A1: Home About Me Excel VB Programming (97-2003) Excel Spreadsheet Formulas Excel VB.NET Programming Access Programming (2000-2003) Material Management Master Scheduling & Production Planning Detailed Capacity Planning Forecasting Methods & Techniques | C1: Detailed Capacity Planning Capacity Requirements Planning (CRP) It is a process of determining short-range capacity requirements. Capacity Requirements Planning is a computerized technique for projecting current and future resource requirements for critical work stations. The functions of CRP are: • To test MPS for feasibility. • To utilize routings to determine labor/machine loads. • If master schedule is feasible, recommends freezing. • If master schedule overloads resources, identify processes that are overscheduled. Capacity planning actually occurs at two times in the assembly environments. First, it is the Rough-Cut Capacity Planning (RCCP) that is done during the preparation of the Master Production Schedule. Purpose of RCCP is to make a rough check on the feasibility of the MPS (against the availability of operating shifts and labor hours, existing availability of equipments) before making any materials planning and final scheduling decisions. It identifies potential bottleneck operations that may disrupt your master schedule. If the master schedule is not feasible at this stage, it should be adjusted. Any serious capacity problems should be relayed back to the aggregate production plan. Once a feasible master schedule is confirmed, we continue with the short-range scheduling of production. The master schedule is exploded through the MRP using bills-of-material, producing a set of recommended planned orders, for in-house production, as well as orders to suppliers for any bought-out material items, and indicate, based on the master schedule and the associated material buy plan, which items should be replenished first and the due dates. It can also include rescheduling of the open orders. In a job shop situation, using the saved routings of the various items, these planned-orders are converted to requirements (for example, in machine and labor hours) at the various work centers. In this way the required capacity for each work center in each time period is determined. As MRP assumes infinite capacity, and in the general approach of infinite loading, capacity constraints are ignored in developing the capacity profile. In finite loading, the master schedule is developed within the capacity constraints at all work centers. Capacity constraints Organizations operate below their maximum available capacity, either because there is insufficient demand to fill the capacity, or it is deliberately done so that the operation can response quickly to every unplanned increase in demand. Often, though, organizations find some parts of their production operating below capacity while other component parts have production at their capacity ceiling. It is the parts of production that are operating at maximum capacity which constitute the capacity constraint for the whole production operation. Alternative long-term capacity strategies would be to add in new production equipments, adding new work shifts, continuous process improvement to reduce cycle times, subcontract out some production volume, or to improve on forecast accuracy with better forecasting methods if actual demand has shown to consistently lag behind forecast. Figure 15.1 below gives a simple illustration of capacity planning. Assuming in a wheel-axle assembly factory, a particular gear sub-assembly production output is the constraint bottleneck. This line runs on 2 eight-hour shift, 5 days/week, that's an available capacity of 80 hours per week. As you can see in Table 15.1 there is a required capacity short on week 1 and week 4, more than the 80 hours/week available capacity can cope with. A straightforward solution is simply to shift some week 4 production backward to week 2 and week 3. This is necessary to maximize the available capacity and resources, so that no overtime is planned on week 4, customer orders promised will be shipped on time, and inventory turnarounds better are will be more balanced over the periods. What happens if this gear sub-assembly has 20 other BOM component parts that assembled into it? You would have to revise the master schedule and re-run MRP. Let's say in week 1, production cannot be shifted earlier. Possible solutions would be: to schedule overtime work in week 1, if safety stock, if any is insufficient to support demand; subcontract out some production volume in week 1; use alternate routing if possible. Revise the master schedule only as a last resort if all options failed, then re-run MRP for follow-on materials planning. You can download the worksheet example here. Balancing capacity planning and demand How do you plan and control on the issues of capacity have significant impact on the other aspects of the whole operation. Below are the facts you may want to take into account: • planning capacity levels in excess of demand means capacity under-utilization, and therefore gives higher units cost of production. • capacity levels higher than demand at any time ensure that demand is satisfied, no revenue lost, but that also mean funding excess inventory cost. • some amount of safety stock that are provided from surplus capacity, would enhance service level in event of demand increase from customers. • planning large increase in capacity levels by hiring new staff, will jeopardize quality of goods in the short-run if training is not adequately done. • the closer you plan required capacity to firm demand curve, the less you will be able to cope with unexpected disruptions and the less dependable of the deliveries of your goods and services to customers. • planning capacity levels with view of cost minimization important especially for price-sensitive customers and competitive markets. Steps to be taken in capacity planning and control Because in reality demand forecast are sometimes unlikely to be constant, planners want to make sure they have enough quantitative data to analyze and to decide on what mix of capacity to meet such demand. Before any capacity decisions are taken, a sequence of planning steps must be followed in the following orders: 1. measure the aggregate demand and capacity levels for the planning period 2. identify the alternative and viable capacity plans which can response well to demand fluctuations 3. choose the most appropriate capacity plan In the next few sections that follow, I will explain on the steps in setting capacity levels over the short and medium terms in aggregate terms. By "aggregate" I mean making overall broad capacity decisions by grouping all the products and services together, and not discriminate between the detail of the individual products and services. This may mean some degree of approximation, especially if the products mix varies significantly. However, the objective is to reconcile, at a general and aggregate level, between overall capacity and demand, to enable decision making on total required and available capacity in work shift hours, labor hours and machine hours. Measuring capacity and demand Sales forecast that comes in as dollars or quantities term need to be translated into same units of capacity (for example, machine hours per month, labor hours per week, quantities of material need, tooling required, space required, etc). If the nature of your products have some festive demand seasonality, or any of your raw materials have supply seasonality, supply problems due to economic crisis that may cause some expected price hike or foreseeable shortages, you may want to make appropriate capacity adjustments and implement measurement on safety stock replenishment and reorder strategies. In reality the line cannot be run continuously at its maximum Design Capacity because of the need for line maintenance, changeover, stoppages, loading, etc. What remains, after such loss times are accounted for, are called the Effective Capacity. The Actual Output of production in most cases, will be lower than the Effective Capacity owing to parts reject rate, machine breakdowns, labor absenteeism, human fatigue, etc The measurement ratio of the actual production output to its design capacity is called Utilization. The ratio of the actual output achieved to effective capacity is called Efficiency. They are expressed as formulas below: Considering this example below in a manufacturing line with the known operating variables, including design capacity, planned and the unplanned lost production down times. You can determine the operation's utilization and efficiency factors based on the above formulas. My worksheet is here. Table 15.2 determining capacity utilization and efficiency factors Alternative capacity plans There are three options that can be considered for coping with the demand fluctuations - Level Capacity plan, Chase-Demand plan, and Match-Demand plan. In practice, there is no one single that might work for all situations but you will have to adopt a mix of plans. Level Capacity Plan In level capacity plan, capacity is set at a uniform level or a constant gradient line throughout the planning horizon, disregarding the fluctuations in forecast demand. This means that with the same number of workers operating the same processes, and with no problem in material supply, it is able to produce the same aggregate output in each period. See the examples in Figure 15.3 where level capacity plan exceeds forecast demand at each of the planning period, and in Figure 15.4 level capacity plan uniformly exceeds forecast demand but will meet shortage towards the end of planning periods. Low capacity utilization can make level capacity plan prohibitively expensive in many manufacturing and after-sales operations, but may be considered as necessary when opportunity costs of individual lost sales are high, or when the new products are at the strategic stage of market penetration. You can set the capacity somewhat below the peak forecast demand level in order to able to reduce some degree of under-utilization. However, in periods when demand is expected to exceed planned level capacity, you could be putting your customer service level at risk. Chase-Demand Plan Chase demand plan is one which attempts to adjust and match capacity close to the varying levels of forecast demand at the each period. This is a more difficult approach than a level capacity plan, as different numbers of workers, more labor hours, more production lost times, and even rescheduling on the different number of equipments may be required in each period. For this reason, this option plan may not look attractive to those manufacturing operations that are capital-intensive and which manufacture standard industry-use, non-perishable products. Also, there are costs that will increase in association with changing capacity levels. For example, costs incurred from borrowing capital, hiring staff, training, insurance, storage, materials obsolescence, pilferage, etc. The benefit of chase demand plan is that it avoids wasteful provision of excess workers and excess working hours that occurs with a level capacity plan, and able to satisfy customer demand throughout the planned period. The various means of adjusting the capacity are: • varying the amount of overtime work used. • transferring staff to work on other work centers when idle time is long. • employing part-time workers. • varying the workforce size - "hire and fire". Of course, there are cost and ethical implications to be considered. • sub-contracting out some capacity volume in the periods of high demand. Manage-Demand Plan This approach of demand management is a medium-term capacity management that attempts to change or influence demand to fit the available capacity. A common example is giving promotion discounts for the products to increase the demand - the marketing gimmick used to stimulate off-peak demand and to constrain peak demand in order to smooth the demand curve. The fact that most operations are required simultaneously to reduce inventory level and costs, and yet to also provide a responsive and customer-oriented approach at all times, a mix plan would be seen as more practical. See an example of the mix plans in Figure 15.5 where instead of having a constant gradient curve, the mix plan shows varying gradient representing the production rate at each different period. Table 15.3 level capacity planning Figure 15.3 level capacity plan that exceeds forecast demand over the entire planning periods Table 15.4 level capacity planning Figure 15.4 level capacity plan that uniformly exceeds forecast demand but will meet shortage towards end of the planning periods Table 15.5 Two option plans of demand capacity planning for comparison Figure 15.5 comparing two alternatives of mixed capacity plans (Download the worksheet and diagram here) Choosing the most appropriate capacity plan Before you adopt your choice of a capacity plan, you must be aware of the consequences, possible risks or potential revenue losses that may occur as a result of your decision of choosing that plan. Figure 15.5 above shows the cumulative graphical representations of the two mix capacity Plan A and Plan B (varying degrees of level capacity planning and chase-demand planning) that are plotted against the cumulative demand forecast line. An example in Table 15.5, capacity plan A despite having higher cost of capacity change than plan B, has lower inventory holding costs. Because the degree of increasing capacity in plan B (105/65=1.62) is smaller than in plan A (105/52=2.02), thus its costs of changing capacity are smaller than that of plan A. The total cost is the sum of the costs of capacity levels change and inventory holding costs. Figure 15.5 shows both capacity plans on a cumulative basis through the 12 month periods. Because plan A has higher peak/normal ratio of 2.02 than 1.62 of plan B, its capacity change costs are also higher. However, because its planned production levels are closer to forecast levels, plan A has lower inventory holding costs throughout each periods. Plan B has much higher total cumulative inventory carrying costs than plan A ($2,983,040 - $982,371 =$2,000,668) because of planned surplus capacity but then it saves $500,000 in capacity change costs comparing to plan A. In terms of total costs, plan A is cheaper than plan B by $1.5 millions ($3,033,040 - $1,532,371) while still meeting demand for all periods, with no issue of working capital being tied down with excess inventory hold. Capacity and Load controls Capacity control is needed to monitor the level of production output, compares it to the planned levels, and make corrective actions if big deviations are observed. Outline below are the various methods of capacity and production load controls that are used to make adjustment to the capacity or load: • Increasing Capacity –Add extra shifts –Schedule overtime or weekends –Add equipment and/or personnel • Increasing Load –Make items normally purchased or subcontracted –Release orders early –Increase lot sizes –Increase the MPS • Reducing Capacity –Eliminate shifts or reduce length of shifts worked –Reassign personnel temporarily between work centers • Reducing Load –Subcontract work to outside suppliers –Reduce lot sizes –Hold work in production control –Reduce the MPS • Redistributing the Load–Use alternate work centers–Use alternate job routings–Adjust operation start dates forward or backward in time–Revise the MPS Functional elements in Capacity Requirements Planning Below section summarizes the important functional elements exist in capacity requirements planning: The Input comprises: - –Planned order releases (after MRP run)–Open orders file–Other important sources - Rework, Excess scrap, Quality problems The Routing file contains: -–Operation identification code –Operation description –Planned work center–Standard setup time–Standard run time per unit –Tooling requirements Lead Times are: -–Staging time (time to pick up materials from store and send to shop floor work center)–Queue time (time waiting before operation begins)–Setup time (time getting ready for operation) –Run time (time performing operation)–Wait time (time waiting after operation ends) –Move time (time physically moving between operations)The Output comprises: -Load Profile for each work centerLoad Schedules that : -Compares actual labor and machine hours against available hours -Offsets schedules between successive stages of production by lead times -Provides feasible MPS and economically loaded work centers -Promotes system operating efficiency Production and Material Controls It is important to point out the need for detailed production and material controls after the same is done for capacity and load controls. There must be daily or weekly feedback mechanism to allow prompt input to system so that production status and inventory records can be updated accurately and timely. Accurate and prompt feedback on deviations from the plan must be provided by the people in the different functions to the planning team - examples of deviations such as changes in customer input (changes in customer orders and demand forecasts), manufacturing problems (machine breakdowns, expected recovery date, quality problems with particular batch, high failure rate, lower yield, etc), vendor problems (material shortages, equipment breakdowns, can't meet promise dates, etc), inventory inaccuracies (pilferage, data entry errors, short-shipment, wrong-shipment, engineering changes) and other perceived problems. Other daily control measurements include the tracking of production yield, equipment utilization, productivity rate, scrap rate, products serialization and traceability, etc. The goal of aggregate capacity planning can be met by altering the demand (forecast and orders), by managing supply through control of production output and inventories, or combination of the two. The Chase Demand and Level Capacity production strategies are at the opposite ends of aggregate capacity planning strategies. Each company has to decide whether to adopt a chase, level, or combination of the two capacity planning strategies The costs of carrying inventory to meet future increase in demand and the cost of changing production capacity input or output rates are the two major costs affecting the management of supply in the aggregate capacity planning decision. Sensitivity analysis should be performed on the aggregate capacity plan to simulate the effects of changes in costs and demand.

A1: Hours/shift: | B1: 8
A2: no. of shifts: | B2: 2
A3: Work days/week: | B3: 5
A4: Gross production rate (qty/hr) | B4: 37
A6: Period: | B6: week1 | C6: week2 | D6: week3 | E6: week4
A7: Demand (in qty) | B7: 3370 | C7: 2150 | D7: 2600 | E7: 3200
A8: Available capacity (hour) | B8: =B1*B2*B3 -> 80 | C8: =B8 -> 80 | D8: =C8 -> 80 | E8: =D8 -> 80 | F8: =D8 -> 
A9: Required capacity (hour) | B9: =ROUND(B7/$B$4,1) -> 91.1 | C9: =ROUND(C7/$B$4,1) -> 58.1 | D9: =ROUND(D7/$B$4,1) -> 70.3 | E9: =ROUND(E7/$B$4,1) -> 86.5 | F9: =ROUND(E7/$B$4,1) -> 
B10: =ROUND(B7/$B$4,1) ->  | C10: =ROUND(C7/$B$4,1) ->  | D10: =ROUND(D7/$B$4,1) ->  | E10: =ROUND(E7/$B$4,1) ->  | F10: =ROUND(E7/$B$4,1) ->  | G10: =ROUND(E7/$B$4,1) -> Figure 15.1 scheduling capacity to meet weekly demand
A11: Table 15.1 scheduling production capacity | F11: =ROUND(E7/$B$4,1) ->  | G11: =ROUND(E7/$B$4,1) -> 

A1: Utilization | B1: = | C1: Actual Output | E1: Efficiency | F1: = | G1: Actual Output
C2: Design Capacity | G2: Effective Capacity

A1: Hours/shift | B1: 8
A2: no. of shifts | B2: 3
A3: Work days/week | B3: 6
A4: Design capacity (qty/minute) | B4: 1
A5: Design capacity (hours/week) | B5: =B1*B2*B3 -> 144
A6: Design capacity (qty/week) | B6: =B4*60*B1*B2*B3 -> 8640
A7: Last week actual output (qty) | B7: 7636
A9: Last week total lost time: | B9: (Minutes) | C9: (Hours)
A10: regular preventive maintenance | B10: 135 | C10: 2.25 | D10: Unavoidable production lost time (planned occurrences)
A11: setup changeover | B11: 90 | C11: 1.5
A12: quality sampling inspection | B12: 162 | C12: 2.7
A13: change shift time | B13: 90 | C13: 1.5
A14: rest time | B14: 270 | C14: 4.5
A15: Sub-Total: | B15: =SUM(B10:B14) -> 747 | C15: =SUM(C10:C14) -> 12.45
A16: Effective Capacity: | B16: =(B5*60)-B15 -> 7893 | C16: =B5-C15 -> 131.55
A17: machine breakdown | B17: 180 | C17: 3 | D17: Avoidable production lost time (unplanned occurrences)
A18: labor shortages | B18: 108 | C18: 1.8
A19: material stockouts | B19: 27 | C19: 0.45
A20: parts failure investigation | B20: 117 | C20: 1.95
A21: waiting for material | B21: 81 | C21: 1.35
A22: Sub-Total: | B22: =SUM(B17:B21) -> 513 | C22: =SUM(C17:C21) -> 8.55
A23: Actual Output: | B23: =(B5*60)-B15-B22 -> 7380 | C23: =B5-C15-C22 -> 123
A25: Utilization =123/144 = | B25: =C23/B5 -> 0.85416666666666674
A26: Efficiency =123/131.6 = | B26: =C23/C16 -> 0.93500570125427596

B1: Per Day | C1: Per Shift | D1: Per Hour | K1: 370.58
A2: Inventory holding cost per unit qty | B2: 6.23 | C2: =B2/3 -> 2.0766666666666667 | D2: =C2/8 -> 0.25958333333333333 | G2: In house production standard cost / unit | K2: 370.58
A3: Target production (qty) | B3: 30 | C3: =B3/3 -> 10 | D3: =C3/8 -> 1.25 | G3: Outsourced production standard cost / unit | K3: 400.45
B5: Jan | C5: Feb | D5: Mar | E5: Apr | F5: May | G5: Jun | H5: Jul | I5: Aug | J5: Sep | K5: Oct | L5: Nov | M5: Dec
A6: Demand (qty) | B6: 400 | C6: 450 | D6: 475 | E6: 430 | F6: 405 | G6: 560 | H6: 670 | I6: 700 | J6: 1020 | K6: 1250 | L6: 850 | M6: 200
A7: Cumulative demand (qty) | B7: =B6 -> 400 | C7: =B7+C6 -> 850 | D7: =C7+D6 -> 1325 | E7: =D7+E6 -> 1755 | F7: =E7+F6 -> 2160 | G7: =F7+G6 -> 2720 | H7: =G7+H6 -> 3390 | I7: =H7+I6 -> 4090 | J7: =I7+J6 -> 5110 | K7: =J7+K6 -> 6360 | L7: =K7+L6 -> 7210 | M7: =L7+M6 -> 7410
A8: Productive days | B8: 20 | C8: 18 | D8: 20.666665999999999 | E8: 21 | F8: 20 | G8: 21 | H8: 20 | I8: 20 | J8: 20.666665999999999 | K8: 23.333333 | L8: 20.666665999999999 | M8: 20
A9: Productive shifts | B9: =B8*3 -> 60 | C9: =C8*3 -> 54 | D9: =D8*3 -> 61.999997999999998 | E9: =E8*3 -> 63 | F9: =F8*3 -> 60 | G9: =G8*3 -> 63 | H9: =H8*3 -> 60 | I9: =I8*3 -> 60 | J9: =J8*3 -> 61.999997999999998 | K9: =K8*3 -> 69.999999000000003 | L9: =L8*3 -> 61.999997999999998 | M9: =M8*3 -> 60
A10: Productive hours | B10: =B8*24 -> 480 | C10: =C8*24 -> 432 | D10: =D8*24 -> 495.99998399999998 | E10: =E8*24 -> 504 | F10: =F8*24 -> 480 | G10: =G8*24 -> 504 | H10: =H8*24 -> 480 | I10: =I8*24 -> 480 | J10: =J8*24 -> 495.99998399999998 | K10: =K8*24 -> 559.99999200000002 | L10: =L8*24 -> 495.99998399999998 | M10: =M8*24 -> 480
A11: Cumulative productive hours | B11: =B10 -> 480 | C11: =B11+C10 -> 912 | D11: =C11+D10 -> 1407.999984 | E11: =D11+E10 -> 1911.999984 | F11: =E11+F10 -> 2391.999984 | G11: =F11+G10 -> 2895.999984 | H11: =G11+H10 -> 3375.999984 | I11: =H11+I10 -> 3855.999984 | J11: =I11+J10 -> 4351.9999680000001 | K11: =J11+K10 -> 4911.9999600000001 | L11: =K11+L10 -> 5407.9999440000001 | M11: =L11+M10 -> 5887.9999440000001
A12: Demand (qty/productive day) | B12: =B6/B8 -> 20.000 | C12: =C6/C8 -> 25.000 | D12: =D6/D8 -> 22.983871709157153 | E12: =E6/E8 -> 20.476190476190474 | F12: =F6/F8 -> 20.250 | G12: =G6/G8 -> 26.666666666666668 | H12: =H6/H8 -> 33.500 | I12: =I6/I8 -> 35.000 | J12: =J6/J8 -> 49.354840301769045 | K12: =K6/K8 -> 53.571429336734703 | L12: =L6/L8 -> 41.129033584807537 | M12: =M6/M8 -> 10.000
A13: Demand (qty/productive shift) | B13: =B6/B9 -> 6.666666666666667 | C13: =C6/C9 -> 8.3333333333333339 | D13: =D6/D9 -> 7.6612905697190508 | E13: =E6/E9 -> 6.8253968253968251 | F13: =F6/F9 -> 6.750 | G13: =G6/G9 -> 8.8888888888888893 | H13: =H6/H9 -> 11.166666666666666 | I13: =I6/I9 -> 11.666666666666666 | J13: =J6/J9 -> 16.451613433923015 | K13: =K6/K9 -> 17.857143112244902 | L13: =L6/L9 -> 13.709677861602513 | M13: =M6/M9 -> 3.3333333333333335
A14: Demand (qty/productive hour) | B14: =B6/B10 -> 0.83333333333333337 | C14: =C6/C10 -> 1.0416666666666667 | D14: =D6/D10 -> 0.95766132121488134 | E14: =E6/E10 -> 0.85317460317460314 | F14: =F6/F10 -> 0.84375 | G14: =G6/G10 -> 1.1111111111111112 | H14: =H6/H10 -> 1.3958333333333333 | I14: =I6/I10 -> 1.4583333333333333 | J14: =J6/J10 -> 2.0564516792403769 | K14: =K6/K10 -> 2.2321428890306128 | L14: =L6/L10 -> 1.7137097327003141 | M14: =M6/M10 -> 0.41666666666666669
A15: Cumulative target in-house production (qty) | B15: =ROUND(SUM($B$8:B8)*$B$3,0) -> 600 | C15: =ROUND(SUM($B$8:C8)*$B$3,0) -> 1140 | D15: =ROUND(SUM($B$8:D8)*$B$3,0) -> 1760 | E15: =ROUND(SUM($B$8:E8)*$B$3,0) -> 2390 | F15: =ROUND(SUM($B$8:F8)*$B$3,0) -> 2990 | G15: =ROUND(SUM($B$8:G8)*$B$3,0) -> 3620 | H15: =ROUND(SUM($B$8:H8)*$B$3,0) -> 4220 | I15: =ROUND(SUM($B$8:I8)*$B$3,0) -> 4820 | J15: =ROUND(SUM($B$8:J8)*$B$3,0) -> 5440 | K15: =ROUND(SUM($B$8:K8)*$B$3,0) -> 6140 | L15: =ROUND(SUM($B$8:L8)*$B$3,0) -> 6760 | M15: =ROUND(SUM($B$8:M8)*$B$3,0) -> 7360
A16: Outsourced production (qty) | B16: 0 | C16: 150 | D16: 120 | E16: 100 | F16: 100 | G16: 0 | H16: 0 | I16: 0 | J16: 0 | K16: 0 | L16: 0 | M16: 0
A17: Cumulative total planned production (qty) | B17: =B15+SUM($B$16:B16) -> 600 | C17: =C15+SUM($B$16:C16) -> 1290 | D17: =D15+SUM($B$16:D16) -> 2030 | E17: =E15+SUM($B$16:E16) -> 2760 | F17: =F15+SUM($B$16:F16) -> 3460 | G17: =G15+SUM($B$16:G16) -> 4090 | H17: =H15+SUM($B$16:H16) -> 4690 | I17: =I15+SUM($B$16:I16) -> 5290 | J17: =J15+SUM($B$16:J16) -> 5910 | K17: =K15+SUM($B$16:K16) -> 6610 | L17: =L15+SUM($B$16:L16) -> 7230 | M17: =M15+SUM($B$16:M16) -> 7830
A18: Ending inventory (qty) | B18: =ROUND(B17-B7,0) -> 200 | C18: =ROUND(C17-C7,0) -> 440 | D18: =ROUND(D17-D7,0) -> 705 | E18: =ROUND(E17-E7,0) -> 1005 | F18: =ROUND(F17-F7,0) -> 1300 | G18: =ROUND(G17-G7,0) -> 1370 | H18: =ROUND(H17-H7,0) -> 1300 | I18: =ROUND(I17-I7,0) -> 1200 | J18: =ROUND(J17-J7,0) -> 800 | K18: =ROUND(K17-K7,0) -> 250 | L18: =ROUND(L17-L7,0) -> 20 | M18: =ROUND(M17-M7,0) -> 420
A19: Average inventory (qty) | B19: =ROUND(B18/2,0) -> 100 | C19: =ROUNDUP(AVERAGE(B18:C18),0) -> 320 | D19: =ROUNDUP(AVERAGE(C18:D18),0) -> 573 | E19: =ROUNDUP(AVERAGE(D18:E18),0) -> 855 | F19: =ROUNDUP(AVERAGE(E18:F18),0) -> 1153 | G19: =ROUNDUP(AVERAGE(F18:G18),0) -> 1335 | H19: =ROUNDUP(AVERAGE(G18:H18),0) -> 1335 | I19: =ROUNDUP(AVERAGE(H18:I18),0) -> 1250 | J19: =ROUNDUP(AVERAGE(I18:J18),0) -> 1000 | K19: =ROUNDUP(AVERAGE(J18:K18),0) -> 525 | L19: =ROUNDUP(AVERAGE(K18:L18),0) -> 135 | M19: =ROUNDUP(AVERAGE(L18:M18),0) -> 220
A20: Inventory holding cost for month ($) | B20: =B19*$B$2*B8 -> 12460 | C20: =C19*$B$2*C8 -> 35884.800000000003 | D20: =D19*$B$2*D8 -> 73775.657620140002 | E20: =E19*$B$2*E8 -> 111859.65 | F20: =F19*$B$2*F8 -> 143663.8 | G20: =G19*$B$2*G8 -> 174658.05 | H20: =H19*$B$2*H8 -> 166341 | I20: =I19*$B$2*I8 -> 155750 | J20: =J19*$B$2*J8 -> 128753.32918 | K20: =K19*$B$2*K8 -> 76317.498909749993 | L20: =L19*$B$2*L8 -> 17381.699439300002 | M20: =M19*$B$2*M8 -> 27412
A21: Inventory surplus/shortage ($) | B21: =B18*$K$1 -> 74116 | C21: =C18*$K$1 -> 163055.2 | D21: =D18*$K$1 -> 261258.9 | E21: =E18*$K$1 -> 372432.9 | F21: =F18*$K$1 -> 481754 | G21: =G18*$K$1 -> 507694.6 | H21: =H18*$K$1 -> 481754 | I21: =I18*$K$1 -> 444696 | J21: =J18*$K$1 -> 296464 | K21: =K18*$K$1 -> 92645 | L21: =L18*$K$1 -> 7411.6 | M21: =M18*$K$1 -> 155643.6
A22: =CONCATENATE("Inventory holding cost for the year: ",TEXT(SUM(B20:M20),"$#,###")) -> Inventory holding cost for the year: $1,124,257

B1: Per Day | C1: Per Shift | D1: Per Hour | K1: 370.58
A2: Inventory holding cost per unit qty: | B2: 6.23 | C2: =B2/3 -> 2.0766666666666667 | D2: =C2/8 -> 0.25958333333333333 | G2: In-house production standard cost / unit: | K2: 370.58
A3: Target production (qty): | B3: 30 | C3: =B3/3 -> 10 | D3: =C3/8 -> 1.25 | G3: Outsourced production standard cost / unit: | K3: 400.45
B5: Jan | C5: Feb | D5: Mar | E5: Apr | F5: May | G5: Jun | H5: Jul | I5: Aug | J5: Sep | K5: Oct | L5: Nov | M5: Dec
A6: Demand (qty) | B6: 400 | C6: 450 | D6: 475 | E6: 430 | F6: 405 | G6: 560 | H6: 670 | I6: 700 | J6: 650 | K6: 1430 | L6: 1250 | M6: 1050
A7: Cumulative demand (qty) | B7: =B6 -> 400 | C7: =B7+C6 -> 850 | D7: =C7+D6 -> 1325 | E7: =D7+E6 -> 1755 | F7: =E7+F6 -> 2160 | G7: =F7+G6 -> 2720 | H7: =G7+H6 -> 3390 | I7: =H7+I6 -> 4090 | J7: =I7+J6 -> 4740 | K7: =J7+K6 -> 6170 | L7: =K7+L6 -> 7420 | M7: =L7+M6 -> 8470
A8: Productive days | B8: 20 | C8: 18 | D8: 20.666665999999999 | E8: 21 | F8: 20 | G8: 21 | H8: 20 | I8: 20 | J8: 20.666665999999999 | K8: 23.333333 | L8: 20.666665999999999 | M8: 20
A9: Productive shifts | B9: =B8*3 -> 60 | C9: =C8*3 -> 54 | D9: =D8*3 -> 61.999997999999998 | E9: =E8*3 -> 63 | F9: =F8*3 -> 60 | G9: =G8*3 -> 63 | H9: =H8*3 -> 60 | I9: =I8*3 -> 60 | J9: =J8*3 -> 61.999997999999998 | K9: =K8*3 -> 69.999999000000003 | L9: =L8*3 -> 61.999997999999998 | M9: =M8*3 -> 60
A10: Productive hours | B10: =B8*24 -> 480 | C10: =C8*24 -> 432 | D10: =D8*24 -> 495.99998399999998 | E10: =E8*24 -> 504 | F10: =F8*24 -> 480 | G10: =G8*24 -> 504 | H10: =H8*24 -> 480 | I10: =I8*24 -> 480 | J10: =J8*24 -> 495.99998399999998 | K10: =K8*24 -> 559.99999200000002 | L10: =L8*24 -> 495.99998399999998 | M10: =M8*24 -> 480
A11: Cumulative productive hours | B11: =B10 -> 480 | C11: =B11+C10 -> 912 | D11: =C11+D10 -> 1407.999984 | E11: =D11+E10 -> 1911.999984 | F11: =E11+F10 -> 2391.999984 | G11: =F11+G10 -> 2895.999984 | H11: =G11+H10 -> 3375.999984 | I11: =H11+I10 -> 3855.999984 | J11: =I11+J10 -> 4351.9999680000001 | K11: =J11+K10 -> 4911.9999600000001 | L11: =K11+L10 -> 5407.9999440000001 | M11: =L11+M10 -> 5887.9999440000001
A12: Demand (qty/productive day) | B12: =B6/B8 -> 20.000 | C12: =C6/C8 -> 25.000 | D12: =D6/D8 -> 22.983871709157153 | E12: =E6/E8 -> 20.476190476190474 | F12: =F6/F8 -> 20.250 | G12: =G6/G8 -> 26.666666666666668 | H12: =H6/H8 -> 33.500 | I12: =I6/I8 -> 35.000 | J12: =J6/J8 -> 31.451613917793999 | K12: =K6/K8 -> 61.285715161224502 | L12: =L6/L8 -> 60.483872918834614 | M12: =M6/M8 -> 52.500
A13: Demand (qty/productive shift) | B13: =B6/B9 -> 6.666666666666667 | C13: =C6/C9 -> 8.3333333333333339 | D13: =D6/D9 -> 7.6612905697190508 | E13: =E6/E9 -> 6.8253968253968251 | F13: =F6/F9 -> 6.750 | G13: =G6/G9 -> 8.8888888888888893 | H13: =H6/H9 -> 11.166666666666666 | I13: =I6/I9 -> 11.666666666666666 | J13: =J6/J9 -> 10.483871305931332 | K13: =K6/K9 -> 20.428571720408165 | L13: =L6/L9 -> 20.161290972944872 | M13: =M6/M9 -> 17.500
A14: Demand (qty/productive hour) | B14: =B6/B10 -> 0.83333333333333337 | C14: =C6/C10 -> 1.0416666666666667 | D14: =D6/D10 -> 0.95766132121488134 | E14: =E6/E10 -> 0.85317460317460314 | F14: =F6/F10 -> 0.84375 | G14: =G6/G10 -> 1.1111111111111112 | H14: =H6/H10 -> 1.3958333333333333 | I14: =I6/I10 -> 1.4583333333333333 | J14: =J6/J10 -> 1.3104839132414166 | K14: =K6/K10 -> 2.5535714650510206 | L14: =L6/L10 -> 2.520161371618109 | M14: =M6/M10 -> 2.1875
A15: Cumulative target in-house production (qty) | B15: =ROUND(SUM($B$8:B8)*$B$3,0) -> 600 | C15: =ROUND(SUM($B$8:C8)*$B$3,0) -> 1140 | D15: =ROUND(SUM($B$8:D8)*$B$3,0) -> 1760 | E15: =ROUND(SUM($B$8:E8)*$B$3,0) -> 2390 | F15: =ROUND(SUM($B$8:F8)*$B$3,0) -> 2990 | G15: =ROUND(SUM($B$8:G8)*$B$3,0) -> 3620 | H15: =ROUND(SUM($B$8:H8)*$B$3,0) -> 4220 | I15: =ROUND(SUM($B$8:I8)*$B$3,0) -> 4820 | J15: =ROUND(SUM($B$8:J8)*$B$3,0) -> 5440 | K15: =ROUND(SUM($B$8:K8)*$B$3,0) -> 6140 | L15: =ROUND(SUM($B$8:L8)*$B$3,0) -> 6760 | M15: =ROUND(SUM($B$8:M8)*$B$3,0) -> 7360
A16: Outsourced production (qty) | B16: 0 | C16: 0 | D16: 0 | E16: 0 | F16: 0 | G16: 0 | H16: 0 | I16: 0 | J16: 0 | K16: 0 | L16: 0 | M16: 0
A17: Cumulative total planned production (qty) | B17: =B16+B15 -> 600 | C17: =C16+C15 -> 1140 | D17: =D16+D15 -> 1760 | E17: =E16+E15 -> 2390 | F17: =F16+F15 -> 2990 | G17: =G16+G15 -> 3620 | H17: =H16+H15 -> 4220 | I17: =I16+I15 -> 4820 | J17: =J16+J15 -> 5440 | K17: =K16+K15 -> 6140 | L17: =L16+L15 -> 6760 | M17: =M16+M15 -> 7360
A18: Ending inventory (qty) | B18: =ROUND(B17-B7,0) -> 200 | C18: =ROUND(C17-C7,0) -> 290 | D18: =ROUND(D17-D7,0) -> 435 | E18: =ROUND(E17-E7,0) -> 635 | F18: =ROUND(F17-F7,0) -> 830 | G18: =ROUND(G17-G7,0) -> 900 | H18: =ROUND(H17-H7,0) -> 830 | I18: =ROUND(I17-I7,0) -> 730 | J18: =ROUND(J17-J7,0) -> 700 | K18: =ROUND(K17-K7,0) -> -30 | L18: =ROUND(L17-L7,0) -> -660 | M18: =ROUND(M17-M7,0) -> -1110
A19: Average inventory (qty) | B19: =ROUND(B18/2,0) -> 100 | C19: =ROUNDUP(AVERAGE(B18:C18),0) -> 245 | D19: =ROUNDUP(AVERAGE(C18:D18),0) -> 363 | E19: =ROUNDUP(AVERAGE(D18:E18),0) -> 535 | F19: =ROUNDUP(AVERAGE(E18:F18),0) -> 733 | G19: =ROUNDUP(AVERAGE(F18:G18),0) -> 865 | H19: =ROUNDUP(AVERAGE(G18:H18),0) -> 865 | I19: =ROUNDUP(AVERAGE(H18:I18),0) -> 780 | J19: =ROUNDUP(AVERAGE(I18:J18),0) -> 715 | K19: =ROUNDUP(AVERAGE(J18:K18),0) -> 335 | L19: =ROUNDUP(AVERAGE(K18:L18),0) -> -345 | M19: =ROUNDUP(AVERAGE(L18:M18),0) -> -885
A20: Inventory holding cost for month ($) | B20: =B19*$B$2*B8 -> 12460 | C20: =C19*$B$2*C8 -> 27474.3 | D20: =D19*$B$2*D8 -> 46737.458492340003 | E20: =E19*$B$2*E8 -> 69994.05 | F20: =F19*$B$2*F8 -> 91331.8 | G20: =G19*$B$2*G8 -> 113167.95 | H20: =H19*$B$2*H8 -> 107779 | I20: =I19*$B$2*I8 -> 97188 | J20: =J19*$B$2*J8 -> 92058.630363700009 | K20: =K19*$B$2*K8 -> 48697.832637650004 | L20: =L19*$B$2*L8 -> -44419.898567100005 | M20: =M19*$B$2*M8 -> -110271
A21: Inventory surplus/shortage ($): | B21: =B18*$K$1 -> 74116 | C21: =C18*$K$1 -> 107468.2 | D21: =D18*$K$1 -> 161202.3 | E21: =E18*$K$1 -> 235318.3 | F21: =F18*$K$1 -> 307581.4 | G21: =G18*$K$1 -> 333522 | H21: =H18*$K$1 -> 307581.4 | I21: =I18*$K$1 -> 270523.4 | J21: =J18*$K$1 -> 259406 | K21: =K18*$K$1 -> -11117.4 | L21: =L18*$K$1 -> -244582.8 | M21: =M18*$K$1 -> -411343.8
A22: =CONCATENATE("Inventory holding cost for the year: ",TEXT(SUM(B20:M20),"$#,###")) -> Inventory holding cost for the year: $552,198

B1: Per Day | C1: Per Shift | D1: Per Hour | L1: 370.58
A2: Inventory holding cost per unit qty: | B2: 6.23 | C2: =B2/3 -> 2.0766666666666667 | D2: =C2/8 -> 0.25958333333333333 | L2: 390.45
A4: PLAN A | B4: Per Day | C4: Per Shift | D4: Per Hour | L4: 550000
A5: Jan - Jun Target production (qty): | B5: 52 | C5: =B5/3 -> 17.333333333333332 | D5: =C5/8 -> 2.1666666666666665 | G5: In-house production standard cost / unit: | L5: 370.58
A6: Jul - Dec Target production (qty): | B6: 105 | C6: =B6/3 -> 35.00 | D6: =C6/8 -> 4.375 | G6: Outsourced production standard cost / unit: | L6: 390.45
L7: 20000
A8: PLAN B | B8: Per Day | C8: Per Shift | D8: Per Hour
A9: Jan - Feb Target production (qty): | B9: 65 | C9: =B9/3 -> 21.666666666666668 | D9: =C9/8 -> 2.7083333333333335 | G9: Plan A cost of capacity change:52/day to 105/day | L9: 550000
A10: Mar - Jul Target production (qty): | B10: 105 | C10: =B10/3 -> 35.00 | D10: =C10/8 -> 4.375 | G10: Plan B cost of capacity change:65/day to 105/day | L10: 30000
A11: Aug - Dec Target production (qty): | B11: 65 | C11: =B11/3 -> 21.666666666666668 | D11: =C11/8 -> 2.7083333333333335 | G11: Plan B cost of capacity chang:105/day to 65/day | L11: 20000
B13: Jan | C13: Feb | D13: Mar | E13: Apr | F13: May | G13: Jun | H13: Jul | I13: Aug | J13: Sep | K13: Oct | L13: Nov | M13: Dec
A14: Demand (qty) | B14: 400 | C14: 640 | D14: 760 | E14: 830 | F14: 1020 | G14: 1500 | H14: 1980 | I14: 2220 | J14: 2660 | K14: 3850 | L14: 4000 | M14: 2450
A15: Cumulative demand (qty) | B15: =B14 -> 400 | C15: =B15+C14 -> 1040 | D15: =C15+D14 -> 1800 | E15: =D15+E14 -> 2630 | F15: =E15+F14 -> 3650 | G15: =F15+G14 -> 5150 | H15: =G15+H14 -> 7130 | I15: =H15+I14 -> 9350 | J15: =I15+J14 -> 12010 | K15: =J15+K14 -> 15860 | L15: =K15+L14 -> 19860 | M15: =L15+M14 -> 22310
A17: CAPACITY PLAN A | B17: Jan | C17: Feb | D17: Mar | E17: Apr | F17: May | G17: Jun | H17: Jul | I17: Aug | J17: Sep | K17: Oct | L17: Nov | M17: Dec
A18: Productive days | B18: 19 | C18: 18 | D18: 17 | E18: 16 | F18: 19 | G18: 20 | H18: 18 | I18: 20.6666667 | J18: 24.666665999999999 | K18: 25.333333 | L18: 27 | M18: 15
A19: Productive shifts | B19: =B18*3 -> 57 | C19: =C18*3 -> 54 | D19: =D18*3 -> 51 | E19: =E18*3 -> 48 | F19: =F18*3 -> 57 | G19: =G18*3 -> 60 | H19: =H18*3 -> 54 | I19: =I18*3 -> 62.000000100000001 | J19: =J18*3 -> 73.999998000000005 | K19: =K18*3 -> 75.999999000000003 | L19: =L18*3 -> 81 | M19: =M18*3 -> 45
A20: Productive hours | B20: =B18*24 -> 456 | C20: =C18*24 -> 432 | D20: =D18*24 -> 408.00 | E20: =E18*24 -> 384 | F20: =F18*24 -> 456 | G20: =G18*24 -> 480 | H20: =H18*24 -> 432 | I20: =I18*24 -> 496.00000080000001 | J20: =J18*24 -> 591.99998400000004 | K20: =K18*24 -> 607.99999200000002 | L20: =L18*24 -> 648.00 | M20: =M18*24 -> 360
A21: Cumulative productive hours | B21: =B20 -> 456 | C21: =B21+C20 -> 888 | D21: =C21+D20 -> 1296 | E21: =D21+E20 -> 1680 | F21: =E21+F20 -> 2136 | G21: =F21+G20 -> 2616 | H21: =G21+H20 -> 3048 | I21: =H21+I20 -> 3544.0000008000002 | J21: =I21+J20 -> 4135.9999848000007 | K21: =J21+K20 -> 4743.9999768000007 | L21: =K21+L20 -> 5391.9999768000007 | M21: =L21+M20 -> 5751.9999768000007
A22: Demand (qty/productive day) | B22: =B14/B18 -> 21.05263157894737 | C22: =C14/C18 -> 35.555555555555557 | D22: =D14/D18 -> 44.705882352941174 | E22: =E14/E18 -> 51.875 | F22: =F14/F18 -> 53.684210526315788 | G22: =G14/G18 -> 75.000 | H22: =H14/H18 -> 110.000 | I22: =I14/I18 -> 107.41935466545266 | J22: =J14/J18 -> 107.83784075237408 | K22: =K14/K18 -> 151.97368621018009 | L22: =L14/L18 -> 148.14814814814815 | M22: =M14/M18 -> 163.33333333333334
A23: Demand (qty/productive shift) | B23: =B14/B19 -> 7.0175438596491224 | C23: =C14/C19 -> 11.851851851851851 | D23: =D14/D19 -> 14.901960784313726 | E23: =E14/E19 -> 17.291666666666668 | F23: =F14/F19 -> 17.894736842105264 | G23: =G14/G19 -> 25.000 | H23: =H14/H19 -> 36.666666666666664 | I23: =I14/I19 -> 35.806451555150886 | J23: =J14/J19 -> 35.945946917458024 | K23: =K14/K19 -> 50.657895403393361 | L23: =L14/L19 -> 49.382716049382715 | M23: =M14/M19 -> 54.444444444444443
A24: Demand (qty/productive hour) | B24: =B14/B20 -> 0.8771929824561403 | C24: =C14/C20 -> 1.4814814814814814 | D24: =D14/D20 -> 1.8627450980392157 | E24: =E14/E20 -> 2.1614583333333335 | F24: =F14/F20 -> 2.236842105263158 | G24: =G14/G20 -> 3.125 | H24: =H14/H20 -> 4.583333333333333 | I24: =I14/I20 -> 4.4758064443938608 | J24: =J14/J20 -> 4.4932433646822529 | K24: =K14/K20 -> 6.3322369254241702 | L24: =L14/L20 -> 6.1728395061728394 | M24: =M14/M20 -> 6.8055555555555554
A25: Cumulative target in-house production | B25: =ROUND(SUM($B$18:B18)*$B$5,0) -> 988 | C25: =ROUND(SUM($B$18:C18)*$B$5,0) -> 1924 | D25: =ROUND(SUM($B$18:D18)*$B$5,0) -> 2808 | E25: =ROUND(SUM($B$18:E18)*$B$5,0) -> 3640 | F25: =ROUND(SUM($B$18:F18)*$B$5,0) -> 4628 | G25: =ROUND(SUM($B$18:G18)*$B$5,0) -> 5668 | H25: =ROUND((SUM($B$18:$G$18)*$B$5+SUM($H$18:H$18)*$B$6),0) -> 7558 | I25: =ROUND((SUM($B$18:$G$18)*$B$5+SUM($H$18:I$18)*$B$6),0) -> 9728 | J25: =ROUND((SUM($B$18:$G$18)*$B$5+SUM($H$18:J$18)*$B$6),0) -> 12318 | K25: =ROUND((SUM($B$18:$G$18)*$B$5+SUM($H$18:K$18)*$B$6),0) -> 14978 | L25: =ROUND((SUM($B$18:$G$18)*$B$5+SUM($H$18:L$18)*$B$6),0) -> 17813 | M25: =ROUND((SUM($B$18:$G$18)*$B$5+SUM($H$18:M$18)*$B$6),0) -> 19388
A26: Outsourced production | B26: 0 | C26: 0 | D26: 0 | E26: 0 | F26: 0 | G26: 0 | H26: 0 | I26: 0 | J26: 400 | K26: 1000 | L26: 1500 | M26: 300
A27: Plan A cumulative planned production | B27: =B25+SUM($B$26:B$26) -> 988 | C27: =C25+SUM($B$26:C$26) -> 1924 | D27: =D25+SUM($B$26:D$26) -> 2808 | E27: =E25+SUM($B$26:E$26) -> 3640 | F27: =F25+SUM($B$26:F$26) -> 4628 | G27: =G25+SUM($B$26:G$26) -> 5668 | H27: =H25+SUM($B$26:H$26) -> 7558 | I27: =I25+SUM($B$26:I$26) -> 9728 | J27: =J25+SUM($B$26:J$26) -> 12718 | K27: =K25+SUM($B$26:K$26) -> 16378 | L27: =L25+SUM($B$26:L$26) -> 20713 | M27: =M25+SUM($B$26:M$26) -> 22588
A28: Ending inventory (qty) | B28: =ROUND(B27-B15,0) -> 588 | C28: =ROUND(C27-C15,0) -> 884 | D28: =ROUND(D27-D15,0) -> 1008 | E28: =ROUND(E27-E15,0) -> 1010 | F28: =ROUND(F27-F15,0) -> 978 | G28: =ROUND(G27-G15,0) -> 518 | H28: =ROUND(H27-H15,0) -> 428 | I28: =ROUND(I27-I15,0) -> 378 | J28: =ROUND(J27-J15,0) -> 708 | K28: =ROUND(K27-K15,0) -> 518 | L28: =ROUND(L27-L15,0) -> 853 | M28: =ROUND(M27-M15,0) -> 278
A29: Average inventory (qty) | B29: =ROUND(B28/2,0) -> 294 | C29: =ROUNDUP(AVERAGE(B28:C28),0) -> 736 | D29: =ROUNDUP(AVERAGE(C28:D28),0) -> 946 | E29: =ROUNDUP(AVERAGE(D28:E28),0) -> 1009 | F29: =ROUNDUP(AVERAGE(E28:F28),0) -> 994 | G29: =ROUNDUP(AVERAGE(F28:G28),0) -> 748 | H29: =ROUNDUP(AVERAGE(G28:H28),0) -> 473 | I29: =ROUNDUP(AVERAGE(H28:I28),0) -> 403 | J29: =ROUNDUP(AVERAGE(I28:J28),0) -> 543 | K29: =ROUNDUP(AVERAGE(J28:K28),0) -> 613 | L29: =ROUNDUP(AVERAGE(K28:L28),0) -> 686 | M29: =ROUNDUP(AVERAGE(L28:M28),0) -> 566
A30: Inventory holding cost for month ($) | B30: =B29*$B$2*B18 -> 34800.78 | C30: =C29*$B$2*C18 -> 82535.039999999994 | D30: =D29*$B$2*D18 -> 100190.86 | E30: =E29*$B$2*E18 -> 100577.12 | F30: =F29*$B$2*F18 -> 117659.78 | G30: =G29*$B$2*G18 -> 93200.8 | H30: =H29*$B$2*H18 -> 53042.22 | I30: =I29*$B$2*I18 -> 51887.593417023003 | J30: =J29*$B$2*J18 -> 83444.617744740011 | K30: =K29*$B$2*K18 -> 96747.745393670004 | L30: =L29*$B$2*L18 -> 115392.06 | M30: =M29*$B$2*M18 -> 52892.7
A31: Cumulative inventory holding cost ($) | B31: =SUM($B$30:B30) -> 34800.78 | C31: =SUM($B$30:C30) -> 117335.82 | D31: =SUM($B$30:D30) -> 217526.68 | E31: =SUM($B$30:E30) -> 318103.8 | F31: =SUM($B$30:F30) -> 435763.58 | G31: =SUM($B$30:G30) -> 528964.38 | H31: =SUM($B$30:H30) -> 582006.6 | I31: =SUM($B$30:I30) -> 633894.19341702305 | J31: =SUM($B$30:J30) -> 717338.81116176303 | K31: =SUM($B$30:K30) -> 814086.55655543308 | L31: =SUM($B$30:L30) -> 929478.61655543314 | M31: =SUM($B$30:M30) -> 982371.31655543309
A32: Inventory surplus/shortage for month ($) | B32: =B28*$L$1 -> 217901.04 | C32: =C28*$L$1 -> 327592.72 | D32: =D28*$L$1 -> 373544.64 | E32: =E28*$L$1 -> 374285.8 | F32: =F28*$L$1 -> 362427.24 | G32: =G28*$L$1 -> 191960.44 | H32: =H28*$L$1 -> 158608.24 | I32: =I28*$L$1 -> 140079.24 | J32: =J28*$L$1 -> 262370.64 | K32: =K28*$L$1 -> 191960.44 | L32: =L28*$L$1 -> 316104.74 | M32: =M28*$L$1 -> 103021.24
A33: =CONCATENATE("Total Cost = Inventory holding cost for the year + Cost of capacity change = ",TEXT(SUM(M31,L4),"$#,###")) -> Total Cost = Inventory holding cost for the year + Cost of capacity change = $1,532,371
A35: CAPACITY PLAN B | B35: Jan | C35: Feb | D35: Mar | E35: Apr | F35: May | G35: Jun | H35: Jul | I35: Aug | J35: Sep | K35: Oct | L35: Nov | M35: Dec
A36: Productive days | B36: 25 | C36: 20 | D36: 13 | E36: 13 | F36: 13 | G36: 13 | H36: 13 | I36: 18 | J36: 19 | K36: 22 | L36: 25 | M36: 20
A37: Productive shifts | B37: =B36*3 -> 75 | C37: =C36*3 -> 60 | D37: =D36*3 -> 39 | E37: =E36*3 -> 39 | F37: =F36*3 -> 39 | G37: =G36*3 -> 39 | H37: =H36*3 -> 39 | I37: =I36*3 -> 54 | J37: =J36*3 -> 57 | K37: =K36*3 -> 66 | L37: =L36*3 -> 75 | M37: =M36*3 -> 60
A38: Productive hours | B38: =B36*24 -> 600 | C38: =C36*24 -> 480 | D38: =D36*24 -> 312.00 | E38: =E36*24 -> 312 | F38: =F36*24 -> 312 | G38: =G36*24 -> 312 | H38: =H36*24 -> 312 | I38: =I36*24 -> 432 | J38: =J36*24 -> 456 | K38: =K36*24 -> 528 | L38: =L36*24 -> 600 | M38: =M36*24 -> 480
A39: Cumulative productive hours | B39: =B38 -> 600 | C39: =B39+C38 -> 1080 | D39: =C39+D38 -> 1392 | E39: =D39+E38 -> 1704 | F39: =E39+F38 -> 2016 | G39: =F39+G38 -> 2328 | H39: =G39+H38 -> 2640 | I39: =H39+I38 -> 3072 | J39: =I39+J38 -> 3528 | K39: =J39+K38 -> 4056 | L39: =K39+L38 -> 4656 | M39: =L39+M38 -> 5136
A40: Demand (qty/productive day) | B40: =B14/B36 -> 16.000 | C40: =C14/C36 -> 32.000 | D40: =D14/D36 -> 58.46153846153846 | E40: =E14/E36 -> 63.846153846153847 | F40: =F14/F36 -> 78.461538461538467 | G40: =G14/G36 -> 115.38461538461539 | H40: =H14/H36 -> 152.30769230769232 | I40: =I14/I36 -> 123.33333333333333 | J40: =J14/J36 -> 140.000 | K40: =K14/K36 -> 175.000 | L40: =L14/L36 -> 160.000 | M40: =M14/M36 -> 122.500
A41: Demand (qty/productive shift) | B41: =B14/B37 -> 5.333333333333333 | C41: =C14/C37 -> 10.666666666666666 | D41: =D14/D37 -> 19.487179487179485 | E41: =E14/E37 -> 21.282051282051281 | F41: =F14/F37 -> 26.153846153846153 | G41: =G14/G37 -> 38.46153846153846 | H41: =H14/H37 -> 50.769230769230766 | I41: =I14/I37 -> 41.111111111111114 | J41: =J14/J37 -> 46.666666666666664 | K41: =K14/K37 -> 58.333333333333336 | L41: =L14/L37 -> 53.333333333333336 | M41: =M14/M37 -> 40.833333333333336
A42: Demand (qty/productive hour) | B42: =B14/B38 -> 0.66666666666666663 | C42: =C14/C38 -> 1.3333333333333333 | D42: =D14/D38 -> 2.4358974358974357 | E42: =E14/E38 -> 2.6602564102564101 | F42: =F14/F38 -> 3.2692307692307692 | G42: =G14/G38 -> 4.8076923076923075 | H42: =H14/H38 -> 6.3461538461538458 | I42: =I14/I38 -> 5.1388888888888893 | J42: =J14/J38 -> 5.833333333333333 | K42: =K14/K38 -> 7.291666666666667 | L42: =L14/L38 -> 6.666666666666667 | M42: =M14/M38 -> 5.104166666666667
A43: Cumulative target in-house production | B43: =ROUND(SUM($B$36:B36)*$B$9,0) -> 1625 | C43: =ROUND(SUM($B$36:C36)*$B$9,0) -> 2925 | D43: =ROUND((SUM($B$36:$C$36)*$B$9+SUM($D$36:D$36)*$B$10),0) -> 4290 | E43: =ROUND((SUM($B$36:$C$36)*$B$9+SUM($D$36:E$36)*$B$10),0) -> 5655 | F43: =ROUND((SUM($B$36:$C$36)*$B$9+SUM($D$36:F$36)*$B$10),0) -> 7020 | G43: =ROUND((SUM($B$36:$C$36)*$B$9+SUM($D$36:G$36)*$B$10),0) -> 8385 | H43: =ROUND((SUM($B$36:$C$36)*$B$9+SUM($D$36:H$36)*$B$10),0) -> 9750 | I43: =ROUND((SUM($B$36:$C$36)*$B$9+SUM($D$36:$H$36)*$B$10+SUM($I$36:I$36)*$B$11),0) -> 10920 | J43: =ROUND((SUM($B$36:$C$36)*$B$9+SUM($D$36:$H$36)*$B$10+SUM($I$36:J$36)*$B$11),0) -> 12155 | K43: =ROUND((SUM($B$36:$C$36)*$B$9+SUM($D$36:$H$36)*$B$10+SUM($I$36:K$36)*$B$11),0) -> 13585 | L43: =ROUND((SUM($B$36:$C$36)*$B$9+SUM($D$36:$H$36)*$B$10+SUM($I$36:L$36)*$B$11),0) -> 15210 | M43: =ROUND((SUM($B$36:$C$36)*$B$9+SUM($D$36:$H$36)*$B$10+SUM($I$36:M$36)*$B$11),0) -> 16510
A44: Outsourced production | B44: 0 | C44: 0 | D44: 0 | E44: 0 | F44: 0 | G44: 0 | H44: 0 | I44: 300 | J44: 1300 | K44: 1700 | L44: 3000 | M44: 0
A45: Plan B cumulative planned production | B45: =B43+SUM($B$44:B$44) -> 1625 | C45: =C43+SUM($B$44:C$44) -> 2925 | D45: =D43+SUM($B$44:D$44) -> 4290 | E45: =E43+SUM($B$44:E$44) -> 5655 | F45: =F43+SUM($B$44:F$44) -> 7020 | G45: =G43+SUM($B$44:G$44) -> 8385 | H45: =H43+SUM($B$44:H$44) -> 9750 | I45: =I43+SUM($B$44:I$44) -> 11220 | J45: =J43+SUM($B$44:J$44) -> 13755 | K45: =K43+SUM($B$44:K$44) -> 16885 | L45: =L43+SUM($B$44:L$44) -> 21510 | M45: =M43+SUM($B$44:M$44) -> 22810
A46: Ending inventory (qty) | B46: =ROUND(B45-B15,0) -> 1225 | C46: =ROUND(C45-C15,0) -> 1885 | D46: =ROUND(D45-D15,0) -> 2490 | E46: =ROUND(E45-E15,0) -> 3025 | F46: =ROUND(F45-F15,0) -> 3370 | G46: =ROUND(G45-G15,0) -> 3235 | H46: =ROUND(H45-H15,0) -> 2620 | I46: =ROUND(I45-I15,0) -> 1870 | J46: =ROUND(J45-J15,0) -> 1745 | K46: =ROUND(K45-K15,0) -> 1025 | L46: =ROUND(L45-L15,0) -> 1650 | M46: =ROUND(M45-M15,0) -> 500
A47: Average inventory (qty) | B47: =ROUND(B46/2,0) -> 613 | C47: =ROUNDUP(AVERAGE(B46:C46),0) -> 1555 | D47: =ROUNDUP(AVERAGE(C46:D46),0) -> 2188 | E47: =ROUNDUP(AVERAGE(D46:E46),0) -> 2758 | F47: =ROUNDUP(AVERAGE(E46:F46),0) -> 3198 | G47: =ROUNDUP(AVERAGE(F46:G46),0) -> 3303 | H47: =ROUNDUP(AVERAGE(G46:H46),0) -> 2928 | I47: =ROUNDUP(AVERAGE(H46:I46),0) -> 2245 | J47: =ROUNDUP(AVERAGE(I46:J46),0) -> 1808 | K47: =ROUNDUP(AVERAGE(J46:K46),0) -> 1385 | L47: =ROUNDUP(AVERAGE(K46:L46),0) -> 1338 | M47: =ROUNDUP(AVERAGE(L46:M46),0) -> 1075
A48: Inventory holding cost for month ($) | B48: =B47*$B$2*B18 -> 72560.81 | C48: =C47*$B$2*C18 -> 174377.7 | D48: =D47*$B$2*D18 -> 231731.08 | E48: =E47*$B$2*E18 -> 274917.44 | F48: =F47*$B$2*F18 -> 378547.26 | G48: =G47*$B$2*G18 -> 411553.8 | H48: =H47*$B$2*H18 -> 328345.92 | I48: =I47*$B$2*I18 -> 289051.23379954504 | J48: =J47*$B$2*J18 -> 277841.37915743998 | K48: =K47*$B$2*K18 -> 218589.93045715001 | L48: =L47*$B$2*L18 -> 225064.98 | M48: =M47*$B$2*M18 -> 100458.75
A49: Cumulative inventory holding cost ($) | B49: =SUM($B$48:B48) -> 72560.81 | C49: =SUM($B$48:C48) -> 246938.51 | D49: =SUM($B$48:D48) -> 478669.59 | E49: =SUM($B$48:E48) -> 753587.03 | F49: =SUM($B$48:F48) -> 1132134.29 | G49: =SUM($B$48:G48) -> 1543688.09 | H49: =SUM($B$48:H48) -> 1872034.01 | I49: =SUM($B$48:I48) -> 2161085.2437995453 | J49: =SUM($B$48:J48) -> 2438926.6229569851 | K49: =SUM($B$48:K48) -> 2657516.5534141352 | L49: =SUM($B$48:L48) -> 2882581.5334141352 | M49: =SUM($B$48:M48) -> 2983040.2834141352
A50: Inventory surplus/shortage for month($) | B50: =B46*$L$1 -> 453960.5 | C50: =C46*$L$1 -> 698543.3 | D50: =D46*$L$1 -> 922744.2 | E50: =E46*$L$1 -> 1121004.5 | F50: =F46*$L$1 -> 1248854.6 | G50: =G46*$L$1 -> 1198826.3 | H50: =H46*$L$1 -> 970919.6 | I50: =I46*$L$1 -> 692984.6 | J50: =J46*$L$1 -> 646662.1 | K50: =K46*$L$1 -> 379844.5 | L50: =L46*$L$1 -> 611457 | M50: =M46*$L$1 -> 185290
A51: =CONCATENATE("Total Cost = Inventory holding cost for the year + Cost of capacity change = ",TEXT(SUM(M49,L5,L6),"$#,###")) -> Total Cost = Inventory holding cost for the year + Cost of capacity change = $3,033,040

B1: This site was created in Feb.2007 by William Tan var s_sid = 279773;var st_dominio = 4; var cimg = 408;var cwi =270;var che =55; var s_sid = 279773;var st_dominio = 4; var cimg = 408;var cwi =270;var che =55;