A1: Home About Me Excel VB Programming (VB6) Excel Spreadsheet Formulas Excel VB.NET Programming Access Programming (2003) Material Management Inventory KPIs, scorecard, dashboard Master Scheduling, Capacity & Production Planning Business Forecasting Methods | C1: Inventory Key Performance Indicators (KPI), scorecard and dashboard You can skip by going straight to the individual resource of KPI : Inventory, Order Fulfillment, Procurement, Outsourcing, Logistics & Transportation, Production, Manufacturing, Supply Chain Managemt There is no comprehensive list of KPIs that can be specific to each type of industry. Caution is needed whenever an organization is identifying its performance measures. Measures drive employee behavior towards achieving the organizational goals. Organizations must understand the basic concepts that differentiate scorecards from dashboards and analytics, and KPIs from other business performance indictors. Balanced Scorecard What exactly is it? Developed by Kaplan & Norton in 1996, there are many definitions to it. Primarily, it is: ■ a strategic planning and management system used to align business activities to the vision and mission statements of an organization. ■ a strategic concept that involves creating a set of measurements from four perspectives - financial goals and performance, customer requirements and success factors, internal business processes and operational excellency, and learning and growth. These four measurement perspectives must be linked, consistent and mutually reinforcing. Some of specific areas of measurements are: Financials - Return On Investment (ROI), Growth Profit Margin, Cashflow, Working Capital, inventories costs, inventory turnovers, Sales, etc. Customer - Customer service level and satisfaction, retention, acquisition, profitability, market share. Internal business process - involves refinement in critical internal processes and value chain in innovation (how well products are designed to meet customer's needs), operations (materials availability, product quality, process efficiency, utilization, cycle time, costs, forecast errors, excess and obsolescence, scraps), and aftersales service (warranty, repairs, and handling defects and product's returns). Learning and Growth - involves in human capital investment (employee retention, training, skills, productivity, morale), systems (critical market information and customer's needs gathered by sales and marketing, that help company to strategize and plan for future product design and as well as other segments of business opportunities), and organizational capabilities (R&D, technologies, market responsiveness, talented managerial depth). Scorecards and dashboards are always used interchangeably, but each brings a different set of capabilities. The sources of the confusion are: ■ Both represent a way to track results. ■ Both use traffic lights, dials, sliders and other visual aids. ■ Both have targets, thresholds and alert messages. ■ Both provide linkage or drill down to other metrics and reports. The difference comes from the context in how they are applied. Scorecards are intended to be strategic. Dashboards are primarily for data visualization; they display what is happening during a time period. Most organizations begin with identifying what they are already measuring and construct a dashboard dial from there. However, dashboards do not communicate why something matters. In contrast, a scorecard does provide the information lacking in dashboards. A scorecard additionally answers questions by providing deeper analysis, drill-down capabilities, traffic light alert messaging, and forecasting for inferences of performance potential to determine motivational targets. Scorecards do not start with the existing data, but rather they begin with identifying what strategic projects to complete and core processes to improve and excel in. The selection and validation of the correct or best KPIs is a constant debate. Here are some guidelines for understanding the differences: ■ Scorecards chart progress toward strategic objectives. A scorecard displays periodic snapshots of performance associated with an organization’s strategic objectives and plans. It measures organizational activity at a summary level against pre-defined targets to see if performance is within acceptable ranges. Its selection of KPIs helps executives communicate strategy to employees and focuses users on the highest priority projects, initiatives, actions and tasks required to execute plans. There are two key distinctions of scorecards: (1) Each KPI must require a predefined target measure; (2) KPIs should be comprised of both project-based KPIs (e.g., milestones, progress percentage of completion) and process-based KPIs (e.g., percent on-time delivery against customer promise dates). ■ Dashboards monitor and measure processes. A dashboard, on the other hand, is operational and reports information typically more frequently than scorecards and usually with measures.2 Each dashboard measure is reported with little regard to its relationship to other dashboard measures. Dashboard measures do not directly reflect the context of strategic objectives. Key Performance Indicators are quantifiable measurements, agreed to beforehand, that reflect the critical success factors of an organization. KPIs are long-term considerations. The definition of what they are and how they are measured do not change often. The goals for a particular Key Performance Indicator may change as the organization's goals change, or as it gets closer to achieving a goal. It is also important to define the Key Performance Indicators and stay with the same definition from year to year. For examples, will sales be recorded for the KPI at list price or at the actual sales price? Do you take inventory value at different periods of the months and sometimes with different costs when calculating inventory turns? Goals Setting Here are some guidelines on how you should go about setting goals. First, make sure you understand exactly what it is your measuring. What drives this measure? What causes failure? Where do you need improvement? Once you can answer these questions, you're in a better position to set your goals. Benchmarking is one other way to set your goals. Also, you should practice SMART goals which are: Specific: Provide enough detail so that there is no question on what is being measured and no question how the metric is calculated. You should be specific as to the measurement, goals and responsible people/department. Measurable: Here is where you use your metric. Make sure you have a reliable system in place that will accurately measure your performance. Attainable: Will the Supply Chain projects you have scheduled for the year produce results that will achieve your goal? The person setting the goal and the person responsible for achieving the goal should agree with the target. If results are un-attainable or unrealistic, they will have a de-motivating effect on your employees. Realistic: Don't plan to do things if you are unlikely to follow through. Better to plan only a few things and be successful rather than many things and be unsuccessful. Your Supply Chain goals should be challenging, but realistic in relation to the improvement projects you have in place. Time frame: Identify when your targeting to hit your goal. Below is a list of the commonly used KPIs and the subset of formulas for managing inventory, measuring inventory productivity, evaluating operational efficiencies, profits and growth. Table 12.1 below shows the several inventory KPI measurements over a period of 12 months. A company I went for an interview told me that his business unit was tied down with too much inventory dollars of more than $64 millions and they were experiencing a poor inventory turnover of less than 6.0 turns compared to 16 turns the supply chain was well-performing a few years ago. I made out a plan to help the supply chain to improve the inventory turnover in a steadily progressive manner from 5.0 turns to 16.0 turns, measuring from May-2008 up to April-2009. Together with the goal of inventory turnovers are also the plan to improve sales forecast accuracy, to lower the cost of goods sold while at the same time ensuring customer service levels are met continually without risk of stockout, to improve target gross profit margin, to reduce DOI (Days of inventory) and overall average inventory dollars cumulative saving. Assuming time is into year 2009 and actual data are available for measuring inventory management performance. A considerable improvement in inventory turnover from 4.2 turns in May-08 to 16.2 turns in Apr-09 equate to a huge reduction in actual inventory of $50,740,000, or in another word, 81.5% of actual inventory dollars cumulative saving. Over the 12 months period it had also freed up $50.7 millions dollars in cash for the other important businesses. In terms of DOI, it also translates into a reduction in the average days of inventory on-hand from 73 days to 22.8 days. Even with a small 0.3 turns improvement from May-08 to July-08 had resulted in a reduction in average days of inventory on-hand from 73 days to 52.1 days, from the initial capital outlay of $64.24 millions in May-07 beginning inventory level. It was able to free up nearly 10 million dollars ($9.93 M) for other business investment over just a 3-months period. It is not enough to re-emphasize the power of maximizing inventory turns as you can see there were also simultaneous improvement efforts made in other areas of inventory control - beginning inventories, net purchases, ending inventories, cost of goods sold, month-over-month inventory $ cumulative saving. With tightened control on purchasing which had reduced excess and surplus purchases, reduced safety stock level, or reduced the min. and max-order-quantities buying for the slow-usage materials, getting suppliers improved in supply lead time, and hence the costs of goods sold were able to reduce steadily over the measuring period. The lower COGS that was maintained with the different planning strategies, coupled with thje steadily increasing growth in sales revenue over the period, together had contributed to the higher gross profit margin from 2% to 36% over the 12 months. For any level and list of inventory items, this inventory scorecard can be applied to different product lines, multi-location warehouses, different material classes and material categories, existing Service Level Agreement programs, and also for manufacturing site that has production plan with built-to-stock model. DOWNLOAD this worksheet example as shown in Table 12.1. The following is an good example of a dashboard that you can use to effectively track, measure, and evaluate the various categories of the inventory against predefined goals on a weekly basis instead of once every month which are normally too late to react to problems and underperforming results. It evaluates the three levels of inventories - accessible inventory, WIP inventory and the restricted inventory. It also includes the planning and purchasing areas of responsibilities which evaluate the many important issues on inventory productivity and operational efficiencies, and the KPIs in the last section including Customers Service Level, Inventory Turns, Gross Profit Margin and so on. When your organization has the monthly goals on inventory turns, gross profit margin and other KPIs, this weekly dashboard will allow you to timely track and evaluate all the underperforming KPIs before it becoming too late to do anything towards the end of the months. Over-shipment value would have to be excluded from the inventory total value because that is the extra stock shipped out without being captured in the computer system. The units of measurement are in multiple of million $, percentage and number. The frequency of evaluating the performance is weekly and monthly for some KPI. The "traffic lights" color-coding symbols are used to measure the weekly performance status. I have developed an Excel VBA macro (generic enough and no hardcode) to automatically color-code the status in the column "Trend" so that managers don't need to waste unnecessary time on putting in the color symbols but they can use their valuable time to go through the misperformance with the various stakeholders. You can easily easily develop an Workbook_SheetBeforeDoubleClick Change Event code so that when you double-click on any of the performance measurement indicator (ie. any cell in second column under header "Measurement"), it will bring out the detailed worksheets where the different process owners had reviewed and based their weekly results on. To include such Analytics macro will save you much time because you can quickly and effectively go through the causes and effects analysis with the respective stakeholders. Ask all the stakeholders to save their analysis files in a single designated shared directory with specified subfolder names. This way it is a lot easier for you simply to assign a Constant to the designated directory path. If you need my help on writing the code for the analytics, you can write to me. Further down below is the syntax for this dashboard. You can DOWNLOAD this dashboard worksheet as shown below which also has the code in VB Module. When declaring your variables for cell values, positions of columns and rows, you want to make sure you are using the correct data types. If you have problem following my code below, you may want to refer my other page on creating If..Then..Else Conditional Statements and Loops Decision. Below I give you a long list of the various Performance Indicators that are commonly used and some are the standard measurements being used across the various industries. You can study them, and decide how your people are going to effectively collect and munching raw data, setting criteria, automate analysis, and implement control plan before you want to include them in your process dashboard in addition to the KPIs I have shown you in table above. I segment them by the various business unit functions - Inventory, Order Fulfillment, Supply Chain, Procurement, Manufacturing, Production, Outsourcing, Shipping. Inventory Inventory is a list for goods and materials, or those goods and materials themselves, held available in stock by a business. Inventory are held in order to manage and hide from the customer the fact that supply delay is longer than delivery delay, and also to ease the effect of imperfections in the manufacturing process that lower production efficiencies if production capacity stands idle for lack of materials. Inventory Service Level Service Level KPI is to measure the level of service performed by Inventory or Stock Control in fulfilling their customer (user) requirement. It is reflected by the percentage of quantity or value fulfilled toward total quantity or value requested (demand) during the period of reporting. Independent Demand Ratio For manufacturers that also supply replacement parts and consumables this metric helps to define the % mix of demand for an item from independent (outside sources) vs dependent (inside sources). The ratio is calculated by dividing the unit usage for customer orders by the total unit usage of the item from all sources (work orders, sales samples, destructive testing, inventory adjustments, etc.). Early Receipts to MRP Date (required date) Early receipts to MRP date - This is a measure on your Planning efficiencies. Some planners or warehouse personnel may request that the material be brought in long before the plant/operators need the parts. Reasons for doing so may be quality, lead time variance, buffer stock etc. Early receipts to MRP produce higher levels of inventory that are not required yet. In a way, this is at the other end of the scale than JIT. Measure: MRP due date vs Receive to Dock (stores) date. Early PO Receipts to PO Due Date Early receipts to PO date - This is a measure on your suppliers and their diligence to supply per the contract date. Early receipts to PO produce unexpected deliveries turning up, congested goods inwards and of course higher that projected inventory levels. Measure: PO due date vs Receive to Dock (stores) date. Inventory Lead Time Lead time is the length of time it takes to obtain inventory from suppliers. Inventory Accuracy Most Advanced Planning Systems calculate net inventory requirements. If the book inventory used as the basis for these calculations has a high error, the net inventory requirements generated will not reflect the true inventory needs. The inventory error should be factored into the safety stock calculation to protect service levels from variance in inventory due to inventory count accuracy. Assertive continuous improvement programs should be in place to support a decrease in inventory count errors. The formula is: (book inventory - counted inventory)/book inventory Average Age of inventory The (average) age of each product in stock. For example, product received in Jan, but remains until Aug. Unit Cost Per Batch Unit Cost per batch = (Cost/Quantity) for each batch Primarily used in FIFO (First In First Out) Method Assumes an inventory of non-unique goods (that is, every one is similar to every other one) Generally preferred inventory valuation method. Assumes inventory is sold in the order that it is stocked, with the oldest goods sold first and the newest goods sold last. Uses the unit cost per batch of acquired/produced goods, and counts the inventory backwards from the newest batch. Inventory Value Inventory Value = Average Unit Cost x Units of Current Inventory Inventory Carrying Cost It is measure by Inventory Carrying Rate X Average Inventory Value. [ See this example ] GMROI (Gross Margin Return on Inventory) GMROI = [(Unit Selling Price of an Item - Unit Cost of an Item) X Annual Demand for the item] / Average Inventory Cost of the product. Note that Unit Inventory Value tells you what it costs you to make the product. The Unit Selling Price - Unit Inventory Value tells you the Margin. Stock Cover Stock cover is the length of time that inventory will last if current usage continues. Obsolescence for Raw Material, WIP, and Finished Goods Inventory Inventory reserves taken due to obsolescence and scrap and includes products exceeding the shelf life, i.e. spoils and is no good for use in its original purpose (do not include reserves taken for Field Service Parts). Field Service Parts Obsolescence Reserves taken due to obsolescence and scrap. Field Service Parts are those inventory kept at location usually outside Manufacturing plant i.e., distribution center or warehouse. Order Fulfillment Fill Rates (Order Fill Rate, Line Item Fill Rate, Unit Item Fill Rate) It calculates the service level between 2 parties and is a measurement of shipping performance expressed as a percentage of the total order. It calculates the amount of order lines shipped on the initial shipment versus the amount of lines ordered, and has to take into consideration the requested delivery date. Order Fill Rate or Service Level It is measured as Orders filled/Orders Requested. The percentage of your deliveries to customer delivered in full (ie. number of orders, lines, or units delivered in full divided by the total number of orders customer requested). For example: 5 lines (=10 units) not delivered in full from one order of 10 lines (=200 units) = 0% Order Service Level. Line-Item Fill Rate Total Line items filled / Total Lines shipped in time per order per period. For example: 5 lines (=10 units) not delivered in full from one order of 10 lines (=200 units) = 50% Line-Fill Service Level. Unit-Item Fill Rate Total Units items filled / Total Units shipped in time per order per period. For example: 5 lines (=10 units) not delivered in full from one order of 10 lines (=200 units) = 95% Unit-Fill Service Level. Lines Late to Promise Lines shipped after promised ship date Lines Late to Schedule Lines shipped after scheduled ship date Order Fulfillment Cycle Time Order Fulfillment Cycle Time is a continuous measurement defined as the amount of time from customer authorization of a sales order to the customer receipt of product. Customer order Promised Cycle Time The anticipated or agreed upon cycle time of a Purchase Order. It is gap between the Purchase Order Creation Date and the Requested Delivery Date. This tells you the cycle time that you should expect (NOT the actual). Number of deliveries with past due goods issue date Number of Deliveries where the Goods Issue date (date it should leave the premises to reach customer on time based on transit time) is equal to or less than today’s date. Perfect Order Measure / Fulfillment The error-free rate of each stage of an order. Error rates are captured at each stage (order entry, picking, delivery, shipped without damage, invoiced correctly) and multiplied together. % of Backorders The number (or percentage) of unfulfilled orders. A backorder is an unfilled customer order, or demand (immediate or past due) against an item whose current stock level is insufficient to satisfy demand. Can also measure Aged Backorders which are backorders in past-due time buckets based on the Requested Delivery Date/Requested Ship Date. Net Booked Order Value Value of booked order lines less the value of booked return lines for the sale of products but not services. Past Due Schedule Lines Number of booked order lines with past due scheduled ship date. Past Due Schedule Value Value of open order lines with past due scheduled ship date. Sell Through % It refers to the percentage of the inventory received from factory or distribution depot that is actually sold to the consumer. Percentage of units sold during a period = units sold / (units sold + on hand inventory). This can also be described as Units sold divided by Beginning Inventory Qty. On-Time Ship Rate What percent of orders where shipped on or before the requested ship date. On time ship rate can be calculated on a line item, SKU, case or value basis. Supply chain Days Inventory Outstanding (DIO) It measures cash investment tied up in inventory that will impact Working Capital. A decrease is an improvement, an increase a deterioration. DIO is closely tie with Inventory Turns metric. DIO is generally good if Inventory Turns numbers are increasing. DIO = Inventory / (Net Sales / 365) Note: Many companies use Cost of Goods Sold instead of Net Sales when calculating DPO and DIO. Days Sales Outstanding (DSO) Sellers want to shorten their cash conversion cycle by measuring DSO. It measures the average number of days that a company takes to collect revenue after a sale has been made. A low DSO number means that it takes a company fewer days to collect its accounts receivable. A high DSO number shows that a company is selling its product to customers on credit and taking longer to collect money. Thus, a decrease in DSO represents an improvement, an increase a deterioration. DSO = Account Receivables / (Net Sales / 365) Days Payable Outstanding (DPO) It measures the total time it takes a business to pay back its creditors. Buyers want to delay payment for as long possible by extending DPO. DPO = Account Payables / (Net Sales / 365) Days Working Capital (DWC) Days of Working Capital (or the overall cash conversion cycle ) is the average number of days a firm takes to convert working capital into sales revenue. The fewer the number of days, the more efficient the use of working capital. Thus, the lower the number of days, the better. DWC = ( Account Receivables + Inventory – Days Payable Outstanding) / (Net Sales / 365) % of time spent picking back orders Number of hours spent on picking back orders as a percentage of working hours. Sales order by FTE This indicator measures the number of customer orders that are processed by full time employees per day. This helps evaluate the workforce cost per order. Scrap value % Scrap value as a percentage of production value. Manufacturing Schedule Adherence Manufacturing Schedule Adherence = (|Scheduled Production - Actual Production|)/Scheduled Production. which is the absolute variance of actual production to scheduled production. When manufacturing over or under produces against plan, either service level or inventory investment is adversely affected. Assertive continuous improvement programs should be in place to decrease the variance. Inventory Accuracy Most Advanced Planning Systems calculate net inventory requirements. If the book inventory used as the basis for these calculations has a high error, the net inventory requirements generated will not reflect the true inventory needs. The inventory error should be factored into the safety stock calculation to protect service levels from variance in inventory due to inventory count accuracy. Assertive continuous improvement programs should be in place to support a decrease in inventory count errors. Formula is: (book inventory - counted inventory)/book inventory Inventory Carrying Costs Inventory Carrying Cost = Inventory Carrying Rate X Average Inventory Value [ see above ] Inventory Carrying Rate This can best be explained by the example below…. 1. Add up your annual Inventory Costs: Example: $800k = Storage, $400k = Handling, $600k = Obsolescence, $800k = Damage, $600k = Administrative, $200k = Loss (pilferage etc), and $3,400k Total 1. Divide the Inventory Costs by the Average Inventory Value: Example: $3,400k / $34,000k = 10% 2. Add up your: 9% = Opportunity Cost of Capital (the return you could reasonably expect if you used the money elsewhere) 4% = Insurance 6% = Taxes 19% 3. Add your percentages: 10% + 19% = 29% Your Inventory Carrying Rate = 29% Direct Product Cost Sum of costs associated with manufacturing a specific product. Direct Labor Cost Sum of costs associated with payment of employees, insurances, taxes, etc. Direct Material Cost Sum of costs associated with acquisition of raw material and support material. Cost of goods sold (COGS) Cost of Goods Sold includes all expenses directly associated with the production of goods or services the company sells (such as material, labor, overhead, and depreciation). Cost of managing processes Periodic costs of managing processes, usually based on the number of FTEs involved in management functions for processes. Total Supply Chain Management Cost Total Supply Chain Management Cost is a discrete measurement defined as the fixed and operational costs associated with the Plan, Source, Make, and Deliver supply chain processes. Time needed to recruit/hire/train additional labor Amount of time required to achieve a certain substantial improvement concerning the number of employees. Missed Deliveries per Million (MPM) Measures supplier on time delivery by part reference ordered using the same logic as the quality measure PPM. Several missed categories are defined such as ; Missing part reference, under-shipped, over-shipped, delivery window missed etc. (Total number of missed deliveries / Total number of part references ordered) x 1,000,000 Delivery Schedule Adherence (DSA) Delivery Schedule adherence (DSA) is a business metric used to calculate the timeliness of deliveries from suppliers. Delivery schedule adherence is calculated by dividing the number of on time deliveries in a period by the total number of deliveries made. The result is then multiplied by 100 and expressed as a percentage. Manufacturing Cycle Time Measured from the Firm Planned Order until the final production is reported. It usually takes into account the original planned production quantity verses the actual production quantity. Inventory Replenishment Cycle Time Measure of the Manufacturing Cycle Time plus the time included to deploy the product to the appropriate distribution center. Cash To Cash Cycle Time The number of days between paying for raw materials and getting paid for the product by the customer. Upside Supply Chain Flexibility Upside Supply Chain Flexibility is a discrete measurement defined as the amount of time it takes a supply chain to respond to an unplanned 20% increase in demand without service or cost penalty. Procurement Procurement refers to the overall process of acquiring a product or service. Depending on the circumstances, it may include some or all of the following: identifying a need, specifying the requirements to fulfill the need, identifying potential suppliers, soliciting bids and proposals, evaluating bids and proposals, awarding contracts or purchase orders, tracking progress and ensuring compliance, taking delivery, inspecting and inventorying the deliverable, and paying the supplier. Procurement spend per procurement employee Average procurement spend per procurement employee (in FTE). % of suppliers that are responsible for 80% of spend Percentage of suppliers that are responsible for 80% of spend on these suppliers. Number of non-conformities during vendor inspection Suppliers defect rate can be calculated by dividing number of defective items by the total number of items purchased (or the number of shipments with defects by the total number of shipments). This KPI measures the quality of purchases made, or in another way, to measure the performance of different vendors. Requisition to item issuance time To measure the delay between the time when a procurement request is initiated and the time when the request is fulfilled (expressed in terms of days). Travel & entertainment costs as % of gross margin Travel and entertainment costs as a percentage of gross margin. % of (preferred) suppliers not used in last 12 months Percentage of (preferred) suppliers not used in last 12 months (or any other given period). % of On-Time Supplier Deliveries. Percentage of procurement requests satisfied by the preferred supplier list. % of Supplier Deliveries in Full (Line-Fill and Unit-Fill) The percentage of your supplier deliveries is delivered in full (ie. number of orders, lines, or units delivered in full divided by the total number of supplier orders.) An example: 5 lines (=10 units) not delivered in full from one order of 10 lines (=200 units) = 0% Order Service Level, 50 % Line-Fill Service Level and 95% Unit-Fill Service Level. Proportion of purchases made from contracts/frameworks Proportion/percentage of purchases made from contracts/frameworks. % of payable invoices without purchase order Percentage of payable invoices that have not been matched to a purchase order. Total negotiated cost reduction savings Total negotiated cost reduction savings during the procurement process within the measurement period. Value of Supplier Idea Implementation Advanced procurement organizations actively solicit ideas from suppliers for cost savings, revenue growth, and the like. They track these ideas and measure the contribution to the organization's bottom line. This KPI measures how well the procurement department leverages the intellect in the supply base. Procurement Cycle Time The average time it takes between requisition submission and purchase order placement is one measure of procurement cycle time. Another type of procurement cycle time that can be measured is the time it takes from the beginning of a sourcing process to the time that a contract is signed. Travel & entertainment costs as % of increased revenue Travel and entertainment costs as a percentage of increased revenue from new orders and sales. To understand whether a business is gaining true value from its investment in travel. % of RFPs that needed to be improved based on supplier responses Percentage of Request for Proposals (RFP) that needed to be improved based on supplier responses. Average number of responses received to RFPs Average number of responses received to Request for Proposals (RFP). Average size of discounts of items Average size of discounts in procurement of items. Outsourcing % Actual vs. Estimated Savings Percentage of actual or realized savings on spend against a negotiated contract vs the estimated spend determined during the sourcing initiative. % of time sheets in need of correction/validation Percentage of time sheets in need of correction and/or validation by submitter. Vendor/client quality calibration variance Vendor/client calibration variance identifies the difference between client and vendor quality scoring, is calculated as (VendorQualityResult - ClientQualityResult) / ClientQualityResult. % of vendor services delivered without agreed service targets Percentage of vendor services delivered without agreed service targets. % of (major) suppliers subject to monitoring Percentage of (major) suppliers subject to monitoring. % of user complaints due to contracted services Percentage of user complaints on contracted services as a percentage of all user complaints. % of invoices disputed Percentage of invoices disputed. Number of formal disputes with suppliers Number of formal disputes with suppliers % of key stakeholders satisfied with suppliers Percentage of key stakeholders satisfied with their suppliers. Logistics & Transportation Freight cost per unit shipped Calculated by dividing total freight costs by number of units shipped per period. Useful in businesses where units of measure are standard (e.g., pounds). Can also be calculated by mode (barge, rail, ocean, truckload, less-than-truckload, small package, air freight, intermodal, etc.) Outbound freight costs as percentage of net sales Calculated by dividing outbound freight costs by net sales. Most accounting systems can separate "freight in" and "freight out." Percentage can vary with sales mix, but is an excellent indicator of the transportation financial performance. Inbound freight costs as percentage of purchases Calculated by dividing inbound freight costs by purchase dollars. It is important to understand the underlying detail. The measurement can vary widely, depending on whether raw materials are purchased on a delivered, prepaid, or collect basis. Transit time Measured by the number of days (or hours) from the time a shipment leaves your facility to the time it arrives at the customer's location. Often measured against a standard transit time quoted by the carrier for each traffic lane. Unless you are integrated into your customers' systems, you will have to rely on freight carriers to report their own performance. This is often an important component of lead time. Transit times can vary substantially, based on freight mode and carrier systems. Claims as % of freight costs Calculated by dividing total loss and damage claims by total freight costs. Generally measured in total and for each carrier. A high number generally indicates packaging problems, or process problems at the carrier. Freight bill accuracy Calculated by dividing the number of error-free freight bills by the total number of freight bills in the period. Errors can include incorrect pricing, incorrect weights, incomplete information, etc. Generally measured in total and for each carrier. Formula is: [number of error-free freight bills] / [total number of freight bills] Accessorials as percent of total freight Calculated by dividing accessorial and surcharges by total freight expenditures for the period. Many freight carriers will charge extra fees for trailer detention/demurrage, re-delivery, fuel increases, and other expenses or extra services. Often, these are extra costs incurred due to inefficient processes. Percent of truckload capacity utilized Generally used for shipments over 10,000 lbs. Calculated by dividing the total pounds shipped by the theoretical maximum. For example, assume your trucks can hold 40,000 lbs. of product. During the prior month, there were 675 shipments totaling 22.95MM lbs. The percentage utilization was 85%. The 15% unused capacity is an opportunity for more efficiency. Mode selection vs. optimal This is calculated by dividing the number of shipments sent via the optimal mode by the total number of shipments for the period. To measure this, each traffic lane must have a designated optimal mode, based on freight costs and customer service requirements. Truck turnaround time This is calculated by measuring the average time elapsed between a truck's arrival at your facility and its departure. This is an indicator of the efficiency of your lot and dock door space, receiving processes, and shipping processes. This also directly affects freight carrier profits on your business. Shipment visibility/traceability percent Calculated by dividing the total number of shipments via carriers with order tracking systems, by the total number of shipments sent during a period. This is an indicator of the relative sophistication of your carrier base, and one measure of the non-price value available from your carrier base. Number of carriers per mode Calculated by counting the total number of freight carriers used in a given period, by mode (ocean, barge, rail, intermodal, truckload, LTL, small package, etc.). This is an indication of your volume leverage and control over the transportation function. On-time pickups Calculated by dividing the number of pick-ups made on-time (by the freight carrier) by the total number of shipments in a period. This is an indication of freight carrier performance, and carriers' affect on your shipping operations and customer service. Fill Rate Calculates the service level between 2 parties, is a measure of shipping performance expressed as a percentage of the total order. It measures the amount of order lines shipped on the initial shipment versus the amount of lines ordered. This measure has to take into consideration the requested delivery date (except if the receiving party does not accept early shipments). On-time delivery - value % On-time value rate: value of order lines shipped on-time / total value of the order. On-time delivery - line count On-time line count: amount of order lines shipped on-time relative to the amount of lines ordered. Internal cycle time Receipt of material to GRN/MRR Efficiency in warehouse operations hinge on quick turn around of activities and ensuring visibility of material tracking by creating Goods receipt note or material receipt report timely in system. Number of deliveries with past due goods issue date Number of Deliveries where the Goods Issue date (date it should leave the premises to reach customer on time based on transit time) is equal to or less than today’s date. % of undamaged goods after shipping/transportation Percentage of undamaged goods after shipping/transportation. Average time of import or export transaction Average time needed to process and complete an import or export transaction. Empty miles Percentage of miles (trips) that carried no inventory/freight. Shrinkage Value The costs associated with breakage, pilferage, and deterioration of inventories. Usually pertains to the loss of material through handling damage, theft, or neglect. Production Scrap value % Scrap value as a percentage of production value. Manufacturing cycle time Measured from the Firm Planned Order until the final production is reported. It usually takes into account the original planned production quantity verses the actual production quantity. Defects Per Million Opportunities (DPMO) DPMO is a Six Sigma calculation used to indicate the amount of defects in a process per one million process opportunities. DPMO = Total Number of Defects / Total Number of Process Opportunities for a Defect) x 1,000,000 Defects Per Opportunities (DPO) DPO = Total Number of Defects / Total Number of Process Opportunities for a Defect Process Yield (%) Formula is: (100 - defects percentage)% Average production costs of items Average production costs of items produced within measurement period. Mean-Time Between Failure (MTBF) The average time between equipment failures over a given period i.e. the average time a device will function before failing. It is the reliability rating indicating the expected failure rate of equipment. It is the reliability rating indicating the expected failure rate of equipment. More is better. Mean Time To Repair (MTTR) Average time (e.g. in hours) between the delivery of an assembly, SKU for Finished Goods out for repair and its resolution. Finished product cycle time Average time associated with finalizing activities, such as: package, stock, etc. Schedule production activities cycle time Average time associated with scheduling the production activities. Manufacturing Utilization Utilization is the measurement ratio of the Actual Production Output to its Design Capacity, that is required to produce one unit of output. In reality the line cannot be run continuously at its maximum Design Capacity because of the need for line maintenance, changeover, stoppages, loading, etc. What remains, after such loss times are accounted for, are called the Effective Capacity. Utilization = Actual Output/Design Capacity Efficiency Efficiency is the ratio of the Actual Production Output achieved to its Effective Capacity. Efficiency = Actual Output/Effective Capacity Equipment quality Equipment quality = Good Pieces / Total Pieces Equipment performance Equipment performance = Ideal Cycle Time / (Operating Time / Total Pieces) or, Equipment performance = (Total Pieces / Operating Time) / Ideal Run Rate Equipment availability Equipment availability = Operating Time / Planned Production Time Overall Equipment Effectiveness (OEE) Overall Equipment Effectiveness (OEE) = Availability x Performance x Quality Availability = Operating Time / Planned Production Time Performance = Ideal Cycle Time / (Operating Time / Total Pieces) or, Performance = (Total Pieces / Operating Time) / Ideal Run Rate Quality = Good Pieces / Total Pieces Manufacturing Schedule Adherence (MSA) Manufacturing Schedule Adherence = (|Scheduled Production - Actual Production|)/Scheduled Production. The absolute variance of actual production to scheduled production. When manufacturing over or under produces against plan, either service level or inventory investment is adversely affected. Assertive continuous improvement programs should be in place to decrease the variance. Manufacturing cycle time Measured from the Firm Planned Order until the final production is reported. It usually takes into account the original planned production quantity verses the actual production quantity. Takt Time In simple words, Takt Time is the pace of production needed to meet customer demand. It is not cycle time. It is the available daily work time, taking into account the shifts worked and making allowances for planned stoppages (for planned maintenance, team briefings, breaks) divided by the anticipated daily sales rate or demand (including spare parts) plus any extras such as test parts and anticipated scrap. Takt Time = Net Available Time per Day / Customer Demand per Day % lost manufacturing capacity Percentage of lost manufacturing capacity due to e.g. technical problems and/or failures. Water used per amount of product manufactured Water (in m3) used per amount (in e.g. tonne) of product manufactured. Rate of rejects Measures the quality and uniformity of the final product. Unit costs of the operations Ratio of actual to projected unit production costs. Go back to the subject for the following source code Sub scorecard_trafficPolicing() Dim i As Long, j As Long, cogs As Long, lastrow As Long, measure As Byte, exec As Byte, freq As Byte, gol As Byte, tren As Byte, lastmth As Byte, lastmth_2 As Byte, lastwk As Byte, Measurement As Long, Execute As String, Frequency As String, Goal As Single, Month As Single, Month_2 As Single, Week As Single, Week_m2 As Single, Week_m3 As Single, Week_m4 As Single, Week_m5 As Single, Trend As String, cell As Range, symbol As String, Week_last3 As Single With ActiveSheet Columns(2).Cells.Find(What:="COGS*", After:=[B1]).Select cogs = ActiveCell.Row lastrow = Cells(65536, 2).End(xlUp).Row lastmth = .Cells(5, .Columns.Count).End(xlToLeft).Column lastmth_2 = Cells(5, lastmth).End(xlToLeft).Column lastwk = .Cells(8, .Columns.Count).End(xlToLeft).Column Rows("6:6").Cells.Find(What:="Measure*", After:=[A6]).Select measure = ActiveCell.Column Rows("6:6").Cells.Find(What:="Exe*", After:=[A6]).Select exec = ActiveCell.Column Rows("6:6").Cells.Find(What:="Freq*", After:=[A6]).Select freq = ActiveCell.Column Rows("6:6").Cells.Find(What:="Goal*", After:=[A6]).Select gol = ActiveCell.Column Rows("6:6").Cells.Find(What:="Trend", After:=[A6]).Select tren = ActiveCell.Column End With ' ' ' measuring to meet Goal or Max threshold (>,< or =) For i = 8 To lastrow Measurement = Cells(i, measure).Row Execute = Cells(i, exec).Value Frequency = Cells(i, freq).Value Goal = Cells(i, gol).Value Trend = Cells(i, tren).Value Month = Cells(i, lastmth).Value Month_2 = Cells(i, lastmth_2).Value Week = Cells(i, lastwk).Value Week_m2 = Cells(i, lastwk).Offset(, -1).Value Week_m3 = Cells(i, lastwk).Offset(, -2).Value Week_m4 = Cells(i, lastwk).Offset(, -3).Value Week_m5 = Cells(i, lastwk).Offset(, -5).Value Week_last3 = Application.Sum(Cells(i, lastwk).Offset(, -2).Resize(, 3)) On Error Resume Next If IsEmpty(Execute) Then Trend = "" ElseIf Execute = "N" And IsEmpty(Week_last3) Then Trend = "" ElseIf Execute <> vbNullString Then If Measurement <= cogs Then If Execute = "Y" And Frequency = "W" Then ' if it is a KPI that has been traking and is weekly update If Week <= Goal Then Trend = ChrW(9786) ElseIf Week > Goal Then If Week > Week_m2 Then Trend = ChrW(9650) ElseIf Week > Week_m2 And Week_m2 > Week_m3 Then Trend = ChrW(9650) ElseIf Week < Week_m2 And Week_m2 > Week_m3 Then Trend = ChrW(9650) ElseIf Week < Week_m2 And Week_m2 < Week_m3 Then Trend = ChrW(9660) ElseIf Week = Week_m2 And Week_m2 < Week_m3 And Week_m3 < Week_m4 Then Trend = ChrW(9660) ElseIf Week = Week_m2 And Week_m2 = Week_m3 And Week_m3 = Week_m4 Then Trend = ChrW(9650) End If ElseIf Week = vbNullString And Week_m2 > Goal Then If Week_m2 > Week_m3 Then Trend = ChrW(9650) ElseIf Week_m2 > Week_m3 And Week_m3 > Week_m4 Then Trend = ChrW(9650) ElseIf Week_m2 < Week_m3 And Week_m3 > Week_m4 Then Trend = ChrW(9650) ElseIf Week_m2 < Week_m3 And Week_m3 < Week_m4 Then Trend = ChrW(9660) ElseIf Week_m2 = Week_m3 And Week_m3 < Week_m4 And Week_m4 < Week_m5 Then Trend = ChrW(9660) End If ElseIf Week = vbNullString And Week_m2 = vbNullString Then Trend = "" End If ElseIf Execute = "Y" And Frequency = "M" Then If Month = vbNullString Then If Month_2 > Goal Then Trend = ChrW(9650) ElseIf Month_2 <= Goal Then Trend = ChrW(9786) End If ElseIf Month <> vbNullString Then If Month > Goal Then Trend = ChrW(9650) ElseIf Month <= Goal Then Trend = ChrW(9786) End If End If ElseIf Execute = "N" And Frequency = "W" Then 'if it's a weekly KPI and not tracked If Not IsEmpty(Week) Then Trend = ChrW(9673) Else: Trend = "" End If ElseIf Execute = "N" And Frequency = "M" Then 'if it is a monthly KPI and not tracked If Month <> vbNullString Then Trend = ChrW(9673) Else: Trend = "" End If End If ElseIf Measurement > cogs Then If Execute = "Y" And Frequency = "W" Then ' if it is a KPI that has been traking and is weekly update If Week >= Goal Then Trend = ChrW(9786) ElseIf Week < Goal Then If Week < Week_m2 Then Trend = ChrW(9650) ElseIf Week < Week_m2 And Week_m2 < Week_m3 Then Trend = ChrW(9650) ElseIf Week > Week_m2 And Week_m2 < Week_m3 Then Trend = ChrW(9650) ElseIf Week > Week_m2 And Week_m2 > Week_m3 Then Trend = ChrW(9650) ElseIf Week = Week_m2 And Week_m2 > Week_m3 And Week_m3 > Week_m4 Then Trend = ChrW(9660) ElseIf Week = Week_m2 And Week_m2 = Week_m3 And Week_m3 = Week_m4 Then Trend = ChrW(9650) End If ElseIf Week = vbNullString And Week_m2 < Goal Then If Week_m2 > Week_m3 Then Trend = ChrW(9650) ElseIf Week_m2 < Week_m3 And Week_m3 < Week_m4 Then Trend = ChrW(9650) ElseIf Week_m2 > Week_m3 And Week_m3 < Week_m4 Then Trend = ChrW(9650) ElseIf Week_m2 > Week_m3 And Week_m3 > Week_m4 Then Trend = ChrW(9660) ElseIf Week_m2 = Week_m3 And Week_m3 > Week_m4 And Week_m4 > Week_m5 Then Trend = ChrW(9660) End If ElseIf Week = vbNullString And Week_m2 = vbNullString Then Trend = "" End If ElseIf Execute = "Y" And Frequency = "M" Then If Month = vbNullString Then If Month_2 < Goal Then Trend = ChrW(9650) ElseIf Month_2 >= Goal Then Trend = ChrW(9786) End If ElseIf Month <> vbNullString Then If Month < Goal Then Trend = ChrW(9650) ElseIf Month >= Goal Then Trend = ChrW(9786) End If End If End If End If Else End If Cells(i, tren).Value = Trend Next i For Each cell In Range("H8:H100") symbol = cell.Value Select Case symbol Case Cells(1, 1) cell.Interior.ColorIndex = 4 'Green Case Cells(2, 1) cell.Interior.ColorIndex = 3 'Red Case Cells(3, 1) cell.Interior.ColorIndex = 6 'Yellow Case Else cell.Interior.ColorIndex = -4142 End Select Next End Sub Next Page >> SAP R/3 Transaction Codes, Tables and Reports

A1: Cost of Goods Sold (COGS) | B1: = | C1: (Beginning Inventory + Net Purchases) - End Inventory
A2: * COGS is an income statement figure which reflects the cost of obtaining raw materials and producing finished goods that are sold to consumers.

A1: Average Inventory | B1: = | C1: Sum of each period's Beginning stock + Sum of each last period's Ending stock
C2: Number of of periods

A1: Inventory Turnover | B1: = | C1: Cost of Goods Sold during the past 12 months
C2: Average Inventory at Cost during the past 12 months
A3: A ratio showing how many times a company's inventory is sold and replaced over a period.

A1: Gross Profit Margin (GM) | B1: = | C1: (Sales Revenue - Cost of Goods Sold)
C2: Sales Revenue
A3: Gross margins reveal how much a company earns taking into consideration the costs that it incurs for producing its products and/or services, and is expressed as a percentage. Gross margin is a good indication of how profitable a company is at the most fundamental level. Companies with higher gross margins will have more money left over to spend on other business operations, such as research and development or marketing.

A1: Gross Margin Return On Investment | B1: = | C1: (GM% x sales turnover) / (1 - markup %)
A3: Gross Margin Return On Inventory | B3: = | C3: [(Unit Selling Price of an Item - Unit Cost of an Item) X Annual Demand for the item] / Average Inventory Cost of the product

A1: Weeks of Inventory (WOI) | B1: = | C1: Ending Inventory Balance
C2: Average weekly sales for a given period of time
A4: Days of Inventory (DOI) | B4: = | C4: Ending Inventory balance
C5: (Average weekly sales for a given period of time) x 7
A7: or alternatively,
A8: Days of Inventory (DOI) | B8: = | C8: COGS/ 365 days (it gives you the number of days of stock on-hand)
A10: Weeks of Inventory (WOI) | B10: = | C10: COGS/ 52 weeks (it gives you the number of weeks of stock on-hand)
A12: Months of Inventory (WOI) | B12: = | C12: WOI/4.33
A13: some call it Inventory Months of Supply
A14: or alternatively, | B14: = | C14: Inventory On Hand / Average Monthly Usage
A16: Sell through % | B16: = | C16: units sold / (units sold + on hand inventory)

A1: Stock Sales Ratio | B1: = | C1: Beginning of month $ Stock / Sales for period

A1: BTP Shrinkage | B1: = | C1: Difference between book and physical inventory

A1: Month | B1: Target Inventory Turns | C1: Actual Inventory Turns | D1: Sales Forecast $ ('000) | E1: Sales Actual $ ('000) | F1: Beginning Inventory $ ('000) | G1: Purchase Receipts $ ('000) | H1: Ending Inventory $ ('000) | I1: COGS $ ('000) | J1: Forecasted Gross Margin % | K1: Actual Gross Margin % | L1: Average Inventory On Hand $ ('000) | M1: Average Inventory Cumulative Savings $ ('000) | N1: Actual Inventory Cumulative Savings $ ('000) | O1: Average Inventory Cumulative % Saving | P1: Actual Inventory Cumulative % Saving | Q1: Average Days of Inventory On Hand | R1: Actual DOI On-Hand
A2: 39576 | B2: 5 | C2: =ROUNDDOWN((I2*12)/H2,1) -> 4.2 | D2: 23500 | E2: 22460 | F2: 64240 | G2: 19940 | H2: 62220 | I2: =(F2+G2)-H2 -> 21960 | J2: =(D2-I2)/D2 -> 6.5531914893617024E-2 | K2: =(E2-I2)/E2 -> 2.2261798753339269E-2 | L2: =(I2*12)/C2 -> 62742.857142857138 | M2: - | N2: - | O2: - | P2: - | Q2: =365/B2 -> 73.0 | R2: 86.904761904761898
A3: 39607 | B3: 6 | C3: =ROUNDDOWN((I3*12)/H3,1) -> 4.3 | D3: 22882 | E3: 21545 | F3: 60937 | G3: 17890 | H3: 57852 | I3: =(F3+G3)-H3 -> 20975 | J3: =(D3-I3)/D3 -> 8.3340617078926663E-2 | K3: =(E3-I3)/E3 -> 2.6456254351357622E-2 | L3: =(I3*12)/C3 -> 58534.883720930236 | M3: =$L$2-L3 -> 4207.9734219269012 | N3: =$H$2-H3 -> 4368 | O3: =M3/$L$2 -> 6.7066971660947883E-2 | P3: =N3/$H$2 -> 7.0202507232401151E-2 | Q3: =365/B3 -> 60.833333333333336 | R3: 84.883720930232556
A4: 39637 | B4: 7 | C4: =ROUNDDOWN((I4*12)/H4,1) -> 4.5 | D4: 22900 | E4: 21960 | F4: 55372 | G4: 16930 | H4: 52285 | I4: =(F4+G4)-H4 -> 20017 | J4: =(D4-I4)/D4 -> 0.12589519650655021 | K4: =(E4-I4)/E4 -> 8.8479052823315113E-2 | L4: =(I4*12)/C4 -> 53378.666666666664 | M4: =$L$2-L4 -> 9364.1904761904734 | N4: =$H$2-H4 -> 9935 | O4: =M4/$L$2 -> 0.14924711596842741 | P4: =N4/$H$2 -> 0.15967534554805529 | Q4: =365/B4 -> 52.142857142857146 | R4: 81.111111111111114
A5: 39668 | B5: 8 | C5: =ROUNDDOWN((I5*12)/H5,1) -> 5.3 | D5: 20874 | E5: 22990 | F5: 53020 | G5: 16580 | H5: 48220 | I5: =(F5+G5)-H5 -> 21380 | J5: =(D5-I5)/D5 -> -2.4240682188368307E-2 | K5: =(E5-I5)/E5 -> 7.0030448020878641E-2 | L5: =(I5*12)/C5 -> 48407.547169811325 | M5: =$L$2-L5 -> 14335.309973045813 | N5: =$H$2-H5 -> 14000 | O5: =M5/$L$2 -> 0.22847716259408174 | P5: =N5/$H$2 -> 0.22500803600128577 | Q5: =365/B5 -> 45.625 | R5: 68.867924528301884
A6: 39699 | B6: 9 | C6: =ROUNDDOWN((I6*12)/H6,1) -> 5.6 | D6: 21325 | E6: 22786 | F6: 50045 | G6: 16230 | H6: 45000 | I6: =(F6+G6)-H6 -> 21275 | J6: =(D6-I6)/D6 -> 2.3446658851113715E-3 | K6: =(E6-I6)/E6 -> 6.6312648117264991E-2 | L6: =(I6*12)/C6 -> 45589.285714285717 | M6: =$L$2-L6 -> 17153.57142857142 | N6: =$H$2-H6 -> 17220 | O6: =M6/$L$2 -> 0.27339480874316929 | P6: =N6/$H$2 -> 0.27675988428158149 | Q6: =365/B6 -> 40.555555555555557 | R6: 65.178571428571431
A7: 39729 | B7: 10 | C7: =ROUNDDOWN((I7*12)/H7,1) -> 6.8 | D7: 21845 | E7: 23980 | F7: 46864 | G7: 15900 | H7: 39934 | I7: =(F7+G7)-H7 -> 22830 | J7: =(D7-I7)/D7 -> -4.5090409704737926E-2 | K7: =(E7-I7)/E7 -> 4.7956630525437867E-2 | L7: =(I7*12)/C7 -> 40288.23529411765 | M7: =$L$2-L7 -> 22454.621848739487 | N7: =$H$2-H7 -> 22286 | O7: =M7/$L$2 -> 0.35788331726133066 | P7: =N7/$H$2 -> 0.35818064930890386 | Q7: =365/B7 -> 36.5 | R7: 53.676470588235297
A8: 39760 | B8: 11 | C8: =ROUNDDOWN((I8*12)/H8,1) -> 7.4 | D8: 22542 | E8: 23800 | F8: 40980 | G8: 15360 | H8: 34680 | I8: =(F8+G8)-H8 -> 21660 | J8: =(D8-I8)/D8 -> 3.9126963002395529E-2 | K8: =(E8-I8)/E8 -> 8.9915966386554622E-2 | L8: =(I8*12)/C8 -> 35124.32432432432 | M8: =$L$2-L8 -> 27618.532818532818 | N8: =$H$2-H8 -> 27540 | O8: =M8/$L$2 -> 0.44018608772707135 | P8: =N8/$H$2 -> 0.44262295081967212 | Q8: =365/B8 -> 33.18181818181818 | R8: 49.324324324324323
A9: 39790 | B9: 12 | C9: =ROUNDDOWN((I9*12)/H9,1) -> 8.4 | D9: 22980 | E9: 23720 | F9: 36076 | G9: 14755 | H9: 29835 | I9: =(F9+G9)-H9 -> 20996 | J9: =(D9-I9)/D9 -> 8.6335944299390774E-2 | K9: =(E9-I9)/E9 -> 0.11483979763912311 | L9: =(I9*12)/C9 -> 29994.285714285714 | M9: =$L$2-L9 -> 32748.571428571424 | N9: =$H$2-H9 -> 32385 | O9: =M9/$L$2 -> 0.52194899817850637 | P9: =N9/$H$2 -> 0.52049180327868849 | Q9: =365/B9 -> 30.416666666666668 | R9: 43.452380952380949
A10: 39821 | B10: 13 | C10: =ROUNDDOWN((I10*12)/H10,1) -> 9.5 | D10: 23230 | E10: 23540 | F10: 30758 | G10: 14040 | H10: 24900 | I10: =(F10+G10)-H10 -> 19898 | J10: =(D10-I10)/D10 -> 0.14343521308652604 | K10: =(E10-I10)/E10 -> 0.15471537807986407 | L10: =(I10*12)/C10 -> 25134.315789473683 | M10: =$L$2-L10 -> 37608.541353383451 | N10: =$H$2-H10 -> 37320 | O10: =M10/$L$2 -> 0.59940753523152135 | P10: =N10/$H$2 -> 0.5998071359691417 | Q10: =365/B10 -> 28.076923076923077 | R10: 38.421052631578945
A11: 39852 | B11: 14 | C11: =ROUNDDOWN((I11*12)/H11,1) -> 12.7 | D11: 23250 | E11: 23765 | F11: 24456 | G11: 13725 | H11: 18529 | I11: =(F11+G11)-H11 -> 19652 | J11: =(D11-I11)/D11 -> 0.15475268817204302 | K11: =(E11-I11)/E11 -> 0.1730696402272249 | L11: =(I11*12)/C11 -> 18568.818897637797 | M11: =$L$2-L11 -> 44174.038245219344 | N11: =$H$2-H11 -> 43691 | O11: =M11/$L$2 -> 0.70404887913600966 | P11: =N11/$H$2 -> 0.70220186435229826 | Q11: =365/B11 -> 26.071428571428573 | R11: 28.740157480314963
A12: 39880 | B12: 15 | C12: =ROUNDDOWN((I12*12)/H12,1) -> 14.1 | D12: 23845 | E12: 24980 | F12: 17489 | G12: 13020 | H12: 14000 | I12: =(F12+G12)-H12 -> 16509 | J12: =(D12-I12)/D12 -> 0.30765359614174881 | K12: =(E12-I12)/E12 -> 0.339111289031225 | L12: =(I12*12)/C12 -> 14050.212765957447 | M12: =$L$2-L12 -> 48692.644376899691 | N12: =$H$2-H12 -> 48220 | O12: =M12/$L$2 -> 0.77606673642599699 | P12: =N12/$H$2 -> 0.77499196399871428 | Q12: =365/B12 -> 24.333333333333332 | R12: 25.886524822695037
A13: 39911 | B13: 16 | C13: =ROUNDDOWN((I13*12)/H13,1) -> 16.2 | D13: 23930 | E13: 24248 | F13: 14950 | G13: 12080 | H13: 11480 | I13: =(F13+G13)-H13 -> 15550 | J13: =(D13-I13)/D13 -> 0.35018804847471791 | K13: =(E13-I13)/E13 -> 0.35870999670075882 | L13: =(I13*12)/C13 -> 11518.518518518518 | M13: =$L$2-L13 -> 51224.338624338619 | N13: =$H$2-H13 -> 50740 | O13: =M13/$L$2 -> 0.81641705457734604 | P13: =N13/$H$2 -> 0.81549341047894564 | Q13: =365/B13 -> 22.8125 | R13: 22.530864197530864
A14: 39911

A1: Figure 12.1 Measuring monthly Inventory Turns
A2: Figure 12.2 Measuring Cost of Goods Sold and Gross Profit Margin
A3: Figure 12.3 Measuring monthly cumulative inventory dollars saving

A1: ☺ | B1: Green - Meet or exceed goal | E1: $m : in million $
A2: ▲ | B2: Red - Controls are not active and/or not meeting goal | E2: W : Weekly measurement
A3: ▼ | B3: Yellow - Controls active, trending to goal for 2 consecutive periods | E3: M : Monthly measurement
A4: ☼ | B4: Informational purposes only | E4: # : number of times
I5: 39479 | M5: 39508
C6: Owner | D6: Execute | E6: Unit | F6: Frequency | G6: Goal or Max | H6: Trend | I6: week 18 | J6: week 19 | K6: week 20 | L6: week 21 | M6: week 22
A7: Inventory Levels | B7: Accessible Inventory :
B8: Unrestricted stock on-hand | C8: william | D8: Y | E8: $m | F8: W | G8: 9.000 | H8: ▲ | I8: 10.634 | J8: 10.641999999999999 | K8: 10.157 | L8: 10.351000000000001
B9: VMI location | C9: william | D9: Y | E9: $m | F9: W | G9: 0.750 | H9: ▼ | I9: 0.85299999999999998 | J9: 0.76800000000000002 | K9: 0.75600000000000001 | L9: 0.75600000000000001
B10: Reserve stock | C10: william | D10: Y | E10: $m | F10: W | G10: 0.200 | H10: ☺ | I10: 0.13400000000000001 | J10: 0.13400000000000001 | K10: 0.16400000000000001 | L10: 0.17799999999999999
B11: Inbound stock in-transit within 30days | C11: william | D11: Y | E11: $m | F11: W | G11: 0.450 | H11: ☺ | I11: 0.56299999999999994 | J11: 0.66300000000000003 | K11: 0.58399999999999996 | L11: 0.42399999999999999
B12: Inbound stock in-transit >30days | C12: william | D12: Y | E12: $m | F12: W | G12: 0.000 | H12: ▼ | I12: 0.24299999999999999 | J12: 0.32600000000000001 | K12: 0.28199999999999997 | L12: 0.16500000000000001
B13: QI checking | C13: william | D13: Y | E13: $m | F13: W | G13: 0.180 | H13: ☺ | I13: 0.216 | J13: 0.216 | K13: 0.185 | L13: 5.2999999999999999E-2
B14: WIP (parts, sub-assembly & finished goods):
B15: Front end | C15: william | D15: N | E15: $m | F15: W
B16: Assembly | C16: william | D16: N | E16: $m | F16: W
B17: Testing | C17: william | D17: N | E17: $m | F17: W
B18: Packaging | C18: william | D18: N | E18: $m | F18: W
B19: Inaccessible Inventory :
B20: QI Rejects/ MRB location | C20: william | D20: Y | E20: $m | F20: W | G20: 0.020 | H20: ▲ | I20: 0.16200000000000001 | J20: 3.6999999999999998E-2 | K20: 3.6999999999999998E-2 | L20: 5.0999999999999997E-2
B21: Obsolete materials | C21: william | D21: Y | E21: $m | F21: W | G21: 0.020 | H21: ▲ | I21: 0.154 | J21: 3.4000000000000002E-2 | K21: 0.980 | L21: 0.780
B22: Rework/repair materials with vendors | C22: william | D22: Y | E22: $m | F22: W | G22: 0.100 | H22: ▲ | I22: 0.13700000000000001 | J22: 0.13700000000000001 | K22: 0.13700000000000001 | L22: 0.13700000000000001
B23: Sales Returns (DOA) | C23: william | D23: Y | E23: $m | F23: W | G23: 0.020 | H23: ☺ | I23: 3.6400000000000002E-2 | J23: 1.6500000000000001E-2 | K23: 1.6500000000000001E-2 | L23: 0.000
B24: Field warranty parts returns | C24: william | D24: Y | E24: $m | F24: W | G24: 0.050 | H24: ☺ | I24: 6.8000000000000005E-2 | J24: 8.3199999999999996E-2 | K24: 0.67200000000000004 | L24: 4.9500000000000002E-2
B25: Over-shipment | C25: william | D25: Y | E25: $m | F25: W | G25: 0.010 | H25: ☺ | I25: 0.23899999999999999 | J25: 0.23899999999999999 | K25: 0.000 | L25: 0.000
B26: Under-shipment | C26: william | D26: Y | E26: $m | F26: W | G26: 0.200 | H26: ▼ | I26: 0.48299999999999998 | J26: 0.48299999999999998 | K26: 0.32700000000000001 | L26: 0.26500000000000001
B27: Inventory level Total: | E27: $m | F27: W | G27: =SUM(G8:G13,G20:G26)-G25 -> 10.99 | I27: =SUM(I8:I13,I20:I26)-I25 -> 13.683400000000002 | J27: =SUM(J8:J13,J20:J26)-J25 -> 13.539700000000003 | K27: =SUM(K8:K13,K20:K26)-K25 -> 14.297499999999999 | L27: =SUM(L8:L13,L20:L26)-L25 -> 13.209500000000002
A29: Purchasing | B29: Excess stock without Safety Stock level & open demand | C29: william | D29: Y | E29: $m | F29: W | G29: 0.000 | H29: ▼ | I29: 0.23599999999999999 | J29: 0.23599999999999999 | K29: 0.1174 | L29: 1.2999999999999999E-3
B30: Surplus stock without open demand | C30: william | D30: Y | E30: $m | F30: W | G30: 0.020 | H30: ☺ | I30: 3.4200000000000001E-2 | J30: 2.87E-2 | K30: 1.9300000000000001E-2 | L30: 1.668E-2
B31: Excess open Purchase Orders - Class A material | C31: william | D31: Y | E31: $m | F31: W | G31: 0.010 | H31: ▲ | I31: 1.9400000000000001E-2 | J31: 2.1760000000000002E-2 | K31: 1.55E-2 | L31: 9.8000000000000004E-2
B32: Excess open Purchase Orders - Class B and below material | C32: william | D32: Y | E32: $m | F32: W | G32: 0.010 | H32: ▼ | I32: 2.5000000000000001E-2 | J32: 1.8499999999999999E-2 | K32: 1.6299999999999999E-2 | L32: 1.2699999999999999E-2
B33: Excess open Purchase Requisitions | C33: william | D33: Y | E33: $m | F33: W | G33: 1.4999999999999999E-2 | H33: ☺ | I33: 3.2599999999999997E-2 | J33: 2.86E-2 | K33: 1.84E-2 | L33: 1.35E-2
B34: Excess inbound in-transit | C34: william | D34: N | E34: $m | F34: W | G34: 0.000 | H34: ☼ | I34: 2.3E-2 | J34: 3.4000000000000002E-2 | K34: 1.6E-2 | L34: 1.1999999999999999E-3
B35: PO (Delivery Priority 01) without firm demand - aging >30 days | C35: william | D35: Y | E35: % | F35: W | G35: 0.02 | H35: ☺ | I35: 4.4999999999999998E-2 | J35: 6.2E-2 | K35: 3.4000000000000002E-2 | L35: 1.7600000000000001E-2
B36: PO (other Delivery Priorities) without firm demand - aging >30 days | C36: william | D36: Y | E36: % | F36: W | G36: 0.04 | H36: ☺ | I36: 0.1326 | J36: 8.2500000000000004E-2 | K36: 7.5200000000000003E-2 | L36: 3.49E-2
B37: Open PO (Delivery Priority 01) with demand, without ETA | C37: william | D37: Y | E37: % | F37: W | G37: 0 | H37: ☺ | I37: 2.47E-2 | J37: 1.0500000000000001E-2 | K37: 7.3000000000000001E-3 | L37: 0
B38: Open PO with >60 days Leadtime aging | C38: william | D38: Y | E38: % | F38: W | G38: 0 | H38: ▼ | I38: 8.3599999999999994E-2 | J38: 8.7400000000000005E-2 | K38: 4.3799999999999999E-2 | L38: 1.03E-2
B39: Open PO with 30-60 days Leadtime aging | C39: william | D39: Y | E39: % | F39: W | G39: 0.05 | H39: ▼ | I39: 0.1046 | J39: 0.13730000000000001 | K39: 7.8200000000000006E-2 | L39: 6.5799999999999997E-2
B40: PO Executed > 7 Days | C40: william | D40: Y | E40: % | F40: W | G40: 0.2 | H40: ▼ | I40: 0.56399999999999995 | J40: 0.437 | K40: 0.32500000000000001 | L40: 0.26200000000000001
B41: Purchase Requisition Backlog >7 Days (less Exceptions) | C41: william | D41: Y | E41: % | F41: W | G41: 0.25 | H41: ▼ | I41: 0.46700000000000003 | J41: 0.53900000000000003 | K41: 0.34599999999999997 | L41: 0.26700000000000002
B42: Top 25 Critical parts stockout | C42: william | D42: Y | E42: % | F42: W | G42: 0 | H42: ▼ | I42: 8.6400000000000005E-2 | J42: 5.4600000000000003E-2 | K42: 3.4299999999999997E-2 | L42: 1.04E-2
B43: Stockout bins for "Super-Fast" category moving materials | C43: william | D43: Y | E43: % | F43: W | G43: 0 | H43: ☺ | I43: 3.3500000000000002E-2 | J43: 2.0400000000000001E-2 | K43: 2.5000000000000001E-3 | L43: 0
B44: Stockout bins for "Fast" category moving materials | C44: william | D44: Y | E44: % | F44: W | G44: 0.02 | H44: ▼ | I44: 5.96E-2 | J44: 3.5400000000000001E-2 | K44: 3.2399999999999998E-2 | L44: 2.18E-2
B45: Stockout bins for "Medium-Fast" category moving materials | C45: william | D45: Y | E45: % | F45: W | G45: 0.04 | H45: ☺ | I45: 5.3600000000000002E-2 | J45: 4.2700000000000002E-2 | K45: 3.15E-2 | L45: 3.49E-2
B46: <0.33 filled bins for "Super-Fast" category moving materials | C46: william | D46: Y | E46: % | F46: W | G46: 0.01 | H46: ☺ | I46: 2.0299999999999999E-2 | J46: 1.4200000000000001E-2 | K46: 1.0319999999999999E-2 | L46: 2.8E-3
B47: <0.33 filled bins for "Fast" category moving materials | C47: william | D47: Y | E47: % | F47: W | G47: 0.04 | H47: ☺ | I47: 7.3599999999999999E-2 | J47: 5.8299999999999998E-2 | K47: 4.6199999999999998E-2 | L47: 3.4799999999999998E-2
B48: <0.33 filled bins for "Medium-Fast" category moving materials | C48: william | D48: Y | E48: % | F48: W | G48: 0.05 | H48: ▼ | I48: 7.6399999999999996E-2 | J48: 7.0300000000000001E-2 | K48: 6.4799999999999996E-2 | L48: 5.3699999999999998E-2
B49: Need-To-Buy $ | C49: william | D49: N | E49: $m | F49: W | G49: 3.000 | H49: ☼ | I49: 3.4580000000000002 | J49: 4.7519999999999998 | K49: 3.7320000000000002 | L49: 3.2040000000000002
B50: Spot Buy / Contract Buy | C50: william | D50: Y | E50: % | F50: M | G50: 0.3 | H50: ☺ | I50: ☺ | J50: 0.23799999999999999 | K50: 0.254 | L50: 0.19639999999999999
B51: Purchase Requisition Backlog >7 Days (Less Exceptions) | C51: william | D51: Y | E51: % | F51: W | G51: 0.2 | H51: ▲ | I51: 0.42499999999999999 | J51: 0.35780000000000001 | K51: 0.36320000000000002 | L51: 0.26869999999999999
B52: Supplier lead time target reduction in days | C52: william | D52: Y | E52: % | F52: M | G52: 5.00 | H52: ▲ | I52: 8.00
B53: Direct material cost reduction from Suppliers | C53: william | D53: N | E53: $m | F53: M | G53: 1.500 | H53: ☼ | I53: 1.2050000000000001
A55: Key Performance Indicators | B55: Book-To-Physical stock discrepancy | C55: william | D55: Y | E55: $m | F55: M | G55: 0.010 | H55: ▲ | I55: 2.4799999999999999E-2
B56: MDWP (Machine down and production stoppage, waiting for part) | C56: william | D56: Y | E56: # | F56: W | G56: 0.000 | H56: ☺ | I56: 1 | J56: 1 | K56: 0 | L56: 0
B57: COGS / Actual Sales Revenue | C57: william | D57: Y | E57: % | F57: W | G57: 0.4 | H57: ▼ | I57: 0.78669999999999995 | J57: 0.6462 | K57: 0.53480000000000005 | L57: 0.45479999999999998
B58: Inventory Turns | C58: william | D58: Y | E58: # | F58: W | G58: 8.00 | H58: ▲ | I58: 3.5670000000000002 | J58: 3.76 | K58: 4.18 | L58: 7.86
B59: Demand Forecast Accuracy | C59: william | D59: Y | E59: % | F59: W | G59: 0.9 | H59: ☺ | I59: 0.875 | J59: 0.8387 | K59: 0.86799999999999999 | L59: 0.90300000000000002
B60: Gross Profit Margin | C60: william | D60: Y | E60: % | F60: W | G60: 0.17 | H60: ☺ | I60: 0.11459999999999999 | J60: 0.1484 | K60: 0.1726 | L60: 0.19570000000000001
B61: Customer Contract Service Level (SL%) | C61: william | D61: Y | E61: % | F61: W | G61: 0.95 | H61: ☺ | I61: 0.92269999999999996 | J61: 0.88419999999999999 | K61: 0.94830000000000003 | L61: 0.97748000000000002
B62: Ship-To-Commit (All External Customer Orders) | C62: william | D62: Y | E62: % | F62: W | G62: 1 | H62: ☺ | I62: 0.96840000000000004 | J62: 0.98780000000000001 | K62: 0.99756 | L62: 1
B63: Priority 01 Orders Delivery Cycle Time (95% within 12 hours) | C63: william | D63: Y | E63: % | F63: W | G63: 0.95 | H63: ☺ | I63: 0.94359999999999999 | J63: 0.93730000000000002 | K63: 0.92649999999999999 | L63: 0.96960000000000002

A1: Measurement

A1: Go To Top

B1: Inventory Carrying Rate - can be explained by the example below. 1. Add up the annual Inventory Costs. Example: $800k = Storage $400k = Handling $600k = Obsolescence $800k = Damage $600k = Administrative $200k = Loss (pilferage etc) $3,400k = Total 2. Divide the Inventory Costs by the Average Inventory Value (assuming $34,000k). Example: $3,400k / $34,000k = 10% 3. Add up other costs. Example: 9% = Opportunity Cost of Capital (the return you could reasonably expect if you used the money elsewhere) 4% = Insurance 6% = Taxes 19% = Total 4. Add up percentages: 10% + 19% = 29% which is your Inventory Carrying Rate 5. Inventory Carrying Cost = Inventory Carrying Rate X Average Inventory Value 29% X $34,000,000 = $9,860,000

A1: Go To Top

A1: Go To Top

A1: Go To Top

A1: Go To Top

A1: Go To Top

A1: Go To Top

A1: Go To Top

A1: Go To Top

A1: Go To Top

B1: This site was created in Feb.2007 contact Tan, William