A1: Home About Me Excel VB Programming (VB6) Excel Spreadsheet Formulas Excel VB.NET Programming Access Programming (2003) Material Management Pareto "80/20" rule Master Scheduling, Capacity & Production Planning Business Forecasting Methods | C1: Materials ABC Coding - by dollars and other category ABC coding enables inventory planning and control parameters to be applied to all the parts base on part cost per unit. These classified codes are based on Pareto's "80/20" Rule (sometimes called ABC Analysis). The underlying principle of Pareto's "80/20" Rule is that 80% of the effect is provided by 20% of the cause as shown in Figure 6.1. "A" parts typically constitute the top 80% of the total inventory value. However, percentages vary for the different companies, as do the number of categories depends on the type of business, costs and usage structure of the inventory. What I mean is that a lower value but a high volume consumption part may be an A-item Class, and another part which has a very high unit cost but with low demand may be categorized as C-item. Usage value is usually calculated based on annualized part value. In Figure 6.2, Pareto Analysis is used to classify inventory groups. Part items are ranked in descending order of usage value, and plotted on a cumulative frequency curve. This analysis reveals find that 10% of items account for 70% of usage value, the next 20% has 15% of value. The final 70% have 15% of value. Typically for Class A with 10% of items contributing to 70% of the usage value, planners should monitor at least once every week because month-end review would be too late to react due to higher risk of stockout and causing a dip in customer service level. Tight control for such Class-A items can have a great impact over the cost of inventory. A reorder cycle system would be desirable to control Class-B stock items (20% of items contributing to 15% of usage value) as well as for Class A stock items. A two-bin or annual demand system could manage the final 70% of Class-C stock items which makes up only 15% of usage value. Pareto analysis points the way to where control efforts are best directed. However, planners must exercise good judgment especially on critical inventory items (in cases where a production equipment was down for a day without the part due to stockout could mean production output loss and loss of sales of hundreds of thousands dollars, or any security matters that Pareto analysis in itself does not reveal. The Pareto Analysis requires items to be listed with their unit costs and average rate of usage (either monthly, quarterly or annualize the monthly usage rate). We then: ▪ calculate use by value ▪ sort the list into items by value descending ▪ calculate % that each item contributes to total value ▪ derive a cumulative % list ▪ evaluate the cumulative list and identify appropriate breakpoints Table 6.1 explains the ABC Codes (based on Classification Code A1,A2,A3,B1,B2...G2,G3) for all the part items and their total ending inventory on-hand dollars. The table in Green displays a rather complex cost classification structure of the part items than you would normally see in a traditional ABC costs classification. In fact providing more classified cost Codes enables a better cost control on inventory - either from the aspects of demand forecasting, order quantity techniques, inventory cost control measures, excess and obsolescence control, and strategic customer service level performance. In Table 6.1, sort the list by "Total Cost" in column D, in descending order. To compute the cumulative percentages in column E, type the following formula in Cell E2 and copy it all the way down to Cell E22. =SUM($D$2:D2)/$D$23 A Pareto Curve in Figure 6.3 is then plotted base on Table 6.1. The analysis shows that 80% of the inventory ending on-hand values comprised of items with part code A1, A2, B3, B1, B2, C1, A3, E2, E3 and E1, in increasing order of cumulative percentages. The Pareto Curve obtained in Figure 6.3 can be used for any problem analysis that you want to evaluate on your inventory, for example, on quarterly inventory reduction measures, usage events frequency analysis, and contractual service level review. In this case, I used the plotted Pareto Curve to evaluate on the Inventory Turnovers. Inventory Turns is the number of times you sell your average investment in inventory each year. To calculate your Inventory Turns, you would need to know your beginning stock on-hand balance, purchase receipts amount for the period, and the ending stock on-hand balance. The formula are: Below is another Inventory Turns formula that you can use based on Net Sales for the period instead of using COGS. However, the previous formula is preferred because in this formula sales are recorded at Market Value, while inventories are recorded at Cost. This formula can not be used to effectively gauge the healthiness of your inventories, but at best, is to measure the industry averages. An interpretation would be that a low ratio means low turnover which implies poor sales, whereas a high ratio implies strong sales. In the followings example, I calculated the Inventory Turns for each Part Code. The target overall inventory turns was 5.0 and the actual inventory turns was 4.7. Looking at the 80% of the total inventory value, the Pareto curve reveals that only stock items of part code Class-C1 and Class-A3 are underachieving (C1 parts turns 4.0 times whereas A3 parts only achieved 1.5 turns). Knowing this, planners should carefully review the inventory level for Class-A3 parts which possibly have forecast and safety stock quantity setting too high than the actual demand. As Class-A3 parts have unit cost in $8,000.01 to $10,000 range, reduce probably one or a few safety stock quantity would improves its turns many times higher. You can Download the example worksheet here with Tables 6.1, Table 6.2 and the plotted charts. Figure 6.5 shows a typical Pareto Analysis on the causes of delivery misses from a poorly performed monthly Customer Service Level. The column on "Lines of Orders Missed" are sorted in descending order before Pareto Cumulative Percents are calculated ( the last column). The Pareto Curve in Figure 6.5 shows the magnitude of the causes of the delivery "Misses", which means deliveries that were done more than 24 hours after the dates of request are considered as customer service level "Misses". Again, this kind of Pareto Curve would gives planners sufficient depth of understanding to take corrective measures to improve the service level for the future periods. [Download worksheet] It is also easy for someone to misuse ABC Codes. ABC codes can be used to establish maximum days supply for ordering logic by setting supply days lead time, says from 30 to 15 days. This seems a simple way to force an increase in inventory turns. However, such action does not consider the increase in freight costs and handling costs associated with twice as many supply deliveries. Suppliers may also not really ready and capable of shipping every 15 days. The action also subject the part to risk of stockout due to miscalculated replenishment lead time and also later to increases safety stock levels. Next Page >> Different Types of Material Classifications

A2: Figure 6.1 Pareto Analysis of "80/20" Rule | B2: Figure 6.2 Pareto Analysis of parts usage value

A1: Goods Available For Sale | B1: = | C1: (Beginning inventory + Purchase Receipts)
A3: Cost of Goods Sold (COGS) | B3: = | C3: (Beginning inventory + Purchase Receipts) - Ending Inventory
A5: The basic inventory turnover calculation is:
A6: Inventory Turns | B6: = | C6: Cost of Goods Sold from stock sale during the past 12 months
C7: Average Inventory Investment Cost during the past 12 months
A9: A few note on this Inventory Turns formula: 1) Average inventory at cost is usually calculated by averaging the ending inventories for the past 12 months. The use of average inventory is primarily to minimize seasonal factors. However, if inventory fluctuates greatly from month to month, or even within months, it may be necessary to calculate the average inventory using weekly or bi-weekly ending inventory values, instead of using 12 months averaging. 2) Inventory turnover is stated as an annual turnover. However, the period being measured does not necessarily have to be a 12 month period. In certain situations, particularly for seasonal items, inventory turn may be measured for a period of a few months, with the result being “annualized” for comparison purposes. 3) Inventory turnover is a measure of inventory productivity, thus the cost of sales made from other than inventory on hand, such as special orders, needs to be excluded from the cost of goods sold. 4) Inventory turn is a dynamic metric. As sales (and thus, cost of goods sold) and inventory levels fluctuate so does inventory turn. It is not enough to measure inventory turn for each year or quarter. At a minimum, in order to properly utilize inventory turn as a tool it is necessary to measure it monthly on a rolling basis.

A1: Cost of Goods Sold (COGS) | B1: = | C1: Sales turnover for the period
C2: Average stock at cost for period

A0: A | B0: B | C0: C | D0: D | E0: E
1: 1 | A1: Part Code | B1: Plant A | C1: Plant B | D1: Total Ending Stock On-Hand $ | E1: Pareto Cum. % | G1: ABC Classification Code - by part unit cost
2: 2 | A2: A1 | B2: 95385.97 | C2: 1717844.19 | D2: =SUM(B2:C2) -> 1813230.16 | E2: =SUM($D$2:D2)/$D$23 -> 0.14076872203691804 | G2: A1 | H2: above $12,000.00
3: 3 | A3: A2 | B3: 22363.3 | C3: 1539928.02 | D3: =SUM(B3:C3) -> 1562291.32 | E3: =SUM($D$2:D3)/$D$23 -> 0.26205600117955585 | G3: A2 | H3: $10,000.01 to $12,000.00
4: 4 | A4: B3 | B4: 92978.78 | C4: 1310509.47 | D4: =SUM(B4:C4) -> 1403488.25 | E4: =SUM($D$2:D4)/$D$23 -> 0.37101472672068109 | G4: A3 | H4: $8,000.01 to $10,000.00
5: 5 | A5: B1 | B5: 16999.98 | C5: 1249959.35 | D5: =SUM(B5:C5) -> 1266959.33 | E5: =SUM($D$2:D5)/$D$23 -> 0.46937413507998715 | G5: B1 | H5: $6,000.01 to $8,000.00
6: 6 | A6: B2 | B6: 76408.52 | C6: 871577.18 | D6: =SUM(B6:C6) -> 947985.7 | E6: =SUM($D$2:D6)/$D$23 -> 0.54297027220704286 | G6: B2 | H6: $4,000.01 to $6,000.00
7: 7 | A7: C1 | B7: 72678.0 | C7: 754837.51 | D7: =SUM(B7:C7) -> 827515.51 | E7: =SUM($D$2:D7)/$D$23 -> 0.60721379924413366 | G7: B3 | H7: $3,000.01 to $4,000.00
8: 8 | A8: A3 | B8: 36065.79 | C8: 782246.08 | D8: =SUM(B8:C8) -> 818311.87 | E8: =SUM($D$2:D8)/$D$23 -> 0.67074280880326242 | G8: C1 | H8: $2,000.01 to $3,000.00
9: 9 | A9: E2 | B9: 239513.72 | C9: 467285.05 | D9: =SUM(B9:C9) -> 706798.77 | E9: =SUM($D$2:D9)/$D$23 -> 0.72561458503169529 | G9: C2 | H9: $1,750.01 to $2,000.00
10: 10 | A10: E3 | B10: 124749.94 | C10: 330936.13 | D10: =SUM(B10:C10) -> 455686.07 | E10: =SUM($D$2:D10)/$D$23 -> 0.7609914208791233 | G10: C3 | H10: $1,500.01 to$1,750.00
11: 11 | A11: E1 | B11: 109922.62 | C11: 343649.72 | D11: =SUM(B11:C11) -> 453572.34 | E11: =SUM($D$2:D11)/$D$23 -> 0.7962041589316905 | G11: D1 | H11: $1,250.01 to $1,500.00
12: 12 | A12: D3 | B12: 42696.06 | C12: 395469.1 | D12: =SUM(B12:C12) -> 438165.16 | E12: =SUM($D$2:D12)/$D$23 -> 0.83022077247307446 | G12: D2 | H12: $1,000.01 to $1,250.00
13: 13 | A13: F1 | B13: 44239.64 | C13: 388007.06 | D13: =SUM(B13:C13) -> 432246.7 | E13: =SUM($D$2:D13)/$D$23 -> 0.86377791094670042 | G13: D3 | H13: $750.01 to $1,000.00
14: 14 | A14: C3 | B14: 138509.11 | C14: 269959.18 | D14: =SUM(B14:C14) -> 408468.29 | E14: =SUM($D$2:D14)/$D$23 -> 0.89548903093816645 | G14: E1 | H14: $500.01 to $750.00
15: 15 | A15: D2 | B15: 75047.83 | C15: 287411.25 | D15: =SUM(B15:C15) -> 362459.08 | E15: =SUM($D$2:D15)/$D$23 -> 0.9236282614715241 | G15: E2 | H15: $250.01 to $500.00
16: 16 | A16: C2 | B16: 5371.49 | C16: 261670.11 | D16: =SUM(B16:C16) -> 267041.6 | E16: =SUM($D$2:D16)/$D$23 -> 0.94435982969267807 | G16: E3 | H16: $100.01 to $250.00
17: 17 | A17: F2 | B17: 156938.28 | C17: 108498.500000001 | D17: =SUM(B17:C17) -> 265436.78000000102 | E17: =SUM($D$2:D17)/$D$23 -> 0.96496680895348774 | G17: F1 | H17: $50.01 to $100.00
18: 18 | A18: F3 | B18: 55339.72 | C18: 172864.18 | D18: =SUM(B18:C18) -> 228203.9 | E18: =SUM($D$2:D18)/$D$23 -> 0.98268324235256643 | G18: F2 | H18: $10.01 to $50.00
19: 19 | A19: D1 | B19: 110996.32 | C19: 41053.99 | D19: =SUM(B19:C19) -> 152050.31 | E19: =SUM($D$2:D19)/$D$23 -> 0.99448755065064665 | G19: F3 | H19: $1.01 to $10.00
20: 20 | A20: G3 | B20: 1708.45 | C20: 25384.67 | D20: =SUM(B20:C20) -> 27093.119999999999 | E20: =SUM($D$2:D20)/$D$23 -> 0.99659090408173712 | G20: G1 | H20: $0.51 to $1.00
21: 21 | A21: G2 | B21: 6344.99 | C21: 16743.77 | D21: =SUM(B21:C21) -> 23088.76 | E21: =SUM($D$2:D21)/$D$23 -> 0.99838338211917332 | G21: G2 | H21: $0.11 to $0.50
22: 22 | A22: G1 | B22: 5792.51 | C22: 15031.01 | D22: =SUM(B22:C22) -> 20823.52 | E22: =SUM($D$2:D22)/$D$23 -> 1 | G22: G3 | H22: $0.01 to $0.10
23: 23 | D23: =SUM(D2:D22) -> 12880916.539999999
24: Table 6.1 ABC Parts Classification Codes and the inventory values

A2: Figure 6.3 Pareto analysis of inventory values base on ABC Classification Code | B2: Figure 6.4 Inventory Turns of all the Material Classes

A1: Part Code | B1: Beginning Inventory $ | C1: Purchase Receipt $ | D1: Ending Inventory $ | E1: Cost of Goods Sold $ | F1: Inventory Turns
A2: B2 | B2: =D2*1.39234234 -> 1319920.6278245379 | C2: =D2*0.21 -> 199076.99699999997 | D2: 947985.7 | E2: =(B2+C2)-D2 -> 571011.92482453794 | F2: =ROUNDDOWN((E2*12)/D2,1) -> 7.2
A3: B1 | B3: =D3*1.3234234 -> 1676723.6241703222 | C3: =D3*0.21 -> 266061.45929999999 | D3: 1266959.33 | E3: =(B3+C3)-D3 -> 675825.75347032212 | F3: =ROUNDDOWN((E3*12)/D3,1) -> 6.4
A4: A1 | B4: =D4*1.2934234 -> 2345274.3185297437 | C4: =D4*0.21 -> 380778.33359999995 | D4: 1813230.16 | E4: =(B4+C4)-D4 -> 912822.4921297438 | F4: =ROUNDDOWN((E4*12)/D4,1) -> 6.0
A5: D2 | B5: =D5*1.2934234 -> 1503551.7756144721 | C5: =D5*0.21 -> 244116.4068 | D5: 1162459.08 | E5: =(B5+C5)-D5 -> 585209.10241447203 | F5: =ROUNDDOWN((E5*12)/D5,1) -> 6.0
A6: E2 | B6: =D6*1.2871234234 -> 1295874.2795173093 | C6: =D6*0.21 -> 211427.74169999998 | D6: 1006798.77 | E6: =(B6+C6)-D6 -> 500503.25121730915 | F6: =ROUNDDOWN((E6*12)/D6,1) -> 5.9
A7: A2 | B7: =D7*1.245411234234 -> 1945695.1610742651 | C7: =D7*0.21 -> 328081.17719999998 | D7: 1562291.32 | E7: =(B7+C7)-D7 -> 711485.01827426511 | F7: =ROUNDDOWN((E7*12)/D7,1) -> 5.4
A8: B3 | B8: =D8*1.2234234 -> 1717060.36667505 | C8: =D8*0.21 -> 294732.53249999997 | D8: 1403488.25 | E8: =(B8+C8)-D8 -> 608304.64917504997 | F8: =ROUNDDOWN((E8*12)/D8,1) -> 5.2
A9: E3 | B9: =D9*1.2234234 -> 1291551.0410920379 | C9: =D9*0.21 -> 221694.0747 | D9: 1055686.07 | E9: =(B9+C9)-D9 -> 457559.04579203785 | F9: =ROUNDDOWN((E9*12)/D9,1) -> 5.2
A10: C1 | B10: =D10*1.1234234 -> 929650.28779693402 | C10: =D10*0.21 -> 173778.25709999999 | D10: 827515.51 | E10: =(B10+C10)-D10 -> 275913.03489693394 | F10: =ROUNDDOWN((E10*12)/D10,1) -> 4.0
A11: E1 | B11: =D11*1.1234234 -> 846580.80034875602 | C11: =D11*0.21 -> 158250.19139999998 | D11: 753572.34 | E11: =(B11+C11)-D11 -> 251258.65174875606 | F11: =ROUNDDOWN((E11*12)/D11,1) -> 4.0
A12: F1 | B12: =D12*1.1234234 -> 710280.73735277995 | C12: =D12*0.21 -> 132771.80699999997 | D12: 632246.7 | E12: =(B12+C12)-D12 -> 210805.84435277991 | F12: =ROUNDDOWN((E12*12)/D12,1) -> 4.0
A13: F3 | B13: =D13*1.1234234 -> 256369.60123126002 | C13: =D13*0.21 -> 47922.818999999996 | D13: 228203.9 | E13: =(B13+C13)-D13 -> 76088.520231260016 | F13: =ROUNDDOWN((E13*12)/D13,1) -> 4.0
A14: G3 | B14: =D14*1.1234234 -> 30437.044987008001 | C14: =D14*0.21 -> 5689.5551999999998 | D14: 27093.119999999999 | E14: =(B14+C14)-D14 -> 9033.4801870080009 | F14: =ROUNDDOWN((E14*12)/D14,1) -> 4.0
A15: G2 | B15: =D15*1.1234234 -> 25938.453260983999 | C15: =D15*0.21 -> 4848.6395999999995 | D15: 23088.76 | E15: =(B15+C15)-D15 -> 7698.3328609839991 | F15: =ROUNDDOWN((E15*12)/D15,1) -> 4.0
A16: G1 | B16: =D16*1.1234234 -> 23393.629638368002 | C16: =D16*0.21 -> 4372.9391999999998 | D16: 20823.52 | E16: =(B16+C16)-D16 -> 6943.0488383680022 | F16: =ROUNDDOWN((E16*12)/D16,1) -> 4.0
A17: D1 | B17: =D17*1.0234234 -> 872008.22523125401 | C17: =D17*0.21 -> 178930.56510000001 | D17: 852050.31 | E17: =(B17+C17)-D17 -> 198888.48033125396 | F17: =ROUNDDOWN((E17*12)/D17,1) -> 2.8
A18: A3 | B18: =D18*0.921234234 -> 753856.90873255755 | C18: =D18*0.21 -> 171845.4927 | D18: 818311.87 | E18: =(B18+C18)-D18 -> 107390.5314325575 | F18: =ROUNDDOWN((E18*12)/D18,1) -> 1.5
A19: D3 | B19: =D19*0.921234234 -> 680023.01573808747 | C19: =D19*0.21 -> 155014.68359999999 | D19: 738165.16 | E19: =(B19+C19)-D19 -> 96872.53933808743 | F19: =ROUNDDOWN((E19*12)/D19,1) -> 1.5
A20: C3 | B20: =D20*0.921234234 -> 560541.81905143987 | C20: =D20*0.21 -> 127778.34090000001 | D20: 608468.29 | E20: =(B20+C20)-D20 -> 79851.869951439789 | F20: =ROUNDDOWN((E20*12)/D20,1) -> 1.5
A21: C2 | B21: =D21*0.921234234 -> 246007.86382213439 | C21: =D21*0.21 -> 56078.73599999999 | D21: 267041.6 | E21: =(B21+C21)-D21 -> 35044.999822134385 | F21: =ROUNDDOWN((E21*12)/D21,1) -> 1.5
A22: F2 | B22: =D22*0.921234234 -> 244529.44869872747 | C22: =D22*0.21 -> 55741.723800000211 | D22: 265436.78000000102 | E22: =(B22+C22)-D22 -> 34834.392498726666 | F22: =ROUNDDOWN((E22*12)/D22,1) -> 1.5
B23: =SUM(B2:B22) -> 19275269.030388031 | C23: =SUM(C2:C22) -> 3418992.4734 | D23: =SUM(D2:D22) -> 16280916.540000001 | E23: =SUM(E2:E22) -> 6413344.9637880288
D25: Target Turns: | F25: =5 -> 5.0
D26: Average Actual Turns: | F26: =ROUNDDOWN((E23*12)/D23,1) -> 4.7
A28: Table 6.2 Calculation of Inventory Turns

B0: Figure 6.5
B1: Customer Service Level (Non-Hits with delivery after 24 hours)
A2: Causes of Miss: | B2: Lines of orders requested | C2: Lines of orders Hit | D2: Service Level Percent | E2: Lines of orders Missed | F2: Pareto Cumulative Missed %
A3: Ordered more than forecasted usage | B3: 113 | C3: 72 | D3: =C3/B3 -> 0.63716814159292035 | E3: =B3-C3 -> 41 | F3: 0.32539682539682541
A4: Stockout due to insufficient safety stock | B4: 79 | C4: 46 | D4: =C4/B4 -> 0.58227848101265822 | E4: =B4-C4 -> 33 | F4: 0.58730158730158732
A5: 1st-time purchase in the last 12 months | B5: 128 | C5: 97 | D5: =C5/B5 -> 0.7578125 | E5: =B5-C5 -> 31 | F5: 0.83333333333333337
A6: Stockout due to purchase orders released late | B6: 83 | C6: 71 | D6: =C6/B6 -> 0.85542168674698793 | E6: =B6-C6 -> 12 | F6: 0.9285714285714286
A7: Suppliers problems | B7: 34 | C7: 25 | D7: =C7/B7 -> 0.73529411764705888 | E7: =B7-C7 -> 9 | F7: 1