A1: Home About Me Excel VB Programming (VB6) Excel Spreadsheet Formulas Excel VB.NET Programming Access Programming (2003) Material Management More on Safety Stock Master Scheduling, Capacity & Production Planning Business Forecasting Methods | C1: Safety Stock Planning The main reason of keeping safety stock is to buffer against random fluctuations in demand. Other reasons are because of the unreliability of supply and long transportation lead time. With improvements in product quality, supplier's lead time and logistics infrastructure, the last two factors can become relatively insignificant. Uncertainty in customer's demand can be dealt with using forecasting techniques. The random variations in demand usually follow a 'normal' or Gaussian distribution which is the idealized distribution for a very large number of periods of demand. Statistical safety stock can be calculated using 'normal' distribution. Such is a statistical technique which planners often question its validity, comparing it to the practicality of their work experience, but it can be quite helpful for management in terms of deciding the safety stock investment level. Customer service levels Safety stock level has a direct impact on customer service level. There are two types of Customer Service you can use - one with regards to safety stock and another with regards to order fulfillment. Safety stock customer service level refers to the percentage of the numbers of orders received without a stock-out compared to the total exposures to stock-out. Some companies call it "Target safety stock fill-rate" which they report on a weekly or monthly basis. For example, customer placed a total quantity of 10 orders at different times for the month, and there was one incident of stock-out bin on the date required delivery should be sent, the safety stock customer service level therefore will be [(10-1)/10] which is 90%. Demand fulfillment customer service level refers to the percentage of demands filled within an agreed time frame based on customer's total required quantity and required date. In another word, it is the number of satisfied demands divided by the total number of demands. It can be measured in the form of either by item quantities or by the number of line items, and within 12 hours, 24 hours, 48 hours or whatever, depends on the agreement that you have reached with the customer. [see this example]. Do you really need a safety stock? Some managers like to think that the inventory that are not issued in periods when demand is less than forecast, can be used to "offset" demand during periods when actual demand is higher than the forecast. Thus they think that on average safety stock is not intended to be used. For every part which dips into safety stock level due to under-forecast, they argue that there is also a part which does not consume its forecasted quantity. They want to save on safety stock investment and explain any potential service level dip to customers by pointing it to forecast inaccuracy. However, such is a mistaken belief that company does not need any safe stock because high and low demand periods only net to the forecast over a long period of time as is with normal distribution assumption, and also variability averages out only when the forecast tracks actual demand fairly closely. In the short term, every period with low demand does not follow with a period of high usage. Only in periods of ascending demand does high usage follows one another. Therefore, there are cases when having safety stock is the only option to meet your target customer service level. An important aspect of safety stock with respect to customer service level is that, the number of stock-outs per month that the company faces is relatively unimportant when comparing to the number of days of stock-out of a critical part that the customer experiences. A single item stock-out per year may seem like much for a company. A stock-out period of 7 days may mean a week of lost production, rescheduling, overtime costs or lost sales to your customer if the the stock-out part affects a constrained operation. Over-planning of Master Production Schedule Sometimes because of continuous higher forecast and demand, the master scheduler may over-plan certain products so that when actual usage occurred higher than the forecast, there is always some extra sets of inventory that is available to meet the increased demand. Companies don't normally produce these extra products unless there is a demand. Over-planning at master schedule level will produce extra sets of parts or sub-assemblies based on their levels in the bill of material. For simplicity for example, let's assume a unit of product 123C requires 15 pieces of part A and 8 pieces of sub-assembly B. Product forecast for the month was planned at 30 units, and you planned 20% extra of part A and 5% extra of sub-assembly B. If the actual demand was 25 units, the effect of over-planning at master schedule level produces excess safety stock of 165 pieces for part A and excess 26 sub-assemblies B. [see more detail in this worksheet]. When demand dips and you have this kind of excess safety stock or inventory, you should know who to be held responsible for. Calculating statistical and fixed safety stock There are two primary techniques commonly used to set a safety stock level - statistical (using standard deviation and mean absolute deviation) and fixed techniques. I will explain them later. The choice of selecting which technique to use depends on the type of part (dependent- or independent-demand), type of demand of the part (stable or sporadic), its degree of variability (high or low), replenishment lead time of the part, availability of at least 6 to 12 months of historical usage data, and the target customer service level commitment. A point to note is that planners must be aware of the products and parts in their different stages of the product life cycle, and not just relegate to the computer by taking in everything what the statistical technique calculated for them. They must still check on the validity of the statistical calculation for some important categories of parts. Which parts exactly of the unplanned usage that caused stock-out situation that are unacceptable to the customers? How can you know exactly which parts of of the unplanned usage that must be protected by safety stock to prevent causing another very unhappy customers? One way is to look at the product life cycle stages. For new products in the introduction and growth stages, there is little risk in stocking enough materials to meet high customer service levels since the materials will continue to have demand in the short term. The primary danger planners must pay attention to in the introduction and growth stages is that certain categories of parts may be superseded by another part through engineering changes if the product is encountering quality issues or still undergoing modifications. Under such circumstances, parts may be phased out, can not be sold or used in another product, or service parts become excess, surplus, inactive, and eventually become obsolete and have to be scrapped. Finance managers usually aren't very tolerating when inventory dollars has to be written off due to poor planning and mismanagement. Product in the maturity phase usually see high demand of parts and companies are often asked to keep more safety stock to meet customer service level. It is in this phase inventory planners face the greater challenge of keeping inventory costs down while continue to sustain customer service performance. The pressure is on reducing safety stock investment, free up cash flow while relying upon production volume and product lines mix flexibility to make up for any unplanned demand. Fixed Safety Stock A fixed safety stock approach is normally used under the following situations: a new part is being phased in during the product introduction stage. Because there is insufficient historical demand data, a calculated safety stock may be too low. Establishing a fixed safety stock prevents the new part from stock-out during NPI (New Product Introduction) phase. Take not that a replacement or substitution part which supersedes another is not the same. Your inventory system should already take into account the historical usage of the old part that was substituted to provide sufficient calculated safety stock quantity. a part may be phased out, taken out of the bill-of-material, becomes inactive and excess. Demand will gradually tail off as demand softens, and as the Program manager tries to offer price breaks to customers in order to deplete the excess on-hand balance before the parts reach shelf-life expiry dates. Under such situation planners should set the fixed safety stock level to zero, and monitor the on-going usage. Dependent-demand parts are planned through the Master Schedule (MS) and MRP systems. This is usually planned in a production or assembly environments where there are no unplanned usage like customers placing direct orders. The material planner should flag the safety stock technique to "fixed" and safety stock quantity to zero. There are two common types of measurements to find the variability of the supply and demand, namely Standard Deviation and Mean Absolute Deviation. In essence, they are just the two different ways of measuring the same thing. Calculating the standard deviation (σ) Standard deviation (σ) is a measure of the spread of a probability distribution or how widely values are dispersed from the average value (the mean). Consider two parts that have the same forecasted usage rate. The one which experiences the greater deviation of the actual usage rate from the forecasted usage rate will have a greater spread. The smaller the standard deviation, the higher the probability of the actual usage rate tracking closely to the forecasted usage rate. You can also see from the explanation note of 'normal distribution' where actual demand is approximating the forecast with each additional decrement of the standard deviation (or sigma). Mathematically, standard deviation (σ) is calculated as: which is the square root of the sum of the forecast deviations squared divided by the number of periods - 1. (n is the number of periods, and x- is the forecast deviation). Table 4.1 below contains the forecast and actual demand for a 12 months period, which are used to calculate 4 types of deviations in five columns. [you can download the worksheet workout with the formula]. Table 4.1 Calculating Standard Deviation and Mean Absolute Deviation You may ask why should include the deviations with actual demand less than forecast since stock stock had not been used in those periods. This is because the calculations of standard deviation and mean absolute deviation both consider under-deviations and over-deviations (+ and - signs). All the forecast deviations must be summed using Absolute values and then averaged in order to obtain a representative deviation. Forecast deviation columns are used to calculate σ and MAD. Over-deviation column calculates only over-deviation of actual demand above forecast. Calculating the Mean Absolute Deviation (MAD) Mean Absolute Deviation (MAD), like SD ( or σ), is a simple assessment of the variability of the demand pattern, a basis from which safety stock can be calculated. You can consider MAD as a percentage of the demand variations over a given number of periods into the past. For a normal distribution, MAD =0.8 standard deviation. For improved safety stock calculation, the assessment of the variability between forecast and actual demand must use the most recent data, and the value should be exponentially weighted [see weighted averages using Exponential Smoothing technique]. Calculating MAD is easier than standard deviation (SD) because you have to convert SD to variance (SD2) in using exponential weighting technique. Exponentially weighted MAD is also more effective than SD, especially useful in seasonal demand, and giving improved safety stock levels. In Table 4.1, MAD is calculated as: You can fine-tune the exponential forecast by adjusting the value of the smoothing constant (α). For effective exponential forecasting, the range of the smoothing constant which you can chose from are normally 0.1 to 0.4. If the historical demand varies slowly with not much variations, you should use a lower α value of 0.1. If value of α=0.1 makes the new forecast a little insensitive to demand level, then use α=0.15. If there are variable changes in the average past demand level to which you want the forecast to smooth, you should use a higher value of α, say, 0.4. In Table 4.1, MAD for Jan using the weighting factor α=0.2 is calculated as: MAD for Dec using the weighting factor α=0.5 is calculated as: In Table 4.1, The α=0.2 smoothed MAD was lower than the non-weighted MAD in December by about 12%, that is ((9.17-8.04)/9.17). The α=0.5 smoothed MAD was about 27% lower. The two MAD equations using 0.2 and 0.5 Alpha Factor also recognized that the 15 to 20 magnitude forecast deviations of the demand occurred further in the past prior to July, and all the more recent deviations from July onward were all in the 5 to 10 deviations range. Both 0.2 and 0.5 Alpha Factors reacted at the time of the larger deviations. Over time, however, the smaller 5 to 10 magnitude deviations caused the smoothed MAD to be reduced. The conclusion here is that the non-smoothed MAD technique weighted all periods equally, without accounting for the newer or the older periods of the data. However, the MAD smoothing technique with Alpha (α) Factors reacted more heavily to the more recent trend toward lower deviations Calculating statistical safety stock using MAD It involves many mathematical computations and for this it is best to illustrate with an example. Consider the following: Planners need to specify the number of sigma accounts for the 100% customer service level by part. Although the default is 4 σ for 100% service, the actual may be from 3 to 6 σ based on the actual deviations experienced in the past. Now we come to the more interesting part. With the calculated σ, new MAD, Lead Time Deviation and the known Safety Factor (based on σ or MAD) in this example, we can associate the quantity of safety stock with the various customer safety stock percents (tabulated in Table 4.3). Safety Factor is related to the safety stock replenishment frequency as you can see from the graph that with every increment of Safety Factor, you are increasing the safety stock quantity which in turns provides you improved Safety Stock Service Percents, of course, less stockout. You can download Table 4.3 with the plotted graph as shown below. Table 4.4 Comparing the Safety Stock Level at different New MAD calculations. Table 4.4 is derived from Table 4.1 in the previous example. Table 4.4 compares the safety stock level required based on the different calculated value of the three MADs, SD, Lead Time Deviation with β=0.5 and 3-month replenishment lead time, and Safety Factor of 1.28 at 90% customer safety stock service level. Based on Alpha factor 0.2, there is 11.5% less safety stock [(26-23)/26] required than using the non-weighted calculation. Using 0.5 Alpha factor results in about 27% lesser [(26-19)/26]. You can see all the calculations in this worksheet. Next Page >> Economic Order Quantities

A1: SD =

A1: Sum of Forecast Deviation squared | B1: =
B2: = SUM(E3:E14)
B3: = 1450
A5: Standard Deviation (σ) | B5: = SQRT(1450/(12-1))
B6: = 11.48 pcs
A8: Absolute Deviation | B8: = ABS[Forecasted Usage - Actual Usage]
A9: Absolute Deviation for Feb. | B9: = ABS(100-105)
B10: = 5 pcs
A12: Sum of Absolute Deviation | B12: = ABS(SUM(ABS(D3:D14))) = 110 pcs
B13: note: this must be entered as an array formula. Press Shift+Ctrl+Enter.
A15: Mean Absolute Deviation (MAD) | B15: = Sum of the absolute deviations/number of periods
B16: = 110/12 = 9.17 pcs

B1: A | C1: B | D1: C | E1: D | F1: E | G1: F | H1: G | I1: H
A2: 1 | B2: Month | C2: Forecasted Usage | D2: Actual Usage | E2: Forecast Deviation | F2: Squaring Forecast Deviation | G2: Over-Deviations | H2: MAD calculated using 0.2 Alpha Factor | I2: MAD calculated using 0.5 Alpha Factor
A3: 2 | B3: Previous MAD | H3: 9.17 | I3: 9.17
A4: 3 | B4: Jan | C4: 105 | D4: 85 | E4: =C4-D4 -> 20 | F4: =E4*E4 -> 400 | G4: =IF(E4<0,E4,"") ->  | H4: =(0.2*ABS(E4))+((1-0.2)*H3) -> 11.336 | I4: =(0.5*ABS(E4))+((1-0.5)*I3) -> 14.585000000000001
A5: 4 | B5: Feb | C5: 100 | D5: 105 | E5: =C5-D5 -> -5 | F5: =E5*E5 -> 25 | G5: =IF(E5<0,E5,"") -> -5 | H5: =(0.2*ABS(E5))+((1-0.2)*H4) -> 10.068800000000001 | I5: =(0.5*ABS(E5))+((1-0.5)*I4) -> 9.7925000000000004
A6: 5 | B6: Mar | C6: 105 | D6: 105 | E6: =C6-D6 -> 0 | F6: =E6*E6 -> 0 | G6: =IF(E6<0,E6,"") ->  | H6: =(0.2*ABS(E6))+((1-0.2)*H5) -> 8.0550400000000018 | I6: =(0.5*ABS(E6))+((1-0.5)*I5) -> 4.8962500000000002
A7: 6 | B7: Apr | C7: 110 | D7: 100 | E7: =C7-D7 -> 10 | F7: =E7*E7 -> 100 | G7: =IF(E7<0,E7,"") ->  | H7: =(0.2*ABS(E7))+((1-0.2)*H6) -> 8.4440320000000018 | I7: =(0.5*ABS(E7))+((1-0.5)*I6) -> 7.4481250000000001
A8: 7 | B8: May | C8: 110 | D8: 90 | E8: =C8-D8 -> 20 | F8: =E8*E8 -> 400 | G8: =IF(E8<0,E8,"") ->  | H8: =(0.2*ABS(E8))+((1-0.2)*H7) -> 10.755225600000003 | I8: =(0.5*ABS(E8))+((1-0.5)*I7) -> 13.7240625
A9: 8 | B9: Jun | C9: 105 | D9: 120 | E9: =C9-D9 -> -15 | F9: =E9*E9 -> 225 | G9: =IF(E9<0,E9,"") -> -15 | H9: =(0.2*ABS(E9))+((1-0.2)*H8) -> 11.604180480000002 | I9: =(0.5*ABS(E9))+((1-0.5)*I8) -> 14.362031249999999
A10: 9 | B10: Jul | C10: 75 | D10: 70 | E10: =C10-D10 -> 5 | F10: =E10*E10 -> 25 | G10: =IF(E10<0,E10,"") ->  | H10: =(0.2*ABS(E10))+((1-0.2)*H9) -> 10.283344384000001 | I10: =(0.5*ABS(E10))+((1-0.5)*I9) -> 9.6810156250000006
A11: 10 | B11: Aug | C11: 105 | D11: 100 | E11: =C11-D11 -> 5 | F11: =E11*E11 -> 25 | G11: =IF(E11<0,E11,"") ->  | H11: =(0.2*ABS(E11))+((1-0.2)*H10) -> 9.2266755072000013 | I11: =(0.5*ABS(E11))+((1-0.5)*I10) -> 7.3405078125000003
A12: 11 | B12: Sep | C12: 100 | D12: 110 | E12: =C12-D12 -> -10 | F12: =E12*E12 -> 100 | G12: =IF(E12<0,E12,"") -> -10 | H12: =(0.2*ABS(E12))+((1-0.2)*H11) -> 9.3813404057600014 | I12: =(0.5*ABS(E12))+((1-0.5)*I11) -> 8.6702539062500001
A13: 12 | B13: Oct | C13: 115 | D13: 110 | E13: =C13-D13 -> 5 | F13: =E13*E13 -> 25 | G13: =IF(E13<0,E13,"") ->  | H13: =(0.2*ABS(E13))+((1-0.2)*H12) -> 8.5050723246080011 | I13: =(0.5*ABS(E13))+((1-0.5)*I12) -> 6.8351269531250001
A14: 13 | B14: Nov | C14: 90 | D14: 100 | E14: =C14-D14 -> -10 | F14: =E14*E14 -> 100 | G14: =IF(E14<0,E14,"") -> -10 | H14: =(0.2*ABS(E14))+((1-0.2)*H13) -> 8.8040578596864023 | I14: =(0.5*ABS(E14))+((1-0.5)*I13) -> 8.4175634765624991
A15: 14 | B15: Dec | C15: 75 | D15: 80 | E15: =C15-D15 -> -5 | F15: =E15*E15 -> 25 | G15: =IF(E15<0,E15,"") -> -5 | H15: =(0.2*ABS(E15))+((1-0.2)*H14) -> 8.0432462877491222 | I15: =(0.5*ABS(E15))+((1-0.5)*I14) -> 6.7087817382812496
A16: 15 | F16: =SUM(F4:F15) -> 1450
A17: 16 | B17: Sum of Absolute Deviation: | E17: =(SUM(ABS(E4:E15))) -> 110
A18: 17 | B18: Absolute Average Deviation: | E18: =ROUNDUP(AVERAGE(ABS(E4:E15)),2) -> 9.17 | G18: =-SUM(G4:G15)/COUNTIF(G4:G15,"<0") -> 9
A19: 18 | B19: Standard Deviation (σ): | F19: =SQRT(F16/(COUNTA(B4:B15)-1)) -> 11.481209945740989
A20: 19 | B20: Mean Absolute Deviation (MAD): | F20: =E17/COUNTA(B4:B15) -> 9.1666666666666661

A1: MAD | B1: = | C1: Sum of the absolute deviations from mean
C2: Number of periods
B3: = | C3: 110/12
B4: = | C4: 9.17 pcs

A1: New MAD (Jan) | B1: = (α x Absolute Deviation) + ([1 - α] x old MAD)
B2: = (0.2*ABS(D3))+((1-0.2)*G2) which is also,
B3: = (0.2 x 20) + ((1 - 0.2) x 9.17)
B4: = 11.34 pcs

A1: New MAD (Dec) | B1: = (0.5*ABS(D14))+((1-0.5)*H13) which is also,
B2: = (0.5 x 5) + ((1 - 0.5) x 8.42)
B3: = 6.71 pcs

A1: 60 days | B1: :Lead time (assuming 20 workdays per month)
A2: 90% | B2: :Target safety stock service level
A3: 0.20 | B3: :Weighting factor (σ)
A4: 40 pcs | B4: :Order qty
A5: 125 pcs | B5: :Last month's actual usage rate
A6: 100 pcs | B6: :Last month's forecasted usage rate
A7: 1.00 | B7: :Old MAD

A1: Absolute Deviation | B1: = ABS[Forecasted Usage - Actual Usage]
B2: = 100 - 125
B3: = 25 pcs
A5: New MAD | B5: = (σ x Absolute Deviation) + ([1 - σ] x old MAD)
B6: = (0.20 x 25) + ((1-0.20) x 1.00)
B7: = 5.8 pcs
A9: In calculating MAD, the same as was shown previously in exponential smoothing technique - the higher the value of the smoothing alpha factor, the more weight is given to the most recent data than to deviations in the older periods. Standard Deviation is used as a reference for statistical tables which are based on the standard deviations. Some computerized inventory system automatically calculates the standard deviations for you, based on the past lead times experienced. SD can be approximated as:
A11: Standard Deviation | B11: = MAD x 1.25
B12: = 5.8 x 1.25
B13: =7.25 pcs
A15: Lead Time Deviation | B15: = Standard Deviation x (Lead Time in months/Forecast period)β
A16: (base on SD) | B16: = 7.25 x (3)0.5 which is =7.25*POWER(3,0.5) in your Excel spreadsheet
B17: = 7.25 x 1.732
B18: = 12.56 pcs
A20: Lead Time Deviation | B20: = MAD x (Lead Time in months/Forecast period)β
A21: (base on MAD) | B21: = 5.8 x (3)0.5 which is =5.8*POWER(3,0.5) in your Excel spreadsheet
B22: = 5.8 x 1.732
B23: = 10.05 pcs
A25: The calculation of Lead Time Deviation extends the standard deviation over some portion of the lead time for parts which have a forecast review period that does not match the total replenishment lead time of the parts. The calculated standard deviation is based on a 1-month forecast period, but the part has a 3-month lead time. Theoretically, a situation may occur such that the part that you have released for purchase order may experience 3 months in a row of higher than forecasted demand. The calculated safety stock under such worst-case scenario would assume that the average deviation would occur for 3 months in a row. Therefore Lead Time Deviation formula applies a beta factor (β) to account for some portion of the deviation over the lead time. Beta factor (β) is typically set in the 0.5 to 0.7 range. 0.5 is commonly used. Setting to 1 is equivalent to the worst-case scenario. Table 4.2 is a Normal Distribution function table which shows the Safety Factors based on a Normal Distribution. Safety Factor in short is for "customer safety stock service factor". Safety Factor is the number of Standard Deviations (or MAD) associated with the Safety Stock Service Level Percent. Your computerized inventory system has its own lookup information table that looks something like Table 4.2 to assign the Safety Factor. Given that the target safety stock service level is 90% and if you look at Table 4.2 the Safety Factor is 1.28 based on σ (or equal to 1.60 based on MAD). Therefore you now can calculate the statistical safety stock either using 1.28 or 1.60.
A27: Statistical Safety Stock | B27: = Safety Factor x Lead Time Deviation
B28: = roundup((1.28*12.56),0)
B29: = 17
B31: or using 1.60 based on MAD
A32: Statistical Safety Stock | B32: = roundup((1.60*10.05),0)
B33: = 17

A1: Desired Safety Stock Service Level (% periods without stockout) | B1: Additional Safety Stock Service Percent from statistical table | C1: Safety Factor for Standard Deviation (σ) | D1: Safety Factor for MAD (σ x 1.25)
A2: 0.5 | B2: 0.5 | C2: 0.00 | D2: 0.00
A3: 0.8 | B3: 0.79949999999999999 | C3: 0.84 | D3: 1.05
A4: 0.85 | B4: 0.84130000000000005 | C4: 1.00 σ | D4: 1.25
A5: 0.9 | B5: 0.89970000000000006 | C5: 1.28 | D5: 1.60
B6: 0.94520000000000004 | C6: 1.60 | D6: 2.00
A7: 0.95 | B7: 0.95050000000000001 | C7: 1.65 | D7: 2.06
B8: 0.97719999999999996 | C8: 2.00 σ | D8: 2.50
A9: 0.98 | B9: 0.9798 | C9: 2.05 | D9: 2.56
A10: 0.99 | B10: 0.99009999999999998 | C10: 2.33 | D10: 2.91
B11: 0.99180000000000001 | C11: 2.40 | D11: 3.00
B12: 0.99870000000000003 | C12: 3.00 σ | D12: 3.75
B13: 0.99929999999999997 | C13: 3.20 | D13: 4.00
A14: 1 | B14: 0.99996850000000004 | C14: 4.00 σ | D14: 5.00
B15: 0.99999970999999999 | C15: 5.00 σ | D15: 6.25
B16: 0.99999998999999995 | C16: 6.00 σ | D16: 7.50
A17: Source: Normal Distribution Function and "The Nature of Six Sigma Quality"
A18: Table 4.2 Safety Factors based on a Normal Distribution

B1: Customer Safety Stock Service Percents
A2: Safety Stock Service % | B2: 0.8 | C2: 0.85 | D2: 0.89 | E2: 0.9 | F2: 0.93 | G2: 0.94 | H2: 0.95 | I2: 0.96 | J2: 0.97 | K2: 0.98 | L2: 0.99 | M2: 1
A3: SD (σ) | B3: 7.25 | C3: 7.25 | D3: 7.25 | E3: 7.25 | F3: 7.25 | G3: 7.25 | H3: 7.25 | I3: 7.25 | J3: 7.25 | K3: 7.25 | L3: 7.25 | M3: 7.25
A4: New MAD | B4: 5.8 | C4: 5.8 | D4: 5.8 | E4: 5.8 | F4: 5.8 | G4: 5.8 | H4: 5.8 | I4: 5.8 | J4: 5.8 | K4: 5.8 | L4: 5.8 | M4: 5.8
A5: Lead Time Deviation (β=0.5) | B5: 12.56 | C5: 12.56 | D5: 12.56 | E5: 12.56 | F5: 12.56 | G5: 12.56 | H5: 12.56 | I5: 12.56 | J5: 12.56 | K5: 12.56 | L5: 12.56 | M5: 12.56
A6: Safety Factor (based on σ) | B6: 0.84 | C6: 1 | D6: 1.25 | E6: 1.28 | F6: 1.5 | G6: 1.56 | H6: 1.65 | I6: 1.75 | J6: 1.88 | K6: 2.05 | L6: 2.33 | M6: 4
A7: Statistical Safety Stock | B7: 11 | C7: 13 | D7: 16 | E7: 17 | F7: 19 | G7: 20 | H7: 21 | I7: 22 | J7: 24 | K7: 26 | L7: 30 | M7: 51
A8: Table 4.3 Deriving Safety Stock Level at the various Safety Stock Service Percents

D1: Non-smoothed calculation | E1: Based on 0.2 Alpha Factor | F1: Based on 0.5 Alpha Factor
A2: Old MAD | D2: N/A | E2: 8.8040578596864023 | F2: 8.4175634765624991
A3: New MAD | D3: 9.17 | E3: 8.0432462877491222 | F3: 6.7087817382812496
A4: SD (New MAD x 1.25) | D4: =D3*1.25 -> 11.4625 | E4: =E3*1.25 -> 10.054057859686402 | F4: =F3*1.25 -> 8.3859771728515611
A5: Lead Time Deviation (β=0.5) | D5: =D4*POWER(3,0.5) -> 19.853632381758256 | E5: =E4*POWER(3/1,0.5) -> 17.414139035214049 | F5: =F4*POWER(3/1,0.5) -> 14.524938534491715
A6: Safety Factor based on SD (α) | D6: 1.28 (90%) | E6: 1.28 (90%) | F6: 1.28 (90%)
A7: Statistical Safety Stock | D7: = ROUNDUP((4*D5),0) -> 26 | E7: = ROUNDUP((4*E5),0) -> 23 | F7: = ROUNDUP((4*F5),0) -> 19
A8: Safety Stock % reduction | D8: = ROUNDUP((4*D5),0) ->  | E8: = ROUNDUP((4*E5),0) -> 11.5% | F8: = ROUNDUP((4*F5),0) -> 26.9%