A1: Home About Me Excel VBA (XL97-2003) Excel spreadsheet formula Excel VB.NET (XL2007) Access VBA Material Management & Demand Forecasting More on Safety Stock Exponential Smoothing | C1: Weighting the averages using Exponential Smoothing technique The technique of exponential smoothing has many advantages over the moving average technique - it responds well to all sporadic demand changes. It takes more notice of the recent historical demand and less notice of the older demand data. Exponential smoothing technique provides a weighted average which improves the historical forecasting. It also doesn't need to have a very long periods of historical data as does the case in the moving average technique. The later gives equal importance to all the periods you want to evaluate, and also needs many recalculation each time. You use exponential smoothing to derive a new forecast demand (which is in fact a historical "average"). The calculation is: New Forecast = α x Demand in last period + (1-α) x Forecast for last period α is the smoothing factor or constant. In Table 4.1, the calculation of new forecast using α =0.1 and α =0.3 respectively, analyses the last period's demand to give a historical average plus the remainder which we treated it as "statistical forecast fluctuation". The smoothing factor, α, defines the amount of notice which is taken of the each period's demand. The forecasts using exponential smoothing with α =0.1 and α =0.3 respectively, are calculated using the previous period's forecast. The MAD calculated in each case is 2.7 and 2.9 respectively, and this indicates that the statistical forecast using smoothing α =0.1 yields a better result. The chart on the right also indicates that the yellow line forecast with α =0.1 gives a much better smooth. [Download this worksheet] Table 4.1 Exponential Smoothing technique You can fine-tune the statistical forecast by altering the value of the smoothing constant (α). For effective exponential forecasting, the range of the smoothing constant which you can chose from are from 0.1 to 0.4. If the historical demand data varies slowly without sporadic changes, then α value of 0.1 or 0.15 is recommended. If there are understandable variable changes in average past demand level to which you want the forecast to smooth down the variability, a higher value of α, say, 0.4, should be chosen. In Figure 4.2 and Figure 4.3 below, which shows the much unstable variable demand and the increasing trend demand pattern, you see that the exponential smoothing with α =0.4 (the red curve lines) give a more reliable forecast in both cases. Remember this as the rule of thumb - low values of α make the forecast consistent; higher values of α make the forecast reactive to the variability of historical demand. However, smoothing with a higher value of α making your forecast rely too heavily upon demand in the last period. In Figure 4.3, the variability of the demand was high from month to month and display an upward linear trend, using a low value of α smooth it to a more stable average as the yellow curve shows. However, if you have the more challenging customer service level goal to meet, you should use a higher value of α, say=0.4, as it reacts more rapidly to the trends in the past demand average level. MAD value of 4.1 shows that exponential smoothing using α=0.4 gives better forecast. If you have little knowledge or no idea of what caused the historical demand pattern of the part, then it is recommended to initially use a median value of α=0.2 or 0.25, then review the value of α again at regular periods on an on-going basis, and change the α value where necessary. Download the following example worksheet. Table 4.2 exponential smoothing on a variable demand pattern Table 4.3 exponential smoothing on a increasing trend demand pattern

A1: Month | B1: Last period demand | C1: Forecast α = 0.1 | D1: Forecast Error1 | E1: Forecast α = 0.3 | F1: Forecast Error2 | H1: Figure 4.1
A2: 38353 | B2: 10 | C2: 10.0 | D2: =B2-C2 -> 0.0 | E2: 10.0 | F2: =B2-E2 -> 0.0
A3: 38384 | B3: 14 | C3: 10.4 | D3: =B3-C3 -> 3.6 | E3: 10.0 | F3: =B3-E3 -> 4.0
A4: 38412 | B4: 6 | C4: 10.5 | D4: =B4-C4 -> -4.5 | E4: 11.2 | F4: =B4-E4 -> -5.2
A5: 38443 | B5: 8 | C5: 9.8 | D5: =B5-C5 -> -1.8 | E5: 9.64 | F5: =B5-E5 -> -1.64
A6: 38473 | B6: 16 | C6: 9.7 | D6: =B6-C6 -> 6.3 | E6: 9.15 | F6: =B6-E6 -> 6.85
A7: 38504 | B7: 12 | C7: 10.2 | D7: =B7-C7 -> 1.8 | E7: 11.2 | F7: =B7-E7 -> 0.80000000000000071
A8: 38534 | B8: 7 | C8: 10.6 | D8: =B8-C8 -> -3.6 | E8: 11.4 | F8: =B8-E8 -> -4.4
A9: 38565 | B9: 11 | C9: 10.1 | D9: =B9-C9 -> 0.9 | E9: 10.1 | F9: =B9-E9 -> 0.9
A10: 38596 | B10: 13 | C10: 10.3 | D10: =B10-C10 -> 2.7 | E10: 10.38 | F10: =B10-E10 -> 2.62
A11: 38626 | B11: 5 | C11: 9.5 | D11: =B11-C11 -> -4.5 | E11: 11.16 | F11: =B11-E11 -> -6.16
A12: 38657 | B12: 10 | C12: 9.1 | D12: =B12-C12 -> 0.9 | E12: 9.31 | F12: =B12-E12 -> 0.6899999999999995
A13: 38687 | B13: 8 | C13: 9.8 | D13: =B13-C13 -> -1.8 | E13: 9.52 | F13: =B13-E13 -> -1.52
A14: Sum of Absolute Forecast Error: | D14: =(SUM(ABS(D2:D13))) -> 32.4 | F14: =(SUM(ABS(F2:F13))) -> 34.78
A15: Mean Absolute Deviation (MAD): | D15: =D14/12 -> 2.7 | F15: =F14/12 -> 2.8983333333333321

A1: Month | B1: Historical Demand | C1: Previous Forecast | D1: Forecast α = 0.1 | E1: Forecast Error1 | F1: Forecast α = 0.4 | G1: Forecast Error2 | I1: Figure 4.2
A2: 38718 | B2: 10 | C2: 12 | D2: =(0.1*B2)+(1-0.1)*C2 -> 11.8 | E2: =B2-D2 -> -1.8 | F2: =(0.4*B2)+(1-0.4)*C2 -> 11.2 | G2: =B2-F2 -> -1.2
A3: 38749 | B3: 14 | C3: 10 | D3: =(0.1*B3)+(1-0.1)*C3 -> 10.4 | E3: =B3-D3 -> 3.6 | F3: =(0.4*B3)+(1-0.4)*C3 -> 11.6 | G3: =B3-F3 -> 2.4
A4: 38777 | B4: 5 | C4: 9 | D4: =(0.1*B4)+(1-0.1)*C4 -> 8.6 | E4: =B4-D4 -> -3.6 | F4: =(0.4*B4)+(1-0.4)*C4 -> 7.4 | G4: =B4-F4 -> -2.4
A5: 38808 | B5: 8 | C5: 9 | D5: =(0.1*B5)+(1-0.1)*C5 -> 8.9 | E5: =B5-D5 -> -0.9 | F5: =(0.4*B5)+(1-0.4)*C5 -> 8.6 | G5: =B5-F5 -> -0.6
A6: 38838 | B6: 17 | C6: 9 | D6: =(0.1*B6)+(1-0.1)*C6 -> 9.8 | E6: =B6-D6 -> 7.2 | F6: =(0.4*B6)+(1-0.4)*C6 -> 12.2 | G6: =B6-F6 -> 4.8
A7: 38869 | B7: 12 | C7: 10 | D7: =(0.1*B7)+(1-0.1)*C7 -> 10.2 | E7: =B7-D7 -> 1.8 | F7: =(0.4*B7)+(1-0.4)*C7 -> 10.8 | G7: =B7-F7 -> 1.2
A8: 38899 | B8: 7 | C8: 11 | D8: =(0.1*B8)+(1-0.1)*C8 -> 10.6 | E8: =B8-D8 -> -3.6 | F8: =(0.4*B8)+(1-0.4)*C8 -> 9.4 | G8: =B8-F8 -> -2.4
A9: 38930 | B9: 11 | C9: 10 | D9: =(0.1*B9)+(1-0.1)*C9 -> 10.1 | E9: =B9-D9 -> 0.9 | F9: =(0.4*B9)+(1-0.4)*C9 -> 10.4 | G9: =B9-F9 -> 0.6
A10: 38961 | B10: 15 | C10: 10 | D10: =(0.1*B10)+(1-0.1)*C10 -> 10.5 | E10: =B10-D10 -> 4.5 | F10: =(0.4*B10)+(1-0.4)*C10 -> 12.0 | G10: =B10-F10 -> 3.0
A11: 38991 | B11: 5 | C11: 11 | D11: =(0.1*B11)+(1-0.1)*C11 -> 10.4 | E11: =B11-D11 -> -5.4 | F11: =(0.4*B11)+(1-0.4)*C11 -> 8.6 | G11: =B11-F11 -> -3.6
A12: 39022 | B12: 12 | C12: 8 | D12: =(0.1*B12)+(1-0.1)*C12 -> 8.4 | E12: =B12-D12 -> 3.6 | F12: =(0.4*B12)+(1-0.4)*C12 -> 9.6 | G12: =B12-F12 -> 2.4
A13: 39052 | B13: 7 | C13: 10 | D13: =(0.1*B13)+(1-0.1)*C13 -> 9.7 | E13: =B13-D13 -> -2.7 | F13: =(0.4*B13)+(1-0.4)*C13 -> 8.8 | G13: =B13-F13 -> -1.8
A14: Sum of Absolute Forecast Error: | E14: =(SUM(ABS(E2:E13))) -> 39.6 | G14: =(SUM(ABS(G2:G13))) -> 26.4
A15: Mean Absolute Deviation (MAD): | E15: =E14/12 -> 3.3 | G15: =G14/12 -> 2.2

A1: Month | B1: Historical Demand | C1: Previous Forecast | D1: Forecast α = 0.1 | E1: Forecast Error1 | F1: Forecast α = 0.4 | G1: Forecast Error2 | I1: Figure 4.3
A2: 39083 | B2: 6 | C2: 7 | D2: =(0.1*B2)+(1-0.1)*C2 -> 6.9 | E2: =B2-D2 -> -0.9 | F2: =(0.4*B2)+(1-0.4)*C2 -> 6.6 | G2: =B2-F2 -> -0.60000000000000053
A3: 39114 | B3: 8 | C3: 6 | D3: =(0.1*B3)+(1-0.1)*C3 -> 6.2 | E3: =B3-D3 -> 1.8 | F3: =(0.4*B3)+(1-0.4)*C3 -> 6.8 | G3: =B3-F3 -> 1.2
A4: 39142 | B4: 3 | C4: 7 | D4: =(0.1*B4)+(1-0.1)*C4 -> 6.6 | E4: =B4-D4 -> -3.6 | F4: =(0.4*B4)+(1-0.4)*C4 -> 5.4 | G4: =B4-F4 -> -2.4
A5: 39173 | B5: 11 | C5: 8 | D5: =(0.1*B5)+(1-0.1)*C5 -> 8.3 | E5: =B5-D5 -> 2.7 | F5: =(0.4*B5)+(1-0.4)*C5 -> 9.2 | G5: =B5-F5 -> 1.8
A6: 39203 | B6: 14 | C6: 9 | D6: =(0.1*B6)+(1-0.1)*C6 -> 9.5 | E6: =B6-D6 -> 4.5 | F6: =(0.4*B6)+(1-0.4)*C6 -> 11.0 | G6: =B6-F6 -> 3.0
A7: 39234 | B7: 19 | C7: 11 | D7: =(0.1*B7)+(1-0.1)*C7 -> 11.8 | E7: =B7-D7 -> 7.2 | F7: =(0.4*B7)+(1-0.4)*C7 -> 14.2 | G7: =B7-F7 -> 4.8
A8: 39264 | B8: 11 | C8: 15 | D8: =(0.1*B8)+(1-0.1)*C8 -> 14.6 | E8: =B8-D8 -> -3.6 | F8: =(0.4*B8)+(1-0.4)*C8 -> 13.4 | G8: =B8-F8 -> -2.4
A9: 39295 | B9: 17 | C9: 14 | D9: =(0.1*B9)+(1-0.1)*C9 -> 14.3 | E9: =B9-D9 -> 2.7 | F9: =(0.4*B9)+(1-0.4)*C9 -> 15.2 | G9: =B9-F9 -> 1.8
A10: 39326 | B10: 23 | C10: 12 | D10: =(0.1*B10)+(1-0.1)*C10 -> 13.1 | E10: =B10-D10 -> 9.9 | F10: =(0.4*B10)+(1-0.4)*C10 -> 16.4 | G10: =B10-F10 -> 6.6
A11: 39356 | B11: 19 | C11: 12 | D11: =(0.1*B11)+(1-0.1)*C11 -> 12.7 | E11: =B11-D11 -> 6.3 | F11: =(0.4*B11)+(1-0.4)*C11 -> 14.8 | G11: =B11-F11 -> 4.2
A12: 39387 | B12: 26 | C12: 13 | D12: =(0.1*B12)+(1-0.1)*C12 -> 14.3 | E12: =B12-D12 -> 11.7 | F12: =(0.4*B12)+(1-0.4)*C12 -> 18.2 | G12: =B12-F12 -> 7.8
A13: 39417 | B13: 33 | C13: 13 | D13: =(0.1*B13)+(1-0.1)*C13 -> 15.0 | E13: =B13-D13 -> 18.0 | F13: =(0.4*B13)+(1-0.4)*C13 -> 21.0 | G13: =B13-F13 -> 12.0
A14: Sum of Absolute Forecast Error: | E14: =(SUM(ABS(E2:E13))) -> 72.9 | G14: =(SUM(ABS(G2:G13))) -> 48.6
A15: Mean Absolute Deviation (MAD): | E15: =E14/12 -> 6.0750000000000002 | G15: =G14/12 -> 4.05