A2: Descriptive Statistics Analysis Single & Multiple Moving Averages Single & Multiple-Parameters Exponential Smoothing Exponential Smoothing with Seasonality Methods | B2: Decomposition Methods Simple and Multiple Regression Analysis Box-Jenkins (ARIMA) Models Multivariate Data Analysis | C2: Home | About me
A4: Exponential Smoothing Methods Single Exponential Smoothing (SES) Adaptive-Response-Rate Single Exponential Smoothing (ARRSES) Double Exponential Smoothing: Brown's One-Parameter Linear Method Double Exponential Smoothing: Holt's Two-Parameter Linear Method The are single, double and more complicated smoothing methods, and all of them share the common property in that recent values are given relatively more weights than the older observations. In another word, weights are exponentially decreasing as observations get older. In the case of moving averages, the weights are by-product of the MA system adopted, but in exponential smoothing, there are one or more smoothing parameters that need to be determined explicitly. Single Exponential Smoothing From above illustration, we therefore know that when has a value close to 1, the new forecast will include a substantial adjustment for the error in the previous forecast. When is close to 0, the new forecast will include very little adjustment. SES will always trail the trend in the actual data, for the most it can do is to adjust the next forecast for some percentage of the most recent error. Table 1.1 below shows the forecasting for the sales using the Single Exponential Smoothing. One point of concern for SES is the initial estimate values. Since F1 is not known, I use a conservative estimate of 200 (or you can assume F1 = X1 = 224, or use the average the last 4 or 5 values of X t -n). You can see the smoothing effect of in Figure 1.2 - a large (.9) gives very little smoothing in the forecast, whereas a small (.1) gives con considerable smoothing. To choose the best value for , MSE is computed over a test set, and then another value is tried. The MSEs are then compared to find the value that gives the smallest MSE. From the summary statistics, you see that MSE and MAPE decreases as approaches 1. This is because the data exhibit a trend. If only the data are at random, the smaller the value of , the smaller would be MSE. Go To Top Adaptive-Response-Rate Single Exponential Smoothing (ARRSES) ARRSES has an advantage over SES in that it allows the value of to change, in a controlled manner or programmed automatically, as changes in the pattern of data occur. This is especially useful when there are tens of thousands of items require forecasting. Table 1.2 Forecasting sales using Adaptive-Response-Rate Single Exponential Smoothing. Download ARRSES woeksheet. The three graphs plotted in Figure 1.2 are using altogether the different values of and . Note that the values of fluctuate very differently for all the three scenarios. As you can see it is no longer true that a smaller value of would give larger effect of smoothing. If you were to use different initializing values, including the estimate values of F2, E1 and M1, entirely different sets of values would have been generated. One way to control the changes in the values of is to change the value of . Note that when I used a smaller value of (0.15) combined with a higher (0.75), I was able to obtain relatively smaller series of values; and simultaneously, a greater smoothing effect had also been achieved for the forecasts. This is in fact true when looking at the MAE (44.54) and MSE (7708.4) which have the smallest values among the three. Summing up, ARRSES is an SES method with values systematically changed from period to period to allow for the changes in the data pattern. Extra care need to be taken when evaluating the fluctuation in . An alternative is to put an upper bound value on how much is allowed to change (using Excel Conditional Formatting to flag you an alert - with red fonts, blink, etc) from one period to the next. Go To Top Double Exponential Smoothing: Brown's One-Parameter Linear Method Linear Exponential Smoothing method has great advantages over Linear Moving Averages, mainly because of the limitations of single moving averages that need to save the last n values - more data storage. With Linear Exponential Smoothing, you need to compute only 3 data values and a single value for . Also, this method gives decreasing weights to the more distant past observations. The computational rationale of this linear exponential smoothing is quite similar to linear moving averages - both the single and double-smoothed values lag the actual data when a trend exists. The single and double-smoothed values are to be added to the single smoothed values and then adjust for trend. See the equations below for the One-Parameter Linear Exponential Smoothing. Go To Top Double Exponential Smoothing: Holt's Two-Parameter Linear Method This two-parameter linear exponential smoothing method is similar in principle to the earlier one-parameter method. The difference is that it does not apply the double smoothing formula. It smooths the trend separately by using different parameters than that used on the original series. There are two smoothing constants to be used in the equations ( and with values lie between 0 and 1). Go To Top
A5: This site was created in February 2007. contact Tan, William email: vbautomation@yahoo.com WAU_classic('9o1jkg3a8fm3')

A1: Business Forecasting Methods and Techniques

A1: A simplest case of the Single Exponential Smoothing (SES) can be written as: | D1: (1)
A2: In equation (1), forecast Ft +1 is based on weighting the most recent observation Xt with a weight value of (1-/n) and weighting the most recent previous forecast Ft with a weight value of (1-(1/n)). Substituting for 1/n becomes equation (2), where ei is the forecast error for period t. So really forecast provided by SES is simply the old forecast plus an adjustment for the error occurred in the last forecast. | D2: (2)
A3: As you see, it is no longer necessary to store all the historical data as in the case of MA methods. Rather we only need the most recent observation, the most recent forecast, and a value for . By substituting F with its components in equation (2), we expand it to equation (3). | D3: (3)
A4: Repeats this substitution by replacing Ft -1 by its components, we gets equation (4) | D4: (4)
A5: Equations (4) illustrates the exponential behavior. The weights, (1-) t decrease geometrically, and their sum is unity as shown in equation (5). | D5: (5)

A2: Suppose = 0.2, 0.3 and 0.8, we observe that the weights, (1-) t decrease exponentially (geometrically) with time. This is illustrated below and shown in the graph on the right. | E2: Figure 1.1 For example, for =0.5, the weights tend to follow the pattern of exponential decay. Hence the name exponential smoothing, a non-linear estimation. | F2: The speed at which the older responses are dampened (smoothed) is a function of the value of . When is close to 1, dampening is quick and when alpha is close to 0, dampening is slow. This is illustrated below.
A3: Weight assigned to X: | B3: = 0.2 | C3: = 0.5 | D3: = 0.8 | G3: (1-) | H3: (1-)2 | I3: (1-)3 | J3: (1-)4
A4: X t X t -1 X t -2 X t -3 X t -4 X t -5 X t -6 X t -7 X t -8 X t -9 | B4: .2 .16 .128 .1024 .08192 .065536 .052429 .041943 .033554 (.2)(.8)4 | C4: .5 .25 .125 .0625 .03125 .015625 .007813 .003906 .001953 (.5)(.5)4 | D4: .8 .16 .032 .0064 .00128 .000256 .0000512 .00001024 .000002048 (.8)(.2)4 | F4: 0.9 0.7 0.5 0.3 0.1 | G4: .1 .3 .5 .7 .9 | H4: .01 .09 .25 .49 .81 | I4: .001 .027 .125 .343 .729 | J4: .001 .0081 .0625 .2401 .6561

A1: Table 1.1 Forecasting sales using Single Exponential Smoothing.

D1: Exponentially Smoothed Values, Fi | H1: Forecast Error | K1: Absolute Percentage Error (APE) | N1: Squared Error ( Xi -Fi )2
A2: Month | B2: Period t | C2: Historical Sales Xt | D2: α =0.1 | E2: α =0.5 | F2: α =0.9 | H2: α =0.1 | I2: α =0.5 | J2: α =0.9 | K2: α =0.1 | L2: α =0.5 | M2: α =0.9 | N2: α =0.1 | O2: α =0.5 | P2: α =0.9
A3: Jan-06 | B3: 1 | C3: 224
A4: Feb-06 | B4: 2 | C4: 188 | D4: 200 | E4: 200 | F4: 200 | H4: -12 | I4: -12 | J4: -12 | K4: 6.3829787234042552 | L4: 6.3829787234042552 | M4: 6.3829787234042552 | N4: 144.00 | O4: 144.00 | P4: 144.00
A5: Mar-06 | B5: 3 | C5: 198 | D5: 198.8 | E5: 194 | F5: 189.2 | H5: -0.80000000000001137 | I5: 4 | J5: 8.8000000000000114 | K5: 0.40404040404040975 | L5: 2.0202020202020203 | M5: 4.44444444444445 | N5: 0.64000000000001822 | O5: 16.00 | P5: 77.440000000000197
A6: Apr-06 | B6: 4 | C6: 206 | D6: 198.72 | E6: 196 | F6: 197.12 | H6: 7.28 | I6: 10 | J6: 8.88 | K6: 3.5339805825242725 | L6: 4.8543689320388346 | M6: 4.3106796116504826 | N6: 52.998400000000018 | O6: 100.00 | P6: 78.854399999999913
A7: May-06 | B7: 5 | C7: 203 | D7: 199.44800000000001 | E7: 201 | F7: 205.11199999999999 | H7: 3.5519999999999925 | I7: 2 | J7: -2.1119999999999948 | K7: 1.7497536945812771 | L7: 0.98522167487684731 | M7: 1.0403940886699481 | N7: 12.616703999999947 | O7: 4.00 | P7: 4.4605439999999783
A8: Jun-06 | B8: 6 | C8: 238 | D8: 199.8032 | E8: 202 | F8: 203.21119999999999 | H8: 38.196799999999996 | I8: 36 | J8: 34.788800000000009 | K8: 16.049075630252098 | L8: 15.126050420168067 | M8: 14.617142857142863 | N8: 1458.9955302399997 | O8: 1296.00 | P8: 1210.2606054400005
A9: Jul-06 | B9: 7 | C9: 228 | D9: 203.62288000000001 | E9: 220 | F9: 234.52112 | H9: 24.377119999999991 | I9: 8 | J9: -6.5211199999999963 | K9: 10.69171929824561 | L9: 3.5087719298245612 | M9: 2.8601403508771917 | N9: 594.24397949439958 | O9: 64.00 | P9: 42.525006054399952
A10: Aug-06 | B10: 8 | C10: 231 | D10: 206.06059200000001 | E10: 224 | F10: 228.65211199999999 | H10: 24.939407999999986 | I10: 7 | J10: 2.3478880000000117 | K10: 10.796280519480513 | L10: 3.0303030303030303 | M10: 1.0164017316017369 | N10: 621.97407139046334 | O10: 49.00 | P10: 5.5125780605440555
A11: Sep-06 | B11: 9 | C11: 221 | D11: 208.5545328 | E11: 227.5 | F11: 230.76521120000001 | H11: 12.445467199999996 | I11: -6.5 | J11: -9.7652112000000102 | K11: 5.631433122171944 | L11: 2.9411764705882351 | M11: 4.4186476018099592 | N11: 154.88965382627575 | O11: 42.25 | P11: 95.35934978060564
A12: Oct-06 | B12: 10 | C12: 259 | D12: 209.79907951999999 | E12: 224.25 | F12: 221.97652112 | H12: 49.200920480000008 | I12: 34.75 | J12: 37.023478879999999 | K12: 18.996494393822395 | L12: 13.416988416988417 | M12: 14.294779490347489 | N12: 2420.7305760792842 | O12: 1207.5625 | P12: 1370.737988377806
A13: Nov-06 | B13: 11 | C13: 273.4 | D13: 214.71917156799998 | E13: 241.625 | F13: 255.29765211200001 | H13: 58.680828431999998 | I13: 31.774999999999999 | J13: 18.102347887999969 | K13: 21.46336080175567 | L13: 11.62216532553035 | M13: 6.6211952772494405 | N13: 3443.4396254658195 | O13: 1009.6506249999985 | P13: 327.6949990581769
A14: Dec-06 | B14: 12 | D14: 220.58725441119998 | E14: 257.51249999999999 | F14: 271.58976521119996
K15: 95.699117170278441 | L15: 63.888226943924622 | M15: 60.006804177197814 | N15: 8904.5285404962415 | O15: 3932.4631249999984 | P15: 3356.8454707715332
K16: 95.699117170278441 | L16: 63.888226943924622 | M16: 60.006804177197814 | N16: 8904.5285404962415 | O16: 3932.4631249999984 | P16: 3356.8454707715332
A17: Download SES worksheet | H17: Figure 1.2 Actual Sales and Forecasts Using Exponential Smoothing
D23: Test Periods
D24: 2-11 | E24: 2-11 | F24: 2-11
A25: Statistics Summay: | D25: α =0.1 | E25: α =0.5 | F25: α =0.9
A26: Mean Error | D26: 20.587254411199996 | E26: 11.5025 | F26: 7.9544183567999998
A27: Mean Absolute Error | D27: 23.147254411199999 | E27: 15.202500000000001 | F27: 14.0340845968
A28: Mean Abs. Percentage Error | D28: 9.5699117170278445 | E28: 6.388822694392462 | F28: 6.0006804177197814
A29: Standard Deviation of Error | D29: 31.454603161622273 | E29: 20.903118121998499 | F29: 19.312763398481479
A30: Mean Squared Error | D30: 890.45285404962419 | E30: 393.24631249999982 | F30: 335.6845470771533

A1: The equation for forecasting with ARRSES method is the same as equation (4) except that is replaced by t -1 | D1: (6)
A2: Instead of using t + 1 we could have used t in equation (7). Reason is ARRSES is often too responsive to change in the data pattern, thus using t + 1 allows a lag of one period, and forecast in a more conservative manner. | C2: where and are parameters between 0 and 1. Et is a smoother error term, Mt is a smoothed absolute error term | D2: (7) (8) (9) (10)

G1: =0.8 | M1: =0.55 | S1: =0.15
A2: Period t | B2: Historical Sales | C2: Forecast Ft | D2: Error ( ei ) | E2: Smoothed Error ( Et ) | F2: Absolute Smoothed Error ( Mt ) | G2: Value | I2: Forecast Ft | J2: Error ( ei ) | K2: Smoothed Error ( Et ) | L2: Absolute Smoothed Error ( Mt ) | M2: Value | O2: Forecast Ft | P2: Error ( ei ) | Q2: Smoothed Error ( Et ) | R2: Absolute Smoothed Error ( Mt ) | S2: Value
A3: 1 | B3: 253 | Q3: -5.0 | R3: 20.0
A4: 2 | B4: 171 | C4: 253.0 | D4: -82.0 | E4: -65.6 | F4: 65.6 | G4: 0.200 | I4: 253.0 | J4: -82.0 | K4: -45.1 | L4: 45.1 | M4: 0.400 | O4: 230.0 | P4: -59.0 | Q4: -13.1 | R4: 25.85 | S4: 0.750
A5: 3 | B5: 327 | C5: 236.6 | D5: 90.4 | E5: 59.2 | F5: 85.44 | G5: 1.000 | I5: 220.2 | J5: 106.8 | K5: 38.445 | L5: 79.034999999999997 | M5: 1.000 | O5: 185.75 | P5: 141.25 | Q5: 10.0525 | R5: 43.16 | S5: 0.50676982591876207
A6: 4 | B6: 249 | C6: 327.0 | D6: -78.0 | E6: -50.56 | F6: 79.488 | G6: 0.69288389513108606 | I6: 327.0 | J6: -78.0 | K6: -25.599750000000004 | L6: 78.465750000000014 | M6: 0.48643006263048022 | O6: 257.33123791102514 | P6: -8.3312379110251413 | Q6: 7.2949393133462284 | R6: 37.935685686653763 | S6: 0.23291241890639483
A7: 5 | B7: 392 | C7: 272.95505617977528 | D7: 119.04494382022472 | E7: 85.123955056179781 | F7: 111.13355505617977 | G7: 0.63607085346215797 | I7: 289.05845511482255 | J7: 102.94154488517745 | K7: 45.097962186847596 | L7: 91.927437186847612 | M7: 0.32625381137630111 | O7: 255.39078913668362 | P7: 136.60921086331638 | Q7: 26.692080045841752 | R7: 52.736714463153149 | S7: 0.19229754731737134
A8: 6 | B8: 221 | C8: 348.67607519586028 | D8: -127.67607519586028 | E8: -85.116069145452286 | F8: 124.36757116792418 | G8: 0.76596087485141884 | I8: 322.64352648257625 | J8: -101.64352648257625 | K8: -35.609856581335521 | L8: 97.271286299498371 | M8: 0.49058217619167915 | O8: 281.66040532666096 | P8: -60.660405326660964 | Q8: 13.589207239966345 | R8: 53.925268092679318 | S8: 0.50613847141522939
A9: 7 | B9: 196 | C9: 250.88119694124362 | D9: -54.881196941243616 | E9: -60.928171382085353 | F9: 68.778471786579729 | G9: 0.68439118289547085 | I9: 272.77902406495747 | J9: -76.779024064957468 | K9: -58.252898697327595 | L9: 86.00054207050087 | M9: 0.36608806088667051 | O9: 250.95784049919655 | P9: -54.95784049919655 | Q9: 3.3071500790919099 | R9: 54.080153953656897 | S9: 0.25200073584448557
A10: 8 | B10: 165 | C10: 213.32098964790663 | D10: -48.320989647906629 | E10: -50.842425994742378 | F10: 52.412486075641255 | G10: 0.88586108122823759 | I10: 244.67114002824616 | J10: -79.671140028246157 | K10: -70.032931429332805 | L10: 82.519370947260768 | M10: 0.67735501771109163 | O10: 237.10842425297517 | P10: -72.108424252975169 | Q10: -8.0051860707181515 | R10: 56.784394498554633 | S10: 6.1152748971941132E-2
A11: 9 | B11: 278 | C11: 170.51530551239358 | D11: 107.48469448760642 | E11: 75.819270391136669 | F11: 96.470252805213391 | G11: 0.9700441593510184 | I11: 190.70549356335061 | J11: 87.294506436649385 | K11: 16.497159396957407 | L11: 85.145695466424513 | M11: 0.84868474668925664 | O11: 232.69879588587074 | P11: 45.301204114129263 | Q11: -9.2275429910388951E-3 | R11: 55.061915940890827 | S11: 0.14097510665402821
A12: 10 | B12: 351 | C12: 274.78020561972482 | D12: 76.219794380275175 | E12: 76.139689582447474 | F12: 80.269886065262824 | G12: 0.78593419407976595 | I12: 264.79100964590208 | J12: 86.208990354097921 | K12: 54.838666423384694 | L12: 85.730507654644896 | M12: 0.19375212459756969 | O12: 239.08513796741602 | P12: 111.91486203258398 | Q12: 16.779385893345214 | R12: 63.589857854644798 | S12: 1.6758485122356979E-4
A13: 11 | B13: 212 | C13: 334.68394828891184 | D13: -122.68394828891184 | E13: -82.919220714639977 | F13: 114.20113584418203 | G13: 0.94854612750468681 | I13: 281.49418468641994 | J13: -69.494184686419942 | K13: -13.544401687007859 | L13: 76.800530022121166 | M13: 0.63966338149186874 | O13: 239.10389320291944 | P13: -27.103893202919437 | Q13: 10.196894028905518 | R13: 58.116963156885994 | S13: 0.26386890078760566
D16: Test Periods | I16: With =0.8, α =0.2, F1=253, and E1=M1=0, below are the example workouts:
D17: 2-11 | E17: 2-11 | F17: 2-11
D18: β =0.8 | E18: β =0.55 | F18: β =0.15 | I18: F3 =(0.2*171)+(1-0.2)*253 =236
D19: F2 =X1 | E19: F2 =X1 | F19: F2 =230 | I19: e3 =(327-236) =90.4
D20: α2 =0.2 | E20: α2 =0.4 | F20: α2 =0.75 | I20: E3 =(0.8*90.4)+((1-0.8)*(-65.6)) =59.2
D21: E1= 0 | E21: E1= 0 | F21: E1= - 5 | I21: M3 =(0.8*ABS(90.4)+((1-0.8)*65.6)) =85.4
D22: M1= 0 | E22: M1= 0 | F22: M1= 20 | I22: M2 =(0.8*ABS(-82)+((1-0.8)*0)) =65.6
A23: Mean Absolute Error: | D23: 90.671164276202873 | E23: 87.083291693812455 | F23: 44.542139027606574 | I23: 11 =(-76.1 / 80.3) =0.786
A24: Mean Squared Error: | D24: 9912.6300463397783 | E24: 8585.2088673389244 | F24: 7708.3865375025216 | I24: F11 =((0.786*351)+((1-0.786)*274.8)) =334.7

A2: Figure 1.3 Actual Sales and Forecasts Using Adaptive-response-Rate Single Exponential Smoothing (ARRSES)

A1: Single exponential smoothed value is denoted as St , and Double exponential smoothed value is denoted by Dt which will only be computed after values for St are determined. at refers to the adjustment of the St by the difference of St - Dt (meaning the adjusted smoothed estimation value for period t). The trend component bt is the estimate of the trend from one time period to another. Ft + m refers to the derivation of forecast for m periods ahead of t . The forecast for m periods ahead of t is equal to at + bt (m). Notice that at has a factor of / (1-n), whereas at in Linear Moving Average has a factor of 2 / (n-1). The reason for the difference in the two factors is because the average age of data in an n period moving average is (n-1) / 2, and the average age of data in a simple exponential smoothing is (1-) / .

A1: Table 1.3 Application of Brown's One-Parameter Linear Exponential Smoothing to forecast Sales
B2: Period t | C2: Historical Sales | D2: Single Exponential Smoothing St | E2: Double Exponential Smoothing Dt | F2: Value of a | G2: Value of b | H2: Value of a+b(m) | J2: Error Difference ei | K2: | ei | | L2: ei 2 | M2: APE
B3: 1 | C3: 125 | D3: 125.00 | E3: 125.00
B4: 2 | C4: 149 | D4: 129.80 | E4: 125.96 | F4: 133.64 | G4: 0.96000000000000085
B5: 3 | C5: 136 | D5: 131.04 | E5: 126.97600000000003 | F5: 135.10400000000001 | G5: 1.0159999999999982 | H5: 134.6
B6: 4 | C6: 157 | D6: 136.23200000000003 | E6: 128.82720000000003 | F6: 143.63680000000002 | G6: 1.8511999999999986 | H6: 136.12
B7: 5 | C7: 173 | D7: 143.58560000000003 | E7: 131.77888000000004 | F7: 155.39232000000001 | G7: 2.9516799999999961 | H7: 145.48800000000003
B8: 6 | C8: 131 | D8: 141.06848000000002 | E8: 133.63680000000005 | F8: 148.50015999999999 | G8: 1.8579199999999929 | H8: 158.34399999999999
B9: 7 | C9: 177 | D9: 148.25478400000003 | E9: 136.56039680000006 | F9: 159.94917119999999 | G9: 2.9235967999999914 | H9: 150.35807999999997
B10: 8 | C10: 188 | D10: 156.20382720000003 | E10: 140.48908288000007 | F10: 171.91857152 | G10: 3.9286860799999914 | H10: 162.87276799999998
B11: 9 | C11: 154 | D11: 155.76306176000003 | E11: 143.54387865600006 | F11: 167.98224486399999 | G11: 3.0547957759999917 | H11: 175.84725759999998
B12: 10 | C12: 179 | D12: 160.41044940800003 | E12: 146.91719280640007 | F12: 173.9037060096 | G12: 3.3733141503999917 | H12: 171.03704063999999 | J12: 7.9629593600000135 | K12: 7.9629593600000135 | L12: 63.408721769011827 | M12: 4.4485806480447003
A13: T | B13: 11 | C13: 180 | D13: 164.32835952640002 | E13: 150.39942615040007 | F13: 178.25729290239997 | G13: 3.4822333439999866 | H13: 177.27702016000001 | J13: 2.7229798399999936 | K13: 2.7229798399999936 | L13: 7.4146192090463909 | M13: 1.5127665777777741
A14: E | B14: 12 | C14: 150 | D14: 161.46268762112001 | E14: 152.61207844454407 | F14: 170.31329679769595 | G14: 2.2126522941439859 | H14: 181.73952624639995 | J14: -31.739526246399947 | K14: 31.739526246399947 | L14: 1007.3975263459112 | M14: 21.159684164266633
A15: S | B15: 13 | C15: 182 | D15: 165.57015009689601 | E15: 155.20369277501447 | F15: 175.93660741877756 | G15: 2.5916143304703851 | H15: 172.52594909183995 | J15: 9.4740509081600521 | K15: 9.4740509081600521 | L15: 89.757640610408302 | M15: 5.2055224770110176
A16: T | B16: 14 | C16: 192 | D16: 170.85612007751683 | E16: 158.33417823551497 | F16: 183.3780619195187 | G16: 3.1304854605004664 | H16: 178.52822174924793 | J16: 13.471778250752067 | K16: 13.471778250752067 | L16: 181.48880923743641 | M16: 7.0165511722667011
B17: 15 | C17: 224 | D17: 181.48489606201349 | E17: 162.96432180081467 | F17: 200.00547032321231 | G17: 4.6301435652997043 | H17: 186.50854738001917 | J17: 37.491452619980834 | K17: 37.491452619980834 | L17: 1405.6090195562676 | M17: 16.737255633920014
B18: 16 | C18: 178 | D18: 180.78791684961078 | E18: 166.52904081057389 | F18: 195.04679288864767 | G18: 3.564719009759223 | H18: 204.63561388851201 | J18: -26.635613888512012 | K18: 26.635613888512012 | L18: 709.45592721789399 | M18: 14.963828027253939
A19: P | B19: 17 | C19: 198 | D19: 184.23033347968862 | E19: 170.06929934439685 | F19: 198.3913676149804 | G19: 3.5402585338229429 | H19: 198.61151189840689 | J19: -0.61151189840688858 | K19: 0.61151189840688858 | L19: 0.37394680189319679 | M19: 0.30884439313479223
A20: E | B20: 18 | C20: 206 | D20: 188.58426678375093 | E20: 173.77229283226768 | F20: 203.39624073523419 | G20: 3.7029934878708133 | H20: 201.93162614880333 | J20: 4.0683738511966681 | K20: 4.0683738511966681 | L20: 16.55166579310081 | M20: 1.9749387627168293
A21: R | B21: 19 | C21: 156 | D21: 182.06741342700076 | E21: 175.43131695121428 | F21: 188.70350990278723 | G21: 1.6590241189466184 | H21: 207.09923422310499 | J21: -51.099234223104986 | K21: 51.099234223104986 | L21: 2611.1317381877438 | M21: 32.755919373785247
A22: I | B22: 20 | C22: 248 | D22: 195.25393074160061 | E22: 179.39583970929155 | F22: 211.11202177390967 | G22: 3.9645227580772655 | H22: 190.36253402173384 | J22: 57.637465978266164 | K22: 57.637465978266164 | L22: 3322.0774843957897 | M22: 23.240913700913776
A23: O | B23: 21 | C23: 228 | D23: 201.80314459328051 | E23: 183.87730068608937 | F23: 219.72898850047164 | G23: 4.4814609767977842 | H23: 215.07654453198694 | J23: 12.92345546801306 | K23: 12.92345546801306 | L23: 167.01570123371667 | M23: 5.6681822228127459
A24: D | B24: 22 | C24: 231 | D24: 207.64251567462441 | E24: 188.63034368379638 | F24: 226.65468766545243 | G24: 4.7530429977070057 | H24: 224.21044947726944 | J24: 6.7895505227305648 | K24: 6.7895505227305648 | L24: 46.097996300710889 | M24: 2.9391993604894218
A25: S | B25: 23 | C25: 175 | D25: 201.11401253969953 | E25: 191.12707745497704 | F25: 211.10094762442202 | G25: 2.4967337711806223 | H25: 231.40773066315944 | J25: -56.407730663159441 | K25: 56.407730663159441 | L25: 3181.8320785675378 | M25: 32.232988950376821
B26: 24 | C26: 224 | D26: 205.69121003175965 | E26: 194.03990397033357 | F26: 217.34251609318574 | G26: 2.9128265153565209 | H26: 213.59768139560265 | J26: 10.402318604397351 | K26: 10.402318604397351 | L26: 108.20823234739126 | M26: 4.6438922341059605
B27: 25 | H27: 220.25534260854226 | I27: m=1 | J27: -3.5492315160865076 | K27: 329.43800232308001 | L27: 12917.821107573858 | M27: 174.80906769887636
B28: 26 | H28: 223.16816912389879 | I28: m=2
B29: 27 | H29: 226.08099563925529 | I29: m=3
B30: 28 | H30: 228.99382215461182 | I30: m=4
B31: 29 | H31: 231.90664866996835 | I31: m=5
B32: 30 | H32: 234.81947518532485 | I32: m=6
B34: Descriptive Statistics Analysis: | E34: Values:
B35: Mean Error | E35: =K27/COUNT(K12:K26) -> -0.23661543440576718
B36: Mean Absolute Error | E36: =L27/COUNT(L12:L26) -> 21.962533488205334
B37: MAPE | E37: =N27/COUNT(N12:N26) -> 11.653937846591758
B38: MSE | E38: =M27/COUNT(M12:M26) -> 861.1880738382572
B39: Std Deviation of Error | E39: =SQRT(M27/(COUNT(M12:M26)-1)) -> 30.376002167563904

B1: Download worksheet here.

B1: In Table 1.3 the initializing value for is 0.2 and to forecast one period ahead. At t =1, values of St-1 and Dt-1 are not known, but they must be initialized at the outset. In this example, I simply take value of Xt =St =Dt. Alternatively, there are other ways you can initialize the values, for example, by taking some average of the first few data points. A point to note of initialization procedure - if the smoothing parameter is close to 0, the influence of the initialization process would allow trailing and not lagging by too much smoothing effect for many time periods ahead. Below are examples of the equation workout. S2 =X2 + (1-)S1 =(0.2*149)+((1-0.2)*125) =129.8 D2 =S2 + (1-)D1 =(0.2*129.8)+((1-0.2)*125) =125.96 a2 =2S2 - D2 =(2*129.8)-126 =133.64 b2 = /(1-) (S2 - D2) =(0.2/0.8)*(129.8-126) =0.960 F25 =a24 + b24(1) =217.3+(2.913*1) =220.3 F30 =a24 + b24(6) =217.3+(2.913*6) =234.8
A2: Figure 1.4 Applying Forecasts Using Brown's One-Parameter Exponential Smoothing.

A1: St in equation (16) smooths the data by helping to eliminate the lag and brings St to the approximate base of the current data value. Next bt updates the trend, which is expressed as the difference between the last two smoothed values. This is appropriate because if there is a trend in the data, new values should be higher or lower than the previous ones. The constant then smooth some of the randomness remaining in the trend in the last period (St - St - 1), adding that to the previous estimate of the trend, multiplied by (1 - ).
A3: Table 1.3 shows the application of this method to a series with trend, using = 0.2 and = 0.3. To initialize the values, just remember Holt's linear exponential smoothing requires two estimates - to get the smoothed value for St and to get bt to smooth the trend. In this case, I let S1=X1=145, and the trend b1=X2 - X1 =5.
A4: Download worksheet.

A1: Table 1.3 Application of Holt's Two-Parameter Linear Exponential Smoothing ( =0.2, =0.3)
B2: Period t | C2: Historical Sales Xt | D2: Smoothing Data St | E2: Smoothing Trend bt | F2: Forecast F t +m when m=1 | H2: ei | I2: | ei | | J2: ei 2 | K2: APE
B3: 1 | C3: 145 | D3: 145.00 | E3: 5.000
B4: 2 | C4: 150 | D4: 150.00 | E4: 5.000
B5: 3 | C5: 161 | D5: 156.20 | E5: 5.360 | F5: 155.00
B6: 4 | C6: 138 | D6: 156.84799999999998 | E6: 3.9463999999999966 | F6: 161.56
B7: 5 | C7: 142 | D7: 157.03551999999999 | E7: 2.8187359999999995 | F7: 160.79439999999997
B8: 6 | C8: 192 | D8: 166.2834048 | E8: 4.7474806400000018 | F8: 159.85425599999999
B9: 7 | C9: 142 | D9: 165.22470835199999 | E9: 3.0056275135999995 | F9: 171.03088543999999
B10: 8 | C10: 141 | D10: 162.78426869248 | E10: 1.3718073616640005 | F10: 168.23033586559998
B11: 9 | C11: 162 | D11: 163.72486084331521 | E11: 1.2424427984153648 | F11: 164.15607605414399
B12: 10 | C12: 180 | D12: 167.97384291338446 | E12: 2.1444045799115292 | F12: 164.96730364173058 | H12: 15.032696358269419 | I12: 15.032696358269419 | J12: 225.98195979992664 | K12: 8.3514979768163435
A13: T | B13: 11 | C13: 152 | D13: 166.49459799463682 | E13: 1.0573097303137786 | F13: 170.118247493296 | H13: -18.118247493295996 | I13: 18.118247493295996 | J13: 328.27089222832666 | K13: 11.919899666642102
A14: E | B14: 12 | C14: 158 | D14: 165.64152617996049 | E14: 0.48419526681674713 | F14: 167.55190772495061 | H14: -9.5519077249506097 | I14: 9.5519077249506097 | J14: 91.238941185971129 | K14: 6.0455112183231705
A15: S | B15: 13 | C15: 191 | D15: 171.10057715742181 | E15: 1.9766519800101179 | F15: 166.12572144677725 | H15: 24.874278553222751 | I15: 24.874278553222751 | J15: 618.72973354331737 | K15: 13.0231824885983
A16: T | B16: 14 | C16: 178 | D16: 174.06178330994553 | E16: 2.2720182317641973 | F16: 173.07722913743191 | H16: 4.9227708625680862 | I16: 4.9227708625680862 | J16: 24.233672965349339 | K16: 2.7656016081843182
B17: 15 | C17: 156 | D17: 172.26704123336782 | E17: 1.0519901392616264 | F17: 176.33380154170973 | H17: -20.333801541709732 | I17: 20.333801541709732 | J17: 413.46348513763706 | K17: 13.034488167762648
B18: 16 | C18: 203 | D18: 179.25522509810355 | E18: 2.832848256903858 | F18: 173.31903137262944 | H18: 29.680968627370561 | I18: 29.680968627370561 | J18: 880.95989865895547 | K18: 14.621166811512593
B19: 17 | C19: 224 | D19: 190.47045868400593 | E19: 5.3475638556034149 | F19: 182.0880733550074 | H19: 41.911926644992604 | I19: 41.911926644992604 | J19: 1756.609595095241 | K19: 18.710681537943127
A20: P | B20: 18 | C20: 210 | D20: 198.6544180316875 | E20: 6.1984825032268596 | F20: 195.81802253960936 | H20: 14.181977460390641 | I20: 14.181977460390641 | J20: 201.12848468702816 | K20: 6.7533226001860198
A21: E | B21: 19 | C21: 189 | D21: 201.68232042793153 | E21: 5.2473084711320102 | F21: 204.85290053491437 | H21: -15.852900534914369 | I21: 15.852900534914369 | J21: 251.31445536988829 | K21: 8.3877780608012529
A22: R | B22: 20 | C22: 212 | D22: 207.94370311925084 | E22: 5.5515307371881999 | F22: 206.92962889906354 | H22: 5.0703711009364554 | I22: 5.0703711009364554 | J22: 25.708663101211563 | K22: 2.3916844815737996
A23: I | B23: 21 | C23: 190 | D23: 208.79618708515125 | E23: 4.1418167058018609 | F23: 213.49523385643903 | H23: -23.495233856439029 | I23: 23.495233856439029 | J23: 552.02601396875878 | K23: 12.365912556020541
A24: O | B24: 22 | C24: 198 | D24: 209.95040303276249 | E24: 3.2455364783446772 | F24: 212.9380037909531 | H24: -14.938003790953104 | I24: 14.938003790953104 | J24: 223.1439572585293 | K24: 7.5444463590672237
A25: D | B25: 23 | C25: 228 | D25: 216.15675160888574 | E25: 4.1337801076782483 | F25: 213.19593951110718 | H25: 14.804060488892816 | I25: 14.804060488892816 | J25: 219.1602069587974 | K25: 6.4930089863564984
B26: 24 | C26: 239 | D26: 224.03242537325121 | E26: 5.2563482046844152 | F26: 220.29053171656398 | H26: 18.709468283436024 | I26: 18.709468283436024 | J26: 350.04420344889854 | K26: 7.8282294072954075
B27: 25 | F27: 229.28877357793564 | G27: m=1 | H27: 66.898423437816518 | I27: 271.4786133223422 | J27: 6162.0141634078373 | K27: 140.23641192708334
B28: 26 | F28: 234.54512178262004 | G28: m=2
B29: 27 | F29: 239.80146998730447 | G29: m=3
B30: 28 | F30: 245.05781819198887 | G30: m=4
B31: 29 | F31: 250.3141663966733 | G31: m=5
B32: 30 | F32: 255.5705146013577 | G32: m=6
B35: S23 =0.2(X23)+((1 - 0.2)(S22+b22) | H35: Descriptive Statistics Analysis: | K35: Values:
B36: S23 =0.2*(228)+(0.8*(209.95+3.25)) =216.16 | H36: Mean Error | K36: 4.4598948958544344
B37: b23 =0.3(S23 - S22)+((1 - 0.3)b22 | H37: Mean Absolute Error | K37: 18.098574221489478
B38: b23 =0.3(216.16 - 209.95)+(0.7*(3.25)) =4.138 | H38: Mean Abs. Percentage Error (MAPE) | K38: 9.3490941284722222
B39: F24 =S23+b23(1) =216.16+4.138 =220.29 | H39: Mean Squared Error (MSE) | K39: 410.80094422718918
B40: F27 =S24+b24(3) =224.03+(5.256*3) =239.80 | H40: Std Deviation of Error | K40: 20.979606021440095
A43: Figure 1.5 Applying Forecasts to Sales Using Holt's Two-Parameter Linear Exponential Smoothing.