A2: Descriptive Statistics Analysis Single & Multiple Moving Averages Single & Multiple-Parameters Exponential Smoothing Exponential Smoothing with Seasonality Methods | B2: Decomposition Methods Simple and Multiple Regression Analysis Box-Jenkins (ARIMA) Models Multivariate Data Analysis | C2: Home | About me
A4: Descriptive Statistics Analysis Quantitative forecasts are based on data, or observations. A single observation or actual value can be represented by a variable, Xi ,for example, actual sales $ booked. The objective of forecasting then is to predict the future value of X. Individual forecasts can be denoted by variable Fi ,and the error denoted by ei which is the difference between actual and forecast value for observation i, for example: ei = Xi - Fi . In both time-series and casual forecasting, the variable time interval t denotes the present time period, t - 1 last period, t - 2 two periods ago, and so on. Forecasts are for time periods t + 1, t + 2 ... t + m. For the rest of these sections, I will use the following notations. Univariate data analysis explores each variable in a data set, separately. It looks at the range of values, as well as the central tendency of the values. It describes the pattern of response to the variable. It describes each variable on its own. Descriptive statistics describe and summarize data. Both Univariate and Bivariate descriptive statistics describe individual variables for the central tendency, variability or dispersion, and shape of the overall distribution. Bivariate descriptive statistics (e.g., ANOVA, t-tests) often involve more than one quantitative variable being collected and examined. For example, data collected from customers contains kg, feet, locations, dollars spend/week, Return Memo/week. summarizing such data in a way that is analogous to summarizing univariate (single variable) data. Multivariate descriptive statistics refers to any statistical technique used to analyze data that arises from more than one variable at a time. Multivariate data analysis is about separating the signal from the noise in data with many variables and presenting the results as easily interpretable plots summarizing the essential information. This essentially models reality where each situation, product, or decision involves more than a single variable. A wide range of methods is used for the analysis of multivariate data such as Regression Analysis, Correspondence Analysis, Factor Analysis, Multidimensional Scaling, and Cluster Analysis. Go To Top Table 1.1 above contains both univariate and bivariate data set with values in kilogram, and below are their commonly used descriptive statistics. Table 1.3 Single Time Series lagged On Itself To Determine The Auto-Covariance and Auto-Correlation Table 1.3 above is a time series of 20 "equally spaced" data points, denoted by t time period. Each individual data element is referred to as Xt. The mean for the series is x-bar. The data is generated randomly. (hint: you can use this formula to generate a series of random numbers, =INT((85-5+1)* RAND()+5); for this case, I used max=85 and min=5). First, I copy a duplicate of this complete time series to column C but offset by a period of one (time lag k=1). Next I do it similarly in column D and E, lagging the time series by a period each until k=3. Column F is the deviation from the mean. Column G, H, I are basically lagging the deviation of the mean in column F by a lag of one period each. Column J is deviation of the mean squared. Column K is multiplying column F by column G, lagging by one period; column L is column F times column H for 2 periods lagging, and column M is column F times column I for a 3 periods lagging. The calculation of autocovariance and autocorrelation, with one-period lag, is using the following equation:
A5: This site was created in February 2007. contact Tan, William email: vbautomation@yahoo.com

A1: Business Forecasting Methods and Techniques

B1: Univariate data Bivariate data Multivariate data Mean Median Range Deviation from the Mean Mean Absolute Deviation Sum of Squared Deviations Mean Squared Deviation Mean Error Mean Absolute Error | C1: Sum of Squared Errors Mean Squared Error Standard Deviation Errors Percentage Error Mean Percentage Error Mean Absolute Percentage Error Variance Covariance Degree of freedom Correlation Coefficient Root Mean Square Standard Deviation | D1: Standard Error of the Mean Coefficient of Variation Skewness Kurtosis or Kurt(X) Least-Squares Fitting Autocovariance Autocorrelation U-Statistic Demand Forecast Accuracy

B1: Observed | C1: Historical | D1: Present | E1: Forecasted
A2: Values | B2: X1, X2 ... Xn | C2: Xt - n ... Xt - 2, Xt - 1 | D2: Xt | E2: Ft + 1 Ft + 2 ... Ft + m
A3: Period i | B3: 1, 2 ... 4 | C3: t - m ... t - 2, t - 1 | D3: t | E3: t + 1, t + 2 ... t + m
A4: Estimated values | B4: F1, F2 ... Fn | C4: F - n ... F - 2, F - 1 | D4: Ft
A5: Error | B5: e1, e2 ... en | C5: et - n ...et - 2, et - 1 | D5: et

-1: Univariate and Bivariate Data Analysis
A0: A | B0: B | C0: C | D0: D | E0: E | F0: F | G0: =B2-C2 -> G | H0: =ABS(G2) -> H | I0: 29446.560000000001
1: 1 | A1: Week | B1: Meat sold in Kilogram | C1: Forecast in feet | D1: Deviation From Mean =ai | E1: Squared Error | F1: Cubed Deviation | G1: Deviation From Mean =ei | H1: Squared Error ei2 | I1: ai (ei)
2: 2 | A2: 41 | B2: 3290.8 | C2: 3119.2 | D2: -1019.73 | E2: 1039849.27 | F2: -1060365499.05 | G2: =B2-C2 -> -1173.93 | H2: =ABS(G2) -> 1378111.64 | I2: 29446.560000000001
3: 3 | A3: 42 | B3: 3536.7 | C3: 3407.1 | D3: -773.83 | E3: 598812.87 | F3: -463379362.34 | G3: =B3-C3 -> -886.03 | H3: =ABS(G3) -> 785049.161 | I3: 685636.59
4: 4 | A4: 43 | B4: 3902 | C4: 4073 | D4: -408.53 | E4: 166896.76 | F4: -68182333.73 | G4: =B4-C4 -> -220.13 | H4: =ABS(G4) -> 48457.2169 | I4: 89929.71
5: 5 | A5: 44 | B5: 4145 | C5: 4378.9 | D5: -165.53 | E5: 27400.18 | F5: -12796484.220000001 | G5: =B5-C5 -> 85.77 | H5: =ABS(G5) -> 7356.4929 | I5: -14197.51
6: 6 | A6: 45 | B6: 4205 | C6: 4498.9 | D6: -105.53 | E6: 11136.58 | F6: -25386262.02 | G6: =B6-C6 -> 205.77 | H6: =ABS(G6) -> 42341.2929 | I6: -21714.91
7: 7 | A7: 46 | B7: 4387.9 | C7: 4199 | D7: 77.369999999999891 | E7: 5986.12 | F7: 6740558.3700000001 | G7: =B7-C7 -> -94.13 | H7: =ABS(G7) -> 8860.4569 | I7: -7282.84
8: 8 | A8: 47 | B8: 4687.8 | C8: 4498.9 | D8: 377.27 | E8: 142332.65 | F8: 6740558.3700000001 | G8: =B8-C8 -> 188.90000000000055 | H8: =ABS(G8) -> 188.90000000000055 | I8: 77630.85
9: 9 | A9: 48 | B9: 4768.8 | C9: 4498.9 | D9: 458.27 | E9: 210011.39 | F9: 19661138.100000001 | G9: =B9-C9 -> 269.90000000000055 | H9: =ABS(G9) -> 269.90000000000055 | I9: 94298.22
10: 10 | A10: 49 | B10: 4936.2 | C10: 4798.8 | D10: 625.67 | E10: 391462.95 | F10: 244926623.24 | G10: =B10-C10 -> 505.67 | H10: =ABS(G10) -> 255702.149 | I10: 316382.55
11: 11 | A11: 50 | B11: 5245.1 | C11: 5458.6 | D11: 934.57000000000062 | E11: 873421.08 | F11: -9731810.3800000008 | G11: =B11-C11 -> 1165.47 | H11: =ABS(G11) -> 1358320.32 | I11: 1089213.30
B12: 43105.3 | C12: 42931.3 | D12: 934.57000000000062 | E12: 3467309.86 | F12: -9731810.3800000008 | G12: =B11-C11 -> 0 | H12: =ABS(G11) -> 3968881.32 | I12: 3506987.60
13: Table 1.1 Statistical Computation for Univariate Data

A1: Mean, , of volume sold for the past 10 weeks | B1:  = | C1: = 43105.3/10 = 4,310.53 kg
A2: Median (or the middle value) | B2: = | C2: =5.5, which is value at the 5.5th position =(4205+4387.9)/2 =4296.45 or, =MEDIAN(B2:B11)
A3: Range | B3: = | C3: Max - Min =MAX(B2:B11)-MIN(B2:B11) =1954.3 kg The range is very sensitive to extreme scores since it is based on only two values. It should almost never be used as the only measure of spread or dispersion, but can be informative if used as a supplement to other measures of spread such as the standard deviation or semi-interquartile range.
A4: Deviation from the Mean | B4: Xi -  | C4: Note: sum of the deviations always equal to zero, so they should be squared.
A5: Mean Absolute Deviations (MAD) | B5: MAD = | C5: =SUMPRODUCT(ABS(D2:D11))/COUNT(A2:A11) =494.63 kg
A6: Sum of Squared Deviations (SSD) | B6: SSD = | C6: =3,467,309.86 kg
A7: Mean Squared Deviation (MSD) | B7: MSD = | C7: =346,730.98 kg. It is also called the Maximum Likelihood Estimate (MLE).
A8: Variance, var (x) or S2, is the sum of squared deviations divided by the degrees of freedom | B8: S2 = | C8: =SUM(E2:E11)/(COUNT(A2:A11)-1) =385,256.65 kg
A9: The degrees of freedom (df) can be defined as the number of data points minus the number of parameters estimated (which is 1 in the data kilograms) S2 is closely related to MSD, and because it has a smaller denominator, its value is always larger than MSD. Variance S2 is an unbiased estimator of this sample sales variance, whereas MSD is a biased estimator of the sample data variance. (If the mean value of an estimator equals the true value of the quantity it estimates, the estimator is called an unbiased estimator. An estimator is a biased estimator if its expected value is not equal to the value of the population parameter being estimated). The variance, standard deviation, standard error, as well as the range, all are measuring variability. Go To Top
A10: Covariance, Covxy | B10: cov(x,F) = | C10: =3506987.60 / 9 =389665.29 kg-feet
A11: Covariance is the measure of how much two variables change together. The covariance becomes more positive for each pair of values which differ from their mean in the same direction. The covariance becomes more negative with each pair of values which differ from their mean in opposite directions (in another word, if one of them tends to be above its expected value when the other variable is below its expected value. (Variance is a special case of the Covariance when the two variables are identical). Note that the units of covariance, kg-feet, is difficult to interpret. Hence we want to compute the correlation coefficient from Pearson's r which takes care of this scaling problem as described below. If Covariance is divided by the two standard deviations, then the units in the numerator and denominator cancel, leaving with dimensionless number, which will be Pearson's r, the Correlation Coefficient as shown below. Dividing the covariance by the two standard deviations restricts the range r to the interval -1 to +1.
A12: Pearson's product-moment Correlation Coefficient ("ρ" when it is measured in the population and " r " when it is measured in a sample) is a measure of the strength of the linear relationship between two variables. If the relationship between the variables is not linear, then the correlation coefficient does not adequately represent the strength of the relationship between the variables. Simply put it, Correlation Coefficient is the covariance of the deviations of the variables from their means, expressed in terms of their respective standard deviations. Pearson's r can range from -1 to 1. An r of -1 indicates a perfect negative linear relationship between variables, an r of 0 indicates no linear relationship between variables, and an r of 1 indicates a perfect positive relationship between variables. With real data, you would not expect to get values of r of exactly -1, 0, or -1. Pearson's correlation is symmetric in the sense that the correlation of X with Y is the same as the correlation of Y with X. A critical property of Pearson's r is that it is unaffected by linear transformations - which means that multiplying a variable by a constant and/or adding a constant does not change the correlation of that variable with other variables. If Y is the transformed value of X, then Y = mX + b. Go To Top
A13: Pearson's Correlation Coefficient, r | B13: r | C13: =SUMPRODUCT((D2:D11),(G2:G11))/SQRT(E12*H12) =3506987.6 / 3709628.2 =0.945
A14: Root Mean Square (RMS) | B14: RMS = | C14: =SQRT(SUM(E2:E11)/COUNT(A2:A11)) =588.84 kg
A15: Standard Deviation (SD) denoted by σ | B15: SD = | C15: =SQRT(SUM(E2:E11)/(COUNT(A2:A11)-1)) =620.69 kg.
A16: Standard Deviation is a measure of the variability or dispersion of a population or a data set. A low standard deviation indicates that the data points tend to be very close to the the mean, while high standard deviation means the data are spread out over a large range of values. It is also commonly used to measure confidence in statistical conclusions
A17: Standard Error of the Mean (SEM) | B17: = | C17: =STDEV(B2:B11)/SQRT(COUNT(B2:B11)) or, STDEV(B2:B11)/(10^(1/2)) =196.280
A18: SEM is the standard deviation of the error in the sample mean relative to the true mean, since the sample mean is an "unbiased estimator". It is also the standard deviation of the sample mean estimate of a population mean. The standard error of the mean is a "biased estimator" of the population standard error.
A19: Coefficient of Variation (CV) | B19: CVX = CVF= | C19: =(620.69/4310.53)*100 =14.399 =( 664.07/4293.13) =15.468 =SQRT(SUM(H2:H11)/(COUNT(A2:A11)-1)) =664.07 kg =SUM(C2:C11)/COUNT(A2:A11) =4293.13 kg
A20: This coefficient provides a unitless measure of the variation of the distribution, by translating it into a percentage of the mean value. This CV value can be used when comparing two parameter samples that have different means and standard deviations. When the mean is close to 0, the CV value becomes of little use.
A21: Skewness | B21: Skew = | C21: = SUMPRODUCT((D2:D11)^3)/(COUNT(D2:D11)-1)*(SQRT(SUM(E2:E11)/(COUNT(E2:E11)-1))^3) = (-386035317.05) / 9*(620.69)3 = −0.179 Excel, however, uses a slightly different equation for skewness, as shown below. Using Excel's Data Analysis Tool, I obtain the value −0.224. The two results are pretty close.
A22: On the right, the positively skewed distribution curve rises rapidly, reaches the maximum and falls slowly; and the tail as well as median on the right-hand side. A negatively skewed distribution curve rises slowly, reaches its maximum and falls rapidly, and the tail as well as the median are on the left-hand side.
A23: Standard Error of Skewness | B23: = | C23: =SQRT(6/10) =0.775
A24: Measures using Skewness and Kurtosis help to decide normality. Skewness measure indicates the level of non-symmetry. If the distribution of the data are symmetric, then skewness will be close to zero. How can we tell if the skewness is large enough to be a concern? This can be checked using a measure of the standard error of skewness. If the skewness is more than twice this amount, in this case 1.549, then it indicates that the distribution of the data is non-symmetric. However, this does not indicate that the sales data are normally distributed. If Skew is >0, the distribution has a pronounced right tail; whereas if Skew is <0, then the distribution will have a left tail. The sales data distribution shows a negative skewness because the negative deviations dominate the positive deviations, when cubed. Go To Top
A25: Kurtosis or Kurt(X) | B25: Kurt(X) = | C25: this the Kurtosis formula, but Excel is using a different formula as shown below. =KURT(B2:B11) = −0.738
A26: Kurtosis is a measure of the peakedness and flatness of the data distribution. Again, for normally distributed data, the kurtosis is zero. Heavier tailed distributions have larger kurtosis measures. The normal distribution has a kurtosis of 0 irrespective of its mean or standard deviation. Positive kurtosis indicates a relatively peaked distribution. Negative kurtosis indicates a relatively flat distribution. As with skewness, if the value of kurtosis is too big or too small, there is concern about the normality of the distribution. In this case, a rough formula for the Standard Error of Kurtosis is =SQRT(24/N) = 0.1.549. Twice this amount is 3.099. Go To Top
A27: Least-Squares Fitting Technique Least-Squares Method is used to find the best-fitting curve to a given set of data, x1...xn by minimizing the sum of the squares of the offsets ("the residuals", also called the Sum of Squared Errors or Deviations, SSD) of the points from the curve. Because the sum of the squares of the offsets is used instead of the offset absolute values, outlying points can have a disproportionate effect on the fit, a property which may or may not be desirable depending on the problem at hand. Least-Squares Method can be linear and non-linear, and categorized further as ordinary least squares (OLS), weighted least squares (WLS), and alternating least squares (ALS). Ordinary Linear Least Squares (LLS) fitting technique is the simplest and most commonly applied form of linear regression and provides a solution to the problem of finding the best fitting straight line through a set of points. Although Excel can plot a trend line instantly for your graphs, but let's use this LLS method as an example to understand the logic and calculation of the coefficients and a straight line that best fits the historical data in Table 1.2 .The equation for the line is: y = mx + b where the dependent y-value is a function of the independent x-values. The m-values are coefficients corresponding to each x-value, and b is a constant value. Note that y, x, and m can be vectors. Let X be the number of hours that employees clocked in for work in a typical month, Y be the total units of production output recorded, and there were 11 employees' sample data collected for analysis. Go To Top Table 1.2 Ordinary Least Square Fitting Method to find the best linear Line fit on the bivariate data
A28: Mean of total hours worked Mean of the monthly output | B28:  =  = | C28: SUM(B2:B12)/COUNT($B$2:$B$12) =250.09 SUM(C2:C12)/COUNT($B$2:$B$12) =23271.55
A29: The slope m The intercept, b Linear Least Squares line LLS | B29: m = b = f (X) = | C29: =539981.45 / 8444.91 =63.942 or, use this =INDEX(LINEST(C$2:C$12,B$2:B$12),1)  - m () =23271.55 - 63.942(250.09) =7280.3 or, use this =INDEX(LINEST(C$2:C$12,B$2:B$12),2) mx + b =63.942x + 7280.3

A2: A perfect linear relationship, Pearson's r = 1 | B2: A perfect negative linear relationship, Pearson's r = -1 Note that as X increases, Y decreases. | C2: Scatter plot shows that there is no linear relationship between the variables, Pearson's r = 0.

C1: Pearson's r formula is designed so that the correlation between kilogram and feet (in Table 1.1) is the same whether ’forecast’ is measured in kilogram or in feet. The value of Pearson's correlation coefficient computed from Table 1.1, is 0.945. So there is a substantial correlation of 0.945 between kilogram and feet, which means there is a strong positive association between the two different set of variables. Hence, the scatter plot chart on the left reveals a strong positive linear relationship between the two variables set. Covariance and Correlation are closely related statistics to each other in bivariate and especially multivariate data sets. Care must be taken that they are only for measures of linear association and not appropriate for a curvilinear relationship.
B2: Figure 1.0 Scatter Plot Sales and Forecast

B1: L = Lipto Kurtic (Kurtosis > 0) M = Meso kurtic (Kurtosis = 0) or a normal distribution P = Platy kurtic (Kurtosis < 0) Kurtosis has its origin in the Greek word "Bulginess." Kurtosis is measured relative to the ’peakedness’ or ’flatness’ of the normal curve. It tells us the extent to which a distribution is more peaked or flat-topped than the normal curve.

A0: A | B0: B | C0: C | D0: D | E0: E | F0: F | G0: G
1: 1 | B1: Monthly Hrs Worked, Xi | C1: Monthly Output, Yi | D1: Deviation from Mean | E1: Deviation from Mean | I1: Figure 1.1 Using Linear Least Squares Method to find the best line of ’Fit’ from the example on the left.
2: 2 | B2: 195 | C2: 21816 | D2: =B2-$B$14 -> -55.090909090909093 | E2: =C2-$C$14 -> -1455.5454545454559 | F2: =D2*E2 -> 80187.32231404967 | G2: =D2^2 -> 3035.0082644628101 | H2: =D2^2 -> 3035.0082644628101
3: 3 | B3: 279 | C3: 26893 | D3: =B3-$B$14 -> 28.909090909090907 | E3: =C3-$C$14 -> 3621.4545454545441 | F3: =D3*E3 -> 104692.95867768591 | G3: =D3^2 -> 835.73553719008248 | H3: =D3^2 -> 835.73553719008248
4: 4 | B4: 224 | C4: 20528 | D4: =B4-$B$14 -> -26.090909090909093 | E4: =C4-$C$14 -> -2743.5454545454559 | F4: =D4*E4 -> 71581.595041322362 | G4: =D4^2 -> 680.73553719008282 | H4: =D4^2 -> 680.73553719008282
5: 5 | B5: 237 | C5: 20665 | D5: =B5-$B$14 -> -13.090909090909093 | E5: =C5-$C$14 -> -2606.5454545454559 | F5: =D5*E5 -> 34122.049586776884 | G5: =D5^2 -> 171.37190082644634 | H5: =D5^2 -> 171.37190082644634
6: 6 | B6: 219 | C6: 21302 | D6: =B6-$B$14 -> -31.090909090909093 | E6: =C6-$C$14 -> -1969.5454545454559 | F6: =D6*E6 -> 61234.958677685994 | G6: =D6^2 -> 966.6446280991737 | H6: =D6^2 -> 966.6446280991737
7: 7 | B7: 252 | C7: 24420 | D7: =B7-$B$14 -> 1.9090909090909065 | E7: =C7-$C$14 -> 1148.4545454545441 | F7: =D7*E7 -> 2192.5041322313996 | G7: =D7^2 -> 3.644628099173544 | H7: =D7^2 -> 3.644628099173544
8: 8 | B8: 256 | C8: 22315 | D8: =B8-$B$14 -> 5.9090909090909065 | E8: =C8-$C$14 -> -956.54545454545587 | F8: =D8*E8 -> -5652.3140495867819 | G8: =D8^2 -> 34.917355371900797 | H8: =D8^2 -> 34.917355371900797
9: 9 | B9: 264 | C9: 19595 | D9: =B9-$B$14 -> 13.909090909090907 | E9: =C9-$C$14 -> -3676.5454545454559 | F9: =D9*E9 -> -51137.404958677696 | G9: =D9^2 -> 193.46280991735529 | H9: =D9^2 -> 193.46280991735529
10: 10 | B10: 254 | C10: 25294 | D10: =B10-$B$14 -> 3.9090909090909065 | E10: =C10-$C$14 -> 2022.4545454545441 | F10: =D10*E10 -> 7905.9586776859396 | G10: =D10^2 -> 15.280991735537169 | H10: =D10^2 -> 15.280991735537169
11: 11 | B11: 285 | C11: 25989 | D11: =B11-$B$14 -> 34.909090909090907 | E11: =C11-$C$14 -> 2717.4545454545441 | F11: =D11*E11 -> 94863.867768594995 | G11: =D11^2 -> 1218.6446280991734 | H11: =D11^2 -> 1218.6446280991734
12: 12 | B12: 286 | C12: 27170 | D12: =B12-$B$14 -> 35.909090909090907 | E12: =C12-$C$14 -> 3898.4545454545441 | F12: =D12*E12 -> 139989.95867768591 | G12: =D12^2 -> 1289.4628099173551 | H12: =D12^2 -> 1289.4628099173551
13: 13 | A13: Total | B13: =SUM(B2:B12) -> 2751 | C13: =SUM(C2:C12) -> 255987 | D13: =SUM(D2:D12) -> 0 | E13: =SUM(E2:E12) -> -1.4551915228366852E-11 | F13: =SUM(F2:F12) -> 539981.45454545459 | G13: =SUM(G2:G12) -> 8444.9090909090901 | H13: =SUM(G2:G12) -> 8444.9090909090901
14: 14 | A14: Mean | B14: =SUM(B2:B12)/COUNT($B$2:$B$12) -> 250.09090909090909 | C14: =SUM(C2:C12)/COUNT($B$2:$B$12) -> 23271.545454545456 | D14: =SUM(D2:D12)/COUNT($B$2:$B$12) -> 0 | E14: =SUM(E2:E12)/COUNT($B$2:$B$12) -> -1.3229013843969866E-12 | F14: =SUM(F2:F12)/COUNT(B2:B12) -> 49089.223140495873

A0: A | B0: B | C0: C | D0: D | E0: E | F0: F | G0: G | H0: H | I0: I | J0: J | K0: K | L0: L | M0: M
1: 1 | A1: t | C1: (k=1) | D1: (k=2) | E1: (k=3) | G1: (k=1) | H1: (k=2) | I1: (k=3)
2: 2 | A2: 1 | B2: 101 | F2: =B2-$B$23 -> 34.05 | J2: =F2^2 -> 6.0025000000000137
3: 3 | A3: 2 | B3: 40 | C3: 101 | F3: =B3-$B$23 -> -26.95 | G3: =$F2 -> 34.05 | J3: =F3^2 -> 180.9025 | K3: =$F3*G3 -> 32.952500000000001
4: 4 | A4: 3 | B4: 36 | C4: 40 | D4: 101 | F4: =B4-$B$23 -> -30.95 | G4: =$F3 -> -26.95 | H4: =G3 -> 34.05 | J4: =F4^2 -> 1125.6025 | K4: =$F4*G4 -> -451.2475 | L4: =$F4*H4 -> -82.19750000000009
5: 5 | A5: 4 | B5: 116 | C5: 36 | D5: 40 | E5: 101 | F5: =B5-$B$23 -> 49.05 | G5: =$F4 -> -30.95 | H5: =G4 -> -26.95 | I5: =H4 -> 34.05 | J5: =F5^2 -> 157.5025 | K5: =$F5*G5 -> 421.05250000000001 | L5: =$F5*H5 -> -168.79750000000001 | M5: =$F5*I5 -> -30.747499999999999
6: 6 | A6: 5 | B6: 54 | C6: 116 | D6: 36 | E6: 40 | F6: =B6-$B$23 -> -12.95 | G6: =$F5 -> 49.05 | H6: =G5 -> -30.95 | I6: =H5 -> -26.95 | J6: =F6^2 -> 2.102500000000008 | K6: =$F6*G6 -> -18.197500000000002 | L6: =$F6*H6 -> -48.647500000000093 | M6: =$F6*I6 -> 19.502500000000001
7: 7 | A7: 6 | B7: 52 | C7: 54 | D7: 116 | E7: 36 | F7: =B7-$B$23 -> -14.95 | G7: =$F6 -> -12.95 | H7: =G6 -> 49.05 | I7: =H6 -> -30.95 | J7: =F7^2 -> 422.30250000000001 | K7: =$F7*G7 -> -29.797500000000053 | L7: =$F7*H7 -> 257.90249999999997 | M7: =$F7*I7 -> 689.45249999999999
8: 8 | A8: 7 | B8: 93 | C8: 52 | D8: 54 | E8: 116 | F8: =B8-$B$23 -> 26.05 | G8: =$F7 -> -14.95 | H8: =G7 -> -12.95 | I8: =H7 -> 49.05 | J8: =F8^2 -> 208.80250000000001 | K8: =$F8*G8 -> -296.94749999999999 | L8: =$F8*H8 -> 20.952500000000001 | M8: =$F8*I8 -> -181.3475
9: 9 | A9: 8 | B9: 33 | C9: 93 | D9: 52 | E9: 54 | F9: =B9-$B$23 -> -33.95 | G9: =$F8 -> 26.05 | H9: =G8 -> -14.95 | I9: =H8 -> -12.95 | J9: =F9^2 -> 29.702500000000001 | K9: =$F9*G9 -> 78.752500000000055 | L9: =$F9*H9 -> -111.9975 | M9: =$F9*I9 -> 7.9025000000000194
10: 10 | A10: 9 | B10: 77 | C10: 33 | D10: 93 | E10: 52 | F10: =B10-$B$23 -> 10.05 | G10: =$F9 -> -33.95 | H10: =G9 -> 26.05 | I10: =H9 -> -14.95 | J10: =F10^2 -> 759.00250000000005 | K10: =$F10*G10 -> -150.14750000000001 | L10: =$F10*H10 -> -398.09750000000003 | M10: =$F10*I10 -> 566.15250000000003
11: 11 | A11: 10 | B11: 64 | C11: 77 | D11: 33 | E11: 93 | F11: =B11-$B$23 -> -2.95 | G11: =$F10 -> 10.05 | H11: =G10 -> -33.95 | I11: =H10 -> 26.05 | J11: =F11^2 -> 422.30250000000001 | K11: =$F11*G11 -> 566.15250000000003 | L11: =$F11*H11 -> -111.9975 | M11: =$F11*I11 -> -296.94749999999999
12: 12 | A12: 11 | B12: 43 | C12: 64 | D12: 77 | E12: 33 | F12: =B12-$B$23 -> -23.95 | G12: =$F11 -> -2.95 | H12: =G11 -> 10.05 | I12: =H11 -> -33.95 | J12: =F12^2 -> 652.80250000000001 | K12: =$F12*G12 -> 525.05250000000001 | L12: =$F12*H12 -> 703.90250000000003 | M12: =$F12*I12 -> -139.2475
13: 13 | A13: 12 | B13: 59 | C13: 43 | D13: 64 | E13: 77 | F13: =B13-$B$23 -> -7.95 | G13: =$F12 -> -23.95 | H13: =G12 -> -2.95 | I13: =H12 -> 10.05 | J13: =F13^2 -> 809.40250000000003 | K13: =$F13*G13 -> -726.89750000000004 | L13: =$F13*H13 -> -584.64750000000004 | M13: =$F13*I13 -> -783.79750000000001
14: 14 | A14: 13 | B14: 27 | C14: 59 | D14: 43 | E14: 64 | F14: =B14-$B$23 -> -39.95 | G14: =$F13 -> -7.95 | H14: =G13 -> -23.95 | I14: =H13 -> -2.95 | J14: =F14^2 -> 238.70249999999999 | K14: =$F14*G14 -> 439.55250000000001 | L14: =$F14*H14 -> -394.7475 | M14: =$F14*I14 -> -317.4975
15: 15 | A15: 14 | B15: 94 | C15: 27 | D15: 59 | E15: 43 | F15: =B15-$B$23 -> -27.05 | G15: =$F14 -> -39.95 | H15: =G14 -> -7.95 | I15: =H14 -> -23.95 | J15: =F15^2 -> 208.80250000000001 | K15: =$F15*G15 -> 223.2525 | L15: =$F15*H15 -> 411.10250000000002 | M15: =$F15*I15 -> -369.19749999999999
16: 16 | A16: 15 | B16: 113 | C16: 94 | D16: 27 | E16: 59 | F16: =B16-$B$23 -> 46.05 | G16: =$F15 -> -27.05 | H16: =G15 -> -39.95 | I16: =H15 -> -7.95 | J16: =F16^2 -> 183.60249999999999 | K16: =$F16*G16 -> -195.79750000000001 | L16: =$F16*H16 -> -209.3475 | M16: =$F16*I16 -> -385.4975
17: 17 | A17: 16 | B17: 109 | C17: 113 | D17: 94 | E17: 27 | F17: =B17-$B$23 -> 42.05 | G17: =$F16 -> 46.05 | H17: =G16 -> -27.05 | I17: =H16 -> -39.95 | J17: =F17^2 -> 238.70249999999999 | K17: =$F17*G17 -> -209.3475 | L17: =$F17*H17 -> 223.2525 | M17: =$F17*I17 -> 238.70249999999999
18: 18 | A18: 17 | B18: 69 | C18: 109 | D18: 113 | E18: 94 | F18: =B18-$B$23 -> 2.05 | G18: =$F17 -> 42.05 | H18: =G17 -> 46.05 | I18: =H17 -> -27.05 | J18: =F18^2 -> 73.102499999999949 | K18: =$F18*G18 -> -132.0975 | L18: =$F18*H18 -> 115.85250000000001 | M18: =$F18*I18 -> -123.5475
19: 19 | A19: 18 | B19: 39 | C19: 69 | D19: 109 | E19: 113 | F19: =B19-$B$23 -> -27.95 | G19: =$F18 -> 2.05 | H19: =G18 -> 42.05 | I19: =H18 -> 46.05 | J19: =F19^2 -> 29.702500000000001 | K19: =$F19*G19 -> -46.597499999999997 | L19: =$F19*H19 -> 84.202500000000057 | M19: =$F19*I19 -> -73.847499999999997
20: 20 | A20: 19 | B20: 78 | C20: 39 | D20: 69 | E20: 109 | F20: =B20-$B$23 -> 11.05 | G20: =$F19 -> -27.95 | H20: =G19 -> 2.05 | I20: =H19 -> 42.05 | J20: =F20^2 -> 1118.9024999999999 | K20: =$F20*G20 -> 182.30250000000001 | L20: =$F20*H20 -> -285.9975 | M20: =$F20*I20 -> 516.80250000000001
21: 21 | A21: 20 | B21: 42 | C21: 78 | D21: 39 | E21: 69 | F21: =B21-$B$23 -> -24.95 | G21: =$F20 -> 11.05 | H21: =G20 -> -27.95 | I21: =H20 -> 2.05 | J21: =F21^2 -> 155.0025 | K21: =$F21*G21 -> 416.45249999999999 | L21: =$F21*H21 -> 67.852500000000006 | M21: =$F21*I21 -> -106.44750000000001
A22: sum = | B22: =SUM(B2:B21) -> 1339 | J22: =SUM(J2:J21) -> 15964.95 | K22: =SUM(K2:K21) -> 628.44749999999999 | L22: =SUM(L2:L21) -> -511.45499999999998 | M22: =SUM(M2:M21) -> -769.60749999999996
A23: mean = | B23: =SUM(B2:B21)/(COUNT(B2:B21)) -> 66.95
A24: Auto-Cov (lag 1) = -86.86 | F24: Auto-r (lag 1) = - 0.10
A25: Auto-Cov (lag 2) = - 159.69 | F25: Auto-r (lag 2) = - 0.17
A26: Auto-Cov (lag 3) = 81.95 | F26: Auto-r (lag 1) = 0.08
G27: =K$22/$J$22 -> 8.9484831872646109E-2 | J27: =L$22/$J$22 -> -7.2826233989989955E-2 | M27: =M$22/$J$22 -> -0.1095846474771997

A1: Auto-Covariance (lag k) | B1: auto-covk = | C1: = -1563.50/(20-1-1) = - 86.86
A2: Auto-Correlation (lag k) | B2: auto-rk = | C2: = -1563.50 / 15964.95 = - 0.10
A3: Using the same equations, you will obtain the result for autocovariance and autocorrelation, for the lag 2, 3 and more periods. The three autocorrelation values (-0.1, -0.17, 0.08) are close to zero, and so we know that there is no clear pattern of linear relationship. Given a real stochastic process, the autocovariance will be the covariance of the "signal" against a time-shifted version of itself. For example, I want to know "to what extent will the next measurement depend on the data point that I have just examined, or the one that was just before". Auto-covariance would be a measure of this dependence as shown in Table 1.3, with time period offsets. Auto-correlation is simply defined as a normalized form of the auto-covariance. Autocorrelation is the correlation of a data set with itself, offset by k-values. For example, autocorrelation with an offset of 5 would correlate the data set {X1, X2 ... Xn-5} is correlated with {X5, X6 ... Xn}.The autocorrelation function is the set of autocorrelations with offsets 1, 2, 3, 4 ... limit, where limit is <= n/2.
A4: Go To Top
A6: Mean Error, with n error terms. | B6: ME = | C6: =6/10 =0.6 A low value of the ME may conceal forecasting inaccuracy due to the offsetting effect of large positive and negative forecast errors. But 0.6 in this case is a fair value, given that there are no large typically forecast deviations in the series. However, its inaccuracy will become more apparent from inspection of subsequent forecast evaluation statistics.
A7: Mean Absolute Error | B7: MAE = | C7: =34/10 =3.4 3.4 is a small marginal forecast error, and forecasting has done a good justice. Even though, the MSE and MAE may overcome the 'cancellation of positive and negative errors' limitation of the ME, but in some cases they may fail to provide information on forecasting accuracy relative to the scale of the series being examined, for example when you have multivariate forecast series, F1 , F2 , F3, and more.
A8: Sum of Squared Errors | B8: SSE = | C8: =168
A9: Mean Squared Error | B9: MSE = | C9: =168/10 =16.8 Because MSE squares the errors, and thereby give opportunities to larger errors than does the MAE. This is especially true for the large squared errors (49 and 62) derived from period 2 and 3 respectively, as compared to the sum of squared errors from period 5 through to period 9 (total 14), which are even much smaller. MSE of 16.8 is considered relatively large, and U-statistic can be used to making a comparison.
A10: Standard Deviation Errors | B10: SDE = | C10: =SQRT(168/9) =4.32
A12: Percentage Error | B12: PE = | C12: and so SPE, sum of PE = - 6.5
A13: Mean Percentage Error | B13: MPE = | C13: = - 6.5/10 = - 0.65
A14: Mean Absolute Percentage Error | B14: MAPE = | C14: =106.38/10 = 10.64
A15: The objective of using standard statistics and relative statistical measures is often to look for an optimization model so as to minimize the sum or mean of squared errors (MSE, SSE). This may not be a good measure for several reasons. First, the relative measures are giving equal weight to all the time series errors as opposed to MSE, which squares the errors and thereby only emphasizing large errors. Even then, the intention of minimizing MSE to 0 in the fitting phase can always be achieved by using a polynomial of sufficiently high order or an appropriate Fourier transformation. Over-fitting a model to a data series is as good as intentionally including randomness in the generating process, or failing to identify the nonrandom data pattern. Second, because other forecasting methods use different procedures in the fitting phrase -- for example, Smoothing methods are highly dependent on the initial forecasting estimates; Decomposition methods include the trend-cycle in the fitting phase; Regression methods minimize the MSE by giving equal weight to all the collection data points; Box-Jenkins methods minimize the MSE of a non-linear optimization procedure. So, using MSE or SSE as a single criterion alone is rarely adequate. Also, in the forecasting process, using MSE as a measure of statistics accuracy can also create problems. Because MSE is an absolute measure, it does not facilitate comparison across multivariate time series and for different time intervals.
A16: Theil's U-Statistic | C16: Go To Top
A17: U-Statistic | B17: U = | C17: = SQRT(0.251/0.598) =0.65 ,which says that naive method can do an equally good forecasting than other formal methods.
A18: U-Statistical measure, although consider as a 'naive' approach to formal forecasting, does in the evaluation process demonstrate a good characteristics of giving more weight to the large errors (which MSE squared to create the disproportionate margins of large errors.) than to the small errors. Theil's U measures how well the forecasting model predicts against a ‘naive’ model. A forecast in a naive model is done by repeating the most recent value of the variable as the next forecasted value. The intervals of the U-statistic can be examined as: U = 1: The naive estimation approach is as good as the forecasting technique. U near to 0 : The more accurate the forecasts, the lower the value of the U1 statistic. The U1 statistic is bounded between 0 and 1, with values closer to 0 indicating greater forecasting accuracy. If it is equal to 0 then the forecasting model is a perfect fit. U < 1: The forecasting technique used demonstrated greater accuracy than the naive method. U > 1: there is no point in using a forecasting method, since a naive method in this case, produce better results. In a way, U-statistic provides a good comparison between the formal forecasting methods and the naive forecasting methods.
A19: Demand Forecast Accuracy | C19: Go To Top
A20: Demand Forecast Error is the deviation of the actual realized demand quantity from the forecasted quantity. The Forecast Error can be bigger than Actual or Forecast but NOT both. Error above 100% gets 0% forecast accuracy or a very inaccurate forecast. Error % = | Actual Demand - Forecast | Actual Demand Forecast Accuracy % = 1 - Error %

B2: Table 1.4 Computations of Standard and Relative Statistics on Forecast Errors
B3: A | C3: B | D3: C | E3: D | F3: E | G3: F | H3: G | I3: H | J3: I | K3: J
A4: 1 | B4: Period t | C4: Actual Data | D4: Forecast | E4: Forecast Error | F4: Absolute Error | G4: Squared Error | H4: PE | I4: APE | J4: U's numerator | K4: U's denominator
A5: 2 | B5: 1 | C5: 24 | D5: 28 | E5: -4 | F5: 4 | G5: 16 | H5: -16.666666666666664 | I5: 16.666666666666664 | J5: 16.666666666666664 | K5: 16.666666666666664
A6: 3 | B6: 2 | C6: 21 | D6: 28 | E6: -7 | F6: 7 | G6: 49 | H6: -33.333333333333329 | I6: 33.333333333333329 | J6: 33.333333333333329 | K6: 33.333333333333329
A7: 4 | B7: 3 | C7: 36 | D7: 28 | E7: 8 | F7: 8 | G7: 64 | H7: 22.222222222222221 | I7: 22.222222222222221 | J7: 22.222222222222221 | K7: 22.222222222222221
A8: 5 | B8: 4 | C8: 33 | D8: 30 | E8: 3 | F8: 3 | G8: 9 | H8: 9.0909090909090917 | I8: 9.0909090909090917 | J8: 9.0909090909090917 | K8: 9.0909090909090917
A9: 6 | B9: 5 | C9: 36 | D9: 35 | E9: 1 | F9: 1 | G9: 1 | H9: 2.7777777777777777 | I9: 2.7777777777777777 | J9: 2.7777777777777777 | K9: 2.7777777777777777
A10: 7 | B10: 6 | C10: 40 | D10: 38 | E10: 2 | F10: 2 | G10: 4 | H10: 5.00 | I10: 5.00 | J10: 0.001 | K10: 0.010
A11: 8 | B11: 7 | C11: 44 | D11: 45 | E11: -1 | F11: 1 | G11: 1 | H11: -2.2727272727272729 | I11: 2.2727272727272729 | J11: 2.2727272727272729 | K11: 2.2727272727272729
A12: 9 | B12: 8 | C12: 48 | D12: 50 | E12: -2 | F12: 2 | G12: 4 | H12: -4.1666666666666661 | I12: 4.1666666666666661 | J12: 4.1666666666666661 | K12: 4.1666666666666661
A13: 10 | B13: 9 | C13: 54 | D13: 52 | E13: 2 | F13: 2 | G13: 4 | H13: 3.7037037037037033 | I13: 3.7037037037037033 | J13: 3.7037037037037033 | K13: 3.7037037037037033
A14: 11 | B14: 10 | C14: 56 | D14: 52 | E14: 4 | F14: 4 | G14: 16 | H14: 7.1428571428571423 | I14: 7.1428571428571423 | J14: 7.1428571428571423 | K14: 7.1428571428571423
A15: Sum | E15: 6 | F15: 34 | G15: 168 | H15: -6.5019240019239923 | I15: 106.37686387686387 | J15: 106.37686387686387 | K15: 106.37686387686387
A17: ME | B17: 0.60 | E17: SDE | F17: 4.32
A18: MAE | B18: 3.40 | E18: SPE | F18: -6.50
A19: SSE | B19: 168 | E19: MPE | F19: -0.65
A20: MSE | B20: 16.8 | E20: MAPE | F20: 10.63
B21: 4.3204937989385739
A22: Theil's U | B22: -6.5019240019239923

A1: Standard Statistical Measures | B1: Go To Top

A1: Relative Statistical Measures | B1: Go To Top